APP_NAME,USER,DATE,STAR,LIKE,COMMENT,OS,TITLE,id
오딘: 발할라 라이징,조철래,2022년 2월 6일,5,0,과금을 하지않아도 편하게즐길수있는것같고 다른게임에는없는 기능들도 있어서 업하기도 조은듯,android,non-title,
오딘: 발할라 라이징,HaeYeon Nam,2022년 2월 7일,5,0,서브퀘스트좀 깨주게해줘여ㅡㅡ 아니 빌란트를 지붕위에올려놓고 말하기누르면자꾸튕기잖아여 퀘스트를깨라는건지 말라는건지 알수가없네요ㅡ,android,non-title,
오딘: 발할라 라이징,이해란,2022년 2월 1일,1,1,오후 5시55분 카톡으로 문자와서 접속하고 했는데 아무것도 안주네요 뻥치시는건가요,android,non-title,
오딘: 발할라 라이징,김지현,2022년 2월 12일,1,0,상점에서 전리품정리 버튼만 누르면 그냥 팔아지는데 두번이나 그러니 짜증나네요 전리품정리버튼 눌러도 예 아니오 떠야하는거 아닌가요? 메인 캐릭터까지 한번 잘못눌렀다고 싹다팔리니 어이가없네요,android,non-title,
오딘: 발할라 라이징,양승민,2022년 1월 26일,1,12,업데이트만하면 구글에 업데이트가 뜨는게 아니라 플레이버튼만 계속 뜨고 플레이버튼 누르고 다시 업데이트만 반복.. 어중간한 과금투자로는 힘든 게임 극악의 당첨확률의 아이템때문인듯. 몇달을 하면서 희귀이상 나온적이 없음.,android,non-title,
오딘: 발할라 라이징,남자박시현,2021년 12월 10일,1,352,꼭 끝까지 정확히 읽어보시길바랍니다. 11월22일부터 로그인 불가현상으로 피해본유저입니다 이제 한주동안 문의 답장도 없네요 분명 로그인 불가능 현상에대해 자세하게 설명해드렸고 하라는데로 11월22일부터 모든걸 해드렸지만 오딘측에서도 어쩌지도 못하고 아무것도 해주지 못하면서 그럼 게임을 못하니 환불처리를 요구했더니 그마저도 해주지않고 그저 답장을 해주지않는걸로 마무리 지엇나요? 정말 무책임하단 생각 안하세요? 계정도 보내드렸고 아무런 조치를 해줄수없다면 환불해주는게 정상 아닌가요? 전 제 지갑에 돈을 가져가서 돌려주지않는것과 같은기분...전체 리뷰,android,non-title,
오딘: 발할라 라이징,TheMen이남자,2021년 12월 31일,1,157,진짜 돈쓰면 바보인 게임. 라인에서 통제해서 돈써봐야 제자리인 게임. 돈쓰면 머하나? 통제해서 사냥도 제대로 못하고 보스도 못잡고. 그냥 무과금 즐기시길 권장. 돈쓰면 빙시. 라인통제에 지감도 제대로 사냥못하고 거점지배자 구경도 못하고 전설? 좋은템? 있어봐야 사냥할곳도 없고 그냥 매일 필드자사뿐. 오딘게임은 피케이 시스템이 있어서 더이상 발전 못하는게임. 리니지가 피케이 있다고 따라한거같은데 게임이 다른데 비슷한설정을 하면 먹히나?,android,non-title,
오딘: 발할라 라이징,이덕순,2022년 1월 29일,1,0,본인 인증을 신용카드로 하는거 첨 보네 신용카드 없는사람은 갬 하지말란 말이요 카드회사랑 사바사바해서 실적올리려는거요 신용카드 싫어하는 사람은 체크(현금카드)카드로도 가능하게 하고 카드인증도 폭 넓게 해야지 몇군데지정해서 하라고하니 실적올리려는 소리나듣죠 국민청원 올려야 겠어요 신용카드 없어서 오딘게임 못 하고 있습니다 게임하고싶어요 별일 다보네요,android,non-title,
