APP_IMG,APP_NAME,USER,DATE,STAR,LIKE,COMMENT,OS
https://play-lh.googleusercontent.com/w8xd-eZ2_G9YnS4q6ITfoCzWOnXTE2gNqje5j8j_GQVAB6l7Mnr20mfCwi92dLa7cQ=s180-rw,"라프텔 - 애니 감상 및 취향저격 추천, 스트리밍",이선민,2022-03-19 00:00:00+09:00,2,0,프리미엄인데도 돈 내고 시청해야하는 만화들은 뭔가요? 이럼 결제하는 이유가 없지않나요?,android
https://play-lh.googleusercontent.com/w8xd-eZ2_G9YnS4q6ITfoCzWOnXTE2gNqje5j8j_GQVAB6l7Mnr20mfCwi92dLa7cQ=s180-rw,"라프텔 - 애니 감상 및 취향저격 추천, 스트리밍",뇽뇽,2022-03-19 00:00:00+09:00,1,0,저번에 앱 들어갈때마다 튕겨서 삭제 후 재설치 했는데 이번엔 카카오로 로그인하기 누르면 무한 로딩되네요... 이용을 하라는건지 말라는건지,android
https://play-lh.googleusercontent.com/w8xd-eZ2_G9YnS4q6ITfoCzWOnXTE2gNqje5j8j_GQVAB6l7Mnr20mfCwi92dLa7cQ=s180-rw,"라프텔 - 애니 감상 및 취향저격 추천, 스트리밍",루시드TV,2022-03-19 00:00:00+09:00,5,0,라프텔 앱 잘쓰고 있는데 광고가 너무많아요 그냥 시작하기전이나 다 본후에 광고가 나오는거면 괜찮은데 중간중간 나와서 흐름을 끈어요 그래도 그것만 빼면 애니 보기 너무좋고 편합니다 광고를 시작전이나 후에 넣어주시면 감사하겠습니다,android
https://play-lh.googleusercontent.com/w8xd-eZ2_G9YnS4q6ITfoCzWOnXTE2gNqje5j8j_GQVAB6l7Mnr20mfCwi92dLa7cQ=s180-rw,"라프텔 - 애니 감상 및 취향저격 추천, 스트리밍",syee bar,2022-03-19 00:00:00+09:00,4,0,일괄 다운로드가 가능했으면 좋겠어요,android
https://play-lh.googleusercontent.com/w8xd-eZ2_G9YnS4q6ITfoCzWOnXTE2gNqje5j8j_GQVAB6l7Mnr20mfCwi92dLa7cQ=s180-rw,"라프텔 - 애니 감상 및 취향저격 추천, 스트리밍",동그라미,2022-03-19 00:00:00+09:00,1,0,맴버십 가입했는데도 불구하고 5000원이나 더 내서 봐야하는 영상들이 정말 많아요,android
https://play-lh.googleusercontent.com/w8xd-eZ2_G9YnS4q6ITfoCzWOnXTE2gNqje5j8j_GQVAB6l7Mnr20mfCwi92dLa7cQ=s180-rw,"라프텔 - 애니 감상 및 취향저격 추천, 스트리밍",Hyochan Kim,2022-03-19 00:00:00+09:00,1,0,업데이트 이후로 실행이 안되는데 이게 어찌된걸까요? 실행이 돼야 애니를 보던지 말던지 하지요^^,android
https://play-lh.googleusercontent.com/w8xd-eZ2_G9YnS4q6ITfoCzWOnXTE2gNqje5j8j_GQVAB6l7Mnr20mfCwi92dLa7cQ=s180-rw,"라프텔 - 애니 감상 및 취향저격 추천, 스트리밍",ᄋᄋᄋ,2022-03-19 00:00:00+09:00,2,3,"1. 요즘 고화질로 바꾸면 렉이 걸립니다. (와이파이 멀쩡한 상태) 2. 노트북으로 보는데 영상이 갑자기 멈춰요. (와이파이 멀쩡한 상태) 3. 폰으로 라프텔을 들어갈 때마다 업데이트 중이라고 하는데 로딩이 빠른 것도 아니고요. 전 업데이트 한번 하면 끝날 줄 알았는데 들어갈 때마다 계속하니 의문이 들고 짜증이 나네요.. 고쳐주세요. 9,900원이 땅 파면 나오는 돈도 아니고",android
https://play-lh.googleusercontent.com/w8xd-eZ2_G9YnS4q6ITfoCzWOnXTE2gNqje5j8j_GQVAB6l7Mnr20mfCwi92dLa7cQ=s180-rw,"라프텔 - 애니 감상 및 취향저격 추천, 스트리밍",치킨 세상,2022-03-19 00:00:00+09:00,2,0,아무리 무료라지만 광고 좀 적당히 하셔야죠.. 12분 짜리에 4개가 말이 됩니까?근데 60초? 돈을 너무 좋아하시는 거 아닌가요,android
https://play-lh.googleusercontent.com/w8xd-eZ2_G9YnS4q6ITfoCzWOnXTE2gNqje5j8j_GQVAB6l7Mnr20mfCwi92dLa7cQ=s180-rw,"라프텔 - 애니 감상 및 취향저격 추천, 스트리밍",Binah,2022-03-19 00:00:00+09:00,5,0,좋아요,android
https://play-lh.googleusercontent.com/w8xd-eZ2_G9YnS4q6ITfoCzWOnXTE2gNqje5j8j_GQVAB6l7Mnr20mfCwi92dLa7cQ=s180-rw,"라프텔 - 애니 감상 및 취향저격 추천, 스트리밍",Hyunwook Son,2022-03-18 00:00:00+09:00,4,6,판권 왔다갔다하고 부분 유료인건 어느정도 인정합니다. 근데 제 기기 문제인지 무슨 문제인지 모르겠는데 좀 더 높은 화질을 지원해줬음 합니다. 전 탭으로 보는데 극장판같은 고퀄애니 볼때 화질이 좀 별로네요. 요즘 시대에 1080p까지만 지원하는 건 아닌것같습니다. 그래도 보기도 편하고 잘쓰고 있습니다. 계속 발전해주세요.,android
https://play-lh.googleusercontent.com/w8xd-eZ2_G9YnS4q6ITfoCzWOnXTE2gNqje5j8j_GQVAB6l7Mnr20mfCwi92dLa7cQ=s180-rw,"라프텔 - 애니 감상 및 취향저격 추천, 스트리밍",초보입니당,2022-03-18 00:00:00+09:00,5,0,좋네여.. 광고빼곤,android
https://play-lh.googleusercontent.com/w8xd-eZ2_G9YnS4q6ITfoCzWOnXTE2gNqje5j8j_GQVAB6l7Mnr20mfCwi92dLa7cQ=s180-rw,"라프텔 - 애니 감상 및 취향저격 추천, 스트리밍",맬로디몬스터,2022-03-18 00:00:00+09:00,1,2,아니 구매했는대 외 보질못하냐 일안하새요?,android
https://play-lh.googleusercontent.com/w8xd-eZ2_G9YnS4q6ITfoCzWOnXTE2gNqje5j8j_GQVAB6l7Mnr20mfCwi92dLa7cQ=s180-rw,"라프텔 - 애니 감상 및 취향저격 추천, 스트리밍",Sen,2022-03-18 00:00:00+09:00,1,1,카카오로 로그인하려고하면 무한로딩떠요,android
https://play-lh.googleusercontent.com/w8xd-eZ2_G9YnS4q6ITfoCzWOnXTE2gNqje5j8j_GQVAB6l7Mnr20mfCwi92dLa7cQ=s180-rw,"라프텔 - 애니 감상 및 취향저격 추천, 스트리밍",금민서,2022-03-18 00:00:00+09:00,5,26,신규 애니도 쉽개 볼수 있고 무료로도 볼수있어서 정말 유용하게 잘 쓰고 있는 앱인데요. 제가 다른이에게 아이디를 알려준적도 빌려준적도 없는데 자꾸 동시재생차단이라고 떠서요. 혹시 해커거 아닐까라는 생각에 비밀번호를 바꿨는데도 자꾸 떠요. 자꾸 이러니까 시스템 오류인것 같아서요. 만약 정말 시스템 오류라면 보안해주셨으면 해요. 자꾸 뜨니까 불편하고 불쾌해요.,android
https://play-lh.googleusercontent.com/w8xd-eZ2_G9YnS4q6ITfoCzWOnXTE2gNqje5j8j_GQVAB6l7Mnr20mfCwi92dLa7cQ=s180-rw,"라프텔 - 애니 감상 및 취향저격 추천, 스트리밍",익명,2022-03-18 00:00:00+09:00,1,49,"광고가 보다가도 계속 끊기고 튕겨져서 다시 들어가면 처음붙터 광고를 다시보게하고, 광고를 보고 영상를 보다가도 갑자기 다른 기기에서 접속하였다면서 자동으로 꺼집니다. 앱 설명란에는 동시접속이 최대 4기기 까지 가능하다고 하던데, 저 혼자 쓰는 계정인데도 다른 기기에서 접속했다고 꺼지는건 일부로 광고를 더 많이 보게 하려고 하는 것 같아서 매우 불쾌하네요. 영상을 보려면 광고를 보고, 중간중간에도 계속 광고릉 띄우지만 그정도는 넘어갈 수 있습니다. 제 기기에 이상이 있는 것 도 아니고, 다른 앱들은 잘만 실행되는데 라프텔만 렉이 매우...전체 리뷰",android
https://play-lh.googleusercontent.com/w8xd-eZ2_G9YnS4q6ITfoCzWOnXTE2gNqje5j8j_GQVAB6l7Mnr20mfCwi92dLa7cQ=s180-rw,"라프텔 - 애니 감상 및 취향저격 추천, 스트리밍",이이경민,2022-03-18 00:00:00+09:00,3,0,애니가 많이 있어서 좋은데..... 광고가 너무 많이 있어서........,android
https://play-lh.googleusercontent.com/w8xd-eZ2_G9YnS4q6ITfoCzWOnXTE2gNqje5j8j_GQVAB6l7Mnr20mfCwi92dLa7cQ=s180-rw,"라프텔 - 애니 감상 및 취향저격 추천, 스트리밍",샛쿙?,2022-03-18 00:00:00+09:00,1,1,갑자기 계속 업데이트 중입니다라고 뜨면서 다 되면 튕기거든요..? 저만 이런가요?,android
https://play-lh.googleusercontent.com/w8xd-eZ2_G9YnS4q6ITfoCzWOnXTE2gNqje5j8j_GQVAB6l7Mnr20mfCwi92dLa7cQ=s180-rw,"라프텔 - 애니 감상 및 취향저격 추천, 스트리밍",드넓은우주,2022-03-18 00:00:00+09:00,5,1,포인트를 충전하는데 체크카드로 결제할려고 하는데 ISP에는 카드가 등록이되어 있는데도 결제하는곳에는 등록된카드가 안나오고 결제 진행이 안됩니다 다른 결제수단은 되는데 요것만 안되니 좀 그렇습니다,android
https://play-lh.googleusercontent.com/w8xd-eZ2_G9YnS4q6ITfoCzWOnXTE2gNqje5j8j_GQVAB6l7Mnr20mfCwi92dLa7cQ=s180-rw,"라프텔 - 애니 감상 및 취향저격 추천, 스트리밍",Co Co,2022-03-18 00:00:00+09:00,1,1,이거 쓰지 마세요 ㅋㅋㅋ 프리미엄 멤버십 구독해도 따로 돈 내고 봐야 하는 애니가 수두룩빽빽입니다 이럴 거면 결제 왜 함 ㅋㅋ 스탠다드까지는 그럴수 있겠는데 넷플이나 왓챠보다 비싸게 주고 쓰는 프리미엄 사용자까진 보게 해 줘야지 싸가지 없어서 구독 해지하고 앱삭함 ㅇㅇ 걍 차라리 애니를 안 볼게요... 정작 볼만한 작품은 쥐뿔도 없고 뭐 좀 괜찮은 거 보려면 다 별도 대여비까지 내라는데 뭐 하러 씀? 인기많은 애니는 타 어플에도 많아요 라프텔 쓸 이유가 없지 이러면 ㅋㅋ,android
https://play-lh.googleusercontent.com/w8xd-eZ2_G9YnS4q6ITfoCzWOnXTE2gNqje5j8j_GQVAB6l7Mnr20mfCwi92dLa7cQ=s180-rw,"라프텔 - 애니 감상 및 취향저격 추천, 스트리밍",홍챠,2022-03-18 00:00:00+09:00,3,16,"라프텔 1년 안된 6개월 유저입니다. 라프텔에서는 재밌는 영상들이 아주 많습니다. 그런데 한 가지 불편한게 있습니다. 몰입하려는 순간 광고가 너무 많이 나옵니다. 광고가 10초 또는 5초처럼 짧은 광고는 괜찮치만, 20초나 30초 같은 긴 광고는 기다리기가 너무 어렵습니다. 30초 까짓거 기다리면 되지만, 빨리 보고 싶은 성급한 마음이 앞섭니다. 광고가 너무 자주 나오고, 좀 길다는 것 빼곤 렉,버그 등등 문제가 없습니다. 제 바램은 광고가 자주 나오더라도 짧은 광고이거나, 광고가 길지만 자주 안 나오는 광고가 젤 좋은 것 같습니다...전체 리뷰",android
https://play-lh.googleusercontent.com/w8xd-eZ2_G9YnS4q6ITfoCzWOnXTE2gNqje5j8j_GQVAB6l7Mnr20mfCwi92dLa7cQ=s180-rw,"라프텔 - 애니 감상 및 취향저격 추천, 스트리밍",ISFP,2022-03-18 00:00:00+09:00,1,0,아니 15일 무료라면서 갑자기 결제하라뇨.. 고화질로 보고 싶으면 결제하고 보라는건가요? 15일 무료라고 해서 눌렀는데 결제하라니깐 어이없네요 보고싶은 애니는 있지만 결제까지 해서 고화질로 볼꺼같으면 그냥 유튜브로 보는게 훨씬 나을꺼 같네요 진짜 결제 하라는거에서 어이없어서 정말 유튜브에서 고화질로 보는거 더 빠르고 좋음,android
https://play-lh.googleusercontent.com/w8xd-eZ2_G9YnS4q6ITfoCzWOnXTE2gNqje5j8j_GQVAB6l7Mnr20mfCwi92dLa7cQ=s180-rw,"라프텔 - 애니 감상 및 취향저격 추천, 스트리밍",스카북,2022-03-18 00:00:00+09:00,4,0,애니 좋아! 무료야!,android
https://play-lh.googleusercontent.com/w8xd-eZ2_G9YnS4q6ITfoCzWOnXTE2gNqje5j8j_GQVAB6l7Mnr20mfCwi92dLa7cQ=s180-rw,"라프텔 - 애니 감상 및 취향저격 추천, 스트리밍",도막사라무,2022-03-18 00:00:00+09:00,3,0,저기요 드래곤볼z3기더빙 좀,android
https://play-lh.googleusercontent.com/w8xd-eZ2_G9YnS4q6ITfoCzWOnXTE2gNqje5j8j_GQVAB6l7Mnr20mfCwi92dLa7cQ=s180-rw,"라프텔 - 애니 감상 및 취향저격 추천, 스트리밍",권예원,2022-03-18 00:00:00+09:00,1,11,"맨날 판권만료되고, 타 플랫폼 오리지널 제외해도 거의 겹치거나 없습니다 멤버쉽 끊어도 몇 작품은 대여해야되고.. 대체 멤버쉽을 왜 끊는건지 모르겠습니다 굳이 비싸게 라프텔말고 타 플랫폼 구독하는게 볼것도 많고 훨 나은듯합니다 라프텔을 깎아내리거나 영업을 방해할 악의는 없습니다",android
https://play-lh.googleusercontent.com/w8xd-eZ2_G9YnS4q6ITfoCzWOnXTE2gNqje5j8j_GQVAB6l7Mnr20mfCwi92dLa7cQ=s180-rw,"라프텔 - 애니 감상 및 취향저격 추천, 스트리밍",김문석,2022-03-18 00:00:00+09:00,5,0,너무좋아요,android
https://play-lh.googleusercontent.com/w8xd-eZ2_G9YnS4q6ITfoCzWOnXTE2gNqje5j8j_GQVAB6l7Mnr20mfCwi92dLa7cQ=s180-rw,"라프텔 - 애니 감상 및 취향저격 추천, 스트리밍",이준,2022-03-18 00:00:00+09:00,4,0,다운로드가 잘 안되서 불편;;;,android
https://play-lh.googleusercontent.com/w8xd-eZ2_G9YnS4q6ITfoCzWOnXTE2gNqje5j8j_GQVAB6l7Mnr20mfCwi92dLa7cQ=s180-rw,"라프텔 - 애니 감상 및 취향저격 추천, 스트리밍",SIYEON . PART,2022-03-17 00:00:00+09:00,5,0,생각보다 재밌고 좋습니다. 의외로 저는 좋게 사용하고 있네요,android
https://play-lh.googleusercontent.com/w8xd-eZ2_G9YnS4q6ITfoCzWOnXTE2gNqje5j8j_GQVAB6l7Mnr20mfCwi92dLa7cQ=s180-rw,"라프텔 - 애니 감상 및 취향저격 추천, 스트리밍",캐리캐리,2022-03-17 00:00:00+09:00,1,0,정기권결제해서 쓰는데 앱 삭제했다가 다시깔아서 카톡 아이디로 다시 로그인하려는데 화면 멈춰서 진행 안됨 돈내서 결제해놓고 결국 이용못하고있는 상황 예전에도 카톡 로그인 멈춰있는 로그인 문제 있었는데 그땐 일반 아이디 로그인창 갔다가 돌아가서 카톡아이디 로그인화면 진입하면 됐는데 지금은 그것도 안됨 약 1년 넘게 이용했었지만 이젠 맘에 안드는게 한두개가 아니라서 앞으로 여기 다시 이용안할꺼임 개선하고 발전할 생각이 없는듯 타이머 기능도 없고 타이머가 없을거면 한편 시청 완료후 자동 재생기능을 꺼놨으면 폰 배터리라도 소모안되게 폰 화면...전체 리뷰,android
https://play-lh.googleusercontent.com/w8xd-eZ2_G9YnS4q6ITfoCzWOnXTE2gNqje5j8j_GQVAB6l7Mnr20mfCwi92dLa7cQ=s180-rw,"라프텔 - 애니 감상 및 취향저격 추천, 스트리밍",김영헌,2022-03-17 00:00:00+09:00,4,0,볼수있는 작품이 많아서 좋아요,android
https://play-lh.googleusercontent.com/w8xd-eZ2_G9YnS4q6ITfoCzWOnXTE2gNqje5j8j_GQVAB6l7Mnr20mfCwi92dLa7cQ=s180-rw,"라프텔 - 애니 감상 및 취향저격 추천, 스트리밍",Cannon TNT,2022-03-17 00:00:00+09:00,5,0,결제를 토스랑 연동시키면 안되나요? 너무 번거롭네요. 그것 빼면 다 좋은듯,android
https://play-lh.googleusercontent.com/w8xd-eZ2_G9YnS4q6ITfoCzWOnXTE2gNqje5j8j_GQVAB6l7Mnr20mfCwi92dLa7cQ=s180-rw,"라프텔 - 애니 감상 및 취향저격 추천, 스트리밍",김예나,2022-03-17 00:00:00+09:00,1,0,별1개 주기도 싫고 귀칼 .내가인기있어서 어쩌잔거야 볼려고했는데 못봐 돈내놔래 코난보려는데 돈 아진짜 다신은안해😡,android
https://play-lh.googleusercontent.com/w8xd-eZ2_G9YnS4q6ITfoCzWOnXTE2gNqje5j8j_GQVAB6l7Mnr20mfCwi92dLa7cQ=s180-rw,"라프텔 - 애니 감상 및 취향저격 추천, 스트리밍",Syarose,2022-03-17 00:00:00+09:00,5,0,오랜기간 너무 잘 쓰고 있습니다. 불편한 점은 << 5초 이동 >> 추가 부탁드립니다. 0.8배속 or 0.7배속 추가 부탁드립니다.,android
https://play-lh.googleusercontent.com/w8xd-eZ2_G9YnS4q6ITfoCzWOnXTE2gNqje5j8j_GQVAB6l7Mnr20mfCwi92dLa7cQ=s180-rw,"라프텔 - 애니 감상 및 취향저격 추천, 스트리밍",윤희선,2022-03-17 00:00:00+09:00,4,0,"습..솔직히 말해선5점을주기 싶긴헌디.. 몇개가 유료네요..ㅠㅜ..그래도 마법사의 인생이 볼만해서,별4개!",android
https://play-lh.googleusercontent.com/w8xd-eZ2_G9YnS4q6ITfoCzWOnXTE2gNqje5j8j_GQVAB6l7Mnr20mfCwi92dLa7cQ=s180-rw,"라프텔 - 애니 감상 및 취향저격 추천, 스트리밍",박성태,2022-03-17 00:00:00+09:00,5,0,다있는건아니지만 만족,android
https://play-lh.googleusercontent.com/w8xd-eZ2_G9YnS4q6ITfoCzWOnXTE2gNqje5j8j_GQVAB6l7Mnr20mfCwi92dLa7cQ=s180-rw,"라프텔 - 애니 감상 및 취향저격 추천, 스트리밍",성유진,2022-03-16 00:00:00+09:00,3,0,보고싶다 목록에 애니 70개?가량을 담아놨는데 너무 많은건지 스크롤이 넘어가지를 않아요 ㅜㅜ 원래이런건가요? 한 화면 분량만큼만 보여지는데..,android
https://play-lh.googleusercontent.com/w8xd-eZ2_G9YnS4q6ITfoCzWOnXTE2gNqje5j8j_GQVAB6l7Mnr20mfCwi92dLa7cQ=s180-rw,"라프텔 - 애니 감상 및 취향저격 추천, 스트리밍",최광옥,2022-03-16 00:00:00+09:00,5,0,젛아요,android
https://play-lh.googleusercontent.com/w8xd-eZ2_G9YnS4q6ITfoCzWOnXTE2gNqje5j8j_GQVAB6l7Mnr20mfCwi92dLa7cQ=s180-rw,"라프텔 - 애니 감상 및 취향저격 추천, 스트리밍",물빛꽃.,2022-03-16 00:00:00+09:00,1,1,1월에 설치했을때는 정상 작동이 되었는데 업데이트가 잘못된건지 어느순간부터 휴대폰에서 앱실행 자체가 안됩니다... 재설치를 해봐도 똑같고.... 앱 좀 고쳐주세요.....,android
https://play-lh.googleusercontent.com/w8xd-eZ2_G9YnS4q6ITfoCzWOnXTE2gNqje5j8j_GQVAB6l7Mnr20mfCwi92dLa7cQ=s180-rw,"라프텔 - 애니 감상 및 취향저격 추천, 스트리밍",SoDa,2022-03-16 00:00:00+09:00,1,0,애니 잘보고있엇는데 오늘 하루종일 앱튕겨서 접속이 안돼요... ㅜㅜ,android
https://play-lh.googleusercontent.com/w8xd-eZ2_G9YnS4q6ITfoCzWOnXTE2gNqje5j8j_GQVAB6l7Mnr20mfCwi92dLa7cQ=s180-rw,"라프텔 - 애니 감상 및 취향저격 추천, 스트리밍",WolYeong Han,2022-03-16 00:00:00+09:00,4,0,최적화 좀 부탁드립니다. 편하고 참 좋은데 화면 로딩도 길고 다운할시 하나하나씩 안하면 다운 안되는게 생기더라구요. 부탁드립니다!!,android
https://play-lh.googleusercontent.com/w8xd-eZ2_G9YnS4q6ITfoCzWOnXTE2gNqje5j8j_GQVAB6l7Mnr20mfCwi92dLa7cQ=s180-rw,"라프텔 - 애니 감상 및 취향저격 추천, 스트리밍",102 04배윤빈,2022-03-16 00:00:00+09:00,4,0,레이디버그2도 나왔으면 좋겠어용 헿,android
https://play-lh.googleusercontent.com/w8xd-eZ2_G9YnS4q6ITfoCzWOnXTE2gNqje5j8j_GQVAB6l7Mnr20mfCwi92dLa7cQ=s180-rw,"라프텔 - 애니 감상 및 취향저격 추천, 스트리밍",이준기이준기,2022-03-16 00:00:00+09:00,5,0,이준기♥전소민,android
https://play-lh.googleusercontent.com/w8xd-eZ2_G9YnS4q6ITfoCzWOnXTE2gNqje5j8j_GQVAB6l7Mnr20mfCwi92dLa7cQ=s180-rw,"라프텔 - 애니 감상 및 취향저격 추천, 스트리밍",박기열,2022-03-15 00:00:00+09:00,3,0,좋아요,android
https://play-lh.googleusercontent.com/w8xd-eZ2_G9YnS4q6ITfoCzWOnXTE2gNqje5j8j_GQVAB6l7Mnr20mfCwi92dLa7cQ=s180-rw,"라프텔 - 애니 감상 및 취향저격 추천, 스트리밍",동동,2022-03-15 00:00:00+09:00,1,0,타카기양 3기 6화 완성본 언제 올려주시나요? 2달이 지났는데,android
https://play-lh.googleusercontent.com/w8xd-eZ2_G9YnS4q6ITfoCzWOnXTE2gNqje5j8j_GQVAB6l7Mnr20mfCwi92dLa7cQ=s180-rw,"라프텔 - 애니 감상 및 취향저격 추천, 스트리밍",보노보노,2022-03-15 00:00:00+09:00,5,0,텅장이 되어간다....제발 이번 분기만 버텨줘 제발...ㅠ,android
https://play-lh.googleusercontent.com/w8xd-eZ2_G9YnS4q6ITfoCzWOnXTE2gNqje5j8j_GQVAB6l7Mnr20mfCwi92dLa7cQ=s180-rw,"라프텔 - 애니 감상 및 취향저격 추천, 스트리밍",가볼테야,2022-03-15 00:00:00+09:00,3,0,씹덕에게 정말 좋은 플랫폼이기는 한데ㅠㅠ 은근히 판권 만료인 애니가 많고... 월정액은 월정액대로 나가고 막상 보고싶은건 대여나 소장으로 추가금 나가고... 이중으로 돈 쓰게 만들어서 살짝 애매하네요,android
https://play-lh.googleusercontent.com/w8xd-eZ2_G9YnS4q6ITfoCzWOnXTE2gNqje5j8j_GQVAB6l7Mnr20mfCwi92dLa7cQ=s180-rw,"라프텔 - 애니 감상 및 취향저격 추천, 스트리밍",타로점사,2022-03-15 00:00:00+09:00,2,0,없는게 많네요,android
https://play-lh.googleusercontent.com/w8xd-eZ2_G9YnS4q6ITfoCzWOnXTE2gNqje5j8j_GQVAB6l7Mnr20mfCwi92dLa7cQ=s180-rw,"라프텔 - 애니 감상 및 취향저격 추천, 스트리밍",남준서,2022-03-15 00:00:00+09:00,1,1,무슨 광고가 1편보는데 4~5번 나오나요? 그렇다고 광고가 짧은 것도 아니고 30초나 60초정도의 광고만 나오고... 차라리 한 번에 1편 광고가 전부 나오는게 낫겠네요,android
https://play-lh.googleusercontent.com/w8xd-eZ2_G9YnS4q6ITfoCzWOnXTE2gNqje5j8j_GQVAB6l7Mnr20mfCwi92dLa7cQ=s180-rw,"라프텔 - 애니 감상 및 취향저격 추천, 스트리밍",차유나,2022-03-15 00:00:00+09:00,4,0,대부분 다 무료로 볼 수 있는 거라 좋음. 광고가 애니 한 편당 3~4개 정도 나오는데 그 정도는 이해함. 근데 가끔가다 광고가 너무 많아서 성나셨죠? 이러면서 혈자리 알려주는 1분짜리 광고 나오면 그만큼 짜증 나는 게 없음. 그런 거 알려주지 말고 걍 15초짜리로 광고 너무 많아서 죄송합니다ㅠ 이러기만 해도 바로 킹받는 거 다 사라지는데 굳이 1분짜리를 꾸역꾸역 넣어서 개킹받음. 그것빼고는 좋음.,android
https://play-lh.googleusercontent.com/w8xd-eZ2_G9YnS4q6ITfoCzWOnXTE2gNqje5j8j_GQVAB6l7Mnr20mfCwi92dLa7cQ=s180-rw,"라프텔 - 애니 감상 및 취향저격 추천, 스트리밍",배민찬,2022-03-15 00:00:00+09:00,3,0,좋긴 좋은데 판권 만료된 애니들이 좀많아서 아쉽네요,android
https://play-lh.googleusercontent.com/w8xd-eZ2_G9YnS4q6ITfoCzWOnXTE2gNqje5j8j_GQVAB6l7Mnr20mfCwi92dLa7cQ=s180-rw,"라프텔 - 애니 감상 및 취향저격 추천, 스트리밍",최수아,2022-03-15 00:00:00+09:00,1,0,오랜만에 다시 깔아봤는데 앱이중지 된다면서 안드러 가지네요 앱자체는 좋은데 이것좀 고쳐주세요 몇번을 지웠다깔고 이것저것 해봤는데 안됌;;,android
https://play-lh.googleusercontent.com/w8xd-eZ2_G9YnS4q6ITfoCzWOnXTE2gNqje5j8j_GQVAB6l7Mnr20mfCwi92dLa7cQ=s180-rw,"라프텔 - 애니 감상 및 취향저격 추천, 스트리밍",인간,2022-03-14 00:00:00+09:00,4,1,다 좋은데 시청자 성비 표시 다시 해주시면 안될까요... 그걸로 취향인 작품 아닌 작품 쉽게 걸러냈는데(작품이 여성향인지 남성향인지 구분이 쉬워집니다) 안 보이니까 너무 불편해졌어요,android
https://play-lh.googleusercontent.com/w8xd-eZ2_G9YnS4q6ITfoCzWOnXTE2gNqje5j8j_GQVAB6l7Mnr20mfCwi92dLa7cQ=s180-rw,"라프텔 - 애니 감상 및 취향저격 추천, 스트리밍",Ho Soon,2022-03-14 00:00:00+09:00,5,0,라프텔 어플 디자인 바꾸면 훨씬 더 인기 많아질 것 같아요 지금은 약간 불법 애니 보는 어플 느낌이에요..,android
https://play-lh.googleusercontent.com/w8xd-eZ2_G9YnS4q6ITfoCzWOnXTE2gNqje5j8j_GQVAB6l7Mnr20mfCwi92dLa7cQ=s180-rw,"라프텔 - 애니 감상 및 취향저격 추천, 스트리밍",홍길동,2022-03-14 00:00:00+09:00,5,0,굳,android
https://play-lh.googleusercontent.com/w8xd-eZ2_G9YnS4q6ITfoCzWOnXTE2gNqje5j8j_GQVAB6l7Mnr20mfCwi92dLa7cQ=s180-rw,"라프텔 - 애니 감상 및 취향저격 추천, 스트리밍",김진욱,2022-03-14 00:00:00+09:00,5,0,재미있어요 내가 보고 싶은 애니는 거의 다 있어서 좋고요,android
https://play-lh.googleusercontent.com/w8xd-eZ2_G9YnS4q6ITfoCzWOnXTE2gNqje5j8j_GQVAB6l7Mnr20mfCwi92dLa7cQ=s180-rw,"라프텔 - 애니 감상 및 취향저격 추천, 스트리밍",손훈국,2022-03-14 00:00:00+09:00,4,0,"그 좋긴한데요 광고가 4분에 한 10번씩 나와서요...,광고좀 줄여주시면 별 5개 드릴수 있을것 같습니다",android
https://play-lh.googleusercontent.com/w8xd-eZ2_G9YnS4q6ITfoCzWOnXTE2gNqje5j8j_GQVAB6l7Mnr20mfCwi92dLa7cQ=s180-rw,"라프텔 - 애니 감상 및 취향저격 추천, 스트리밍",유린_11,2022-03-14 00:00:00+09:00,4,0,저는 라프텔 멤버십같은거?라고나 할까 때문에 아쉽습니다. 나히아가 무슨 애니인지 궁금해서 라프텔로 보려했더니 멤버십 때문에 안된다는..그게 좀 아쉽습니다. 너튜브에도 찾는것도 걍 싹다 리뷰밖에 안보이고..어떻게 찾아봐도 리뷰가 싹 보이는데..라프텔은 어떻게 찾았을까 라는 생각하면서 대단하다는 생각이 들었습니다. 뭐..광고도 60초 짜리는 좀 줄여주고..광고도 줄였음 좋겠네요. 광고보고 애니보는건 제 기준으론 득일수도 있는데..문제되면 수정하거나 리뷰를 삭제하겠습니다.,android
https://play-lh.googleusercontent.com/w8xd-eZ2_G9YnS4q6ITfoCzWOnXTE2gNqje5j8j_GQVAB6l7Mnr20mfCwi92dLa7cQ=s180-rw,"라프텔 - 애니 감상 및 취향저격 추천, 스트리밍",정수현,2022-03-14 00:00:00+09:00,3,0,컴퓨터나 노트북으로 볼 때 카카오로 로그인이 되는데 핸드폰 앱으로는 계속 로딩만 되고 로그인이 안돼요ㅜㅡㅜ,android
https://play-lh.googleusercontent.com/w8xd-eZ2_G9YnS4q6ITfoCzWOnXTE2gNqje5j8j_GQVAB6l7Mnr20mfCwi92dLa7cQ=s180-rw,"라프텔 - 애니 감상 및 취향저격 추천, 스트리밍",양세빈,2022-03-14 00:00:00+09:00,5,0,라프텔 👍,android
https://play-lh.googleusercontent.com/w8xd-eZ2_G9YnS4q6ITfoCzWOnXTE2gNqje5j8j_GQVAB6l7Mnr20mfCwi92dLa7cQ=s180-rw,"라프텔 - 애니 감상 및 취향저격 추천, 스트리밍",백종철,2022-03-14 00:00:00+09:00,5,0,국내 애니 스트리밍 사이트 라프텔 잘 보고 있어요 좋은 작품 많아서 행복합니다^^,android
https://play-lh.googleusercontent.com/w8xd-eZ2_G9YnS4q6ITfoCzWOnXTE2gNqje5j8j_GQVAB6l7Mnr20mfCwi92dLa7cQ=s180-rw,"라프텔 - 애니 감상 및 취향저격 추천, 스트리밍",도도,2022-03-14 00:00:00+09:00,5,0,24살 쳐먹은 오빠가 드디어 저에게 자비를 배풀길래 잘보고 있어요>< 안나온게 있기는 하지만 나름 만족중 입니다^^ 오빠 땡큐 ㅋ^(TMI:언니가 준 용돈으로 사지 않길 잘했음>< 역시 존버 최고★★★★★),android
https://play-lh.googleusercontent.com/w8xd-eZ2_G9YnS4q6ITfoCzWOnXTE2gNqje5j8j_GQVAB6l7Mnr20mfCwi92dLa7cQ=s180-rw,"라프텔 - 애니 감상 및 취향저격 추천, 스트리밍",이경선,2022-03-14 00:00:00+09:00,4,0,광고가 좀 많이 나오고 (1분짜리도..ㅠ) 두개 나오는 경우도 있고 세로일때 광고 나오면 가로로도 못바꾸는게 아쉽긴하지만..(만화중에서도 못보는 것도 있고..) 그래도 무료로 볼수 있어 좋긴 좋아요,android
