APP_IMG,APP_NAME,USER,DATE,STAR,LIKE,COMMENT,OS
https://play-lh.googleusercontent.com/w8xd-eZ2_G9YnS4q6ITfoCzWOnXTE2gNqje5j8j_GQVAB6l7Mnr20mfCwi92dLa7cQ=s180-rw,"라프텔 - 애니 감상 및 취향저격 추천, 스트리밍",알링Tv,2022-03-09 00:00:00+09:00,3,27,솔찍히 말해서 편리하긴합니다. 근데 돈을주고 가입을해도 못보는 애니도있고요. 판권이 들어오지못해 못보는 애니들도 많습니다...ㅠ 솔찍히 돈주고 보는데..ㅠㅠ 그리고 15세나 19세나 잔인한장면이나 조금이라도 야한장면이나오면 바로 블라인드처리가 돼어있어서 짜증이남니다. 그런아쉬운점들이있고 좋은점은 일단 최신애니들을 들여오는점이나 가입하는 돈이 은근 가성비 값이라는점? 여러가지로 좋은점이많습니다. 별 3점 죄송하게 생각하지만 저도 사람이라서 솔찍한평가를 했습니다. 제가 않좋은 애기를 많이해서 그렇지 그렇다고 않좋은 앱은아닙니다. 개선했...전체 리뷰,android
https://play-lh.googleusercontent.com/w8xd-eZ2_G9YnS4q6ITfoCzWOnXTE2gNqje5j8j_GQVAB6l7Mnr20mfCwi92dLa7cQ=s180-rw,"라프텔 - 애니 감상 및 취향저격 추천, 스트리밍",은후,2022-03-09 00:00:00+09:00,5,0,판권좀 더 많이 돌려주면 좋겠어요,android
https://play-lh.googleusercontent.com/w8xd-eZ2_G9YnS4q6ITfoCzWOnXTE2gNqje5j8j_GQVAB6l7Mnr20mfCwi92dLa7cQ=s180-rw,"라프텔 - 애니 감상 및 취향저격 추천, 스트리밍",치즈냥코,2022-03-08 00:00:00+09:00,1,0,무슨 보고싶은 애니가 다 맴버십 사라그래 이거 걍 유튜브에서 찾아보는게 더 나을듯-_- 유튜브는 제한 없으니깐,android
https://play-lh.googleusercontent.com/w8xd-eZ2_G9YnS4q6ITfoCzWOnXTE2gNqje5j8j_GQVAB6l7Mnr20mfCwi92dLa7cQ=s180-rw,"라프텔 - 애니 감상 및 취향저격 추천, 스트리밍",백호일,2022-03-08 00:00:00+09:00,4,0,광고때문에불편하지만제미있는애니들이많아요,android
https://play-lh.googleusercontent.com/w8xd-eZ2_G9YnS4q6ITfoCzWOnXTE2gNqje5j8j_GQVAB6l7Mnr20mfCwi92dLa7cQ=s180-rw,"라프텔 - 애니 감상 및 취향저격 추천, 스트리밍",신효주,2022-03-08 00:00:00+09:00,1,0,애니 볼려고 깔았는데 무료로 1편 보고는 보고싶은거 거의 돈네야 합니다.,android
https://play-lh.googleusercontent.com/w8xd-eZ2_G9YnS4q6ITfoCzWOnXTE2gNqje5j8j_GQVAB6l7Mnr20mfCwi92dLa7cQ=s180-rw,"라프텔 - 애니 감상 및 취향저격 추천, 스트리밍",해리포터,2022-03-08 00:00:00+09:00,4,1,정말 좋은앱인데 오늘 폰을 바꾸고나서 라프텔이 아예들어가지질 않습니다 몇번을 지웠다 깔아봐도 들어가지질않네요 폰 기종은 샤오미 노트 10 프로입니다 어떻게해야할까요..,android
https://play-lh.googleusercontent.com/w8xd-eZ2_G9YnS4q6ITfoCzWOnXTE2gNqje5j8j_GQVAB6l7Mnr20mfCwi92dLa7cQ=s180-rw,"라프텔 - 애니 감상 및 취향저격 추천, 스트리밍",See Ryu,2022-03-08 00:00:00+09:00,5,0,다크모드좀 만들어주세요 젭알 + 야호 감사합니다,android
https://play-lh.googleusercontent.com/w8xd-eZ2_G9YnS4q6ITfoCzWOnXTE2gNqje5j8j_GQVAB6l7Mnr20mfCwi92dLa7cQ=s180-rw,"라프텔 - 애니 감상 및 취향저격 추천, 스트리밍",이인산,2022-03-07 00:00:00+09:00,5,0,왠만한 만화는 다 볼 수 있어서 좋은 것 같습니다.,android
https://play-lh.googleusercontent.com/w8xd-eZ2_G9YnS4q6ITfoCzWOnXTE2gNqje5j8j_GQVAB6l7Mnr20mfCwi92dLa7cQ=s180-rw,"라프텔 - 애니 감상 및 취향저격 추천, 스트리밍",누구임,2022-03-07 00:00:00+09:00,5,0,애니를 들여와주는 앱이라니 끝내줍니다 근데 tv앱 ui 좀 편하게 고쳐주세요 라프텔 나가기 버튼을 직접 눌러야 나갈 수 있다니 너무 불편해요,android
https://play-lh.googleusercontent.com/w8xd-eZ2_G9YnS4q6ITfoCzWOnXTE2gNqje5j8j_GQVAB6l7Mnr20mfCwi92dLa7cQ=s180-rw,"라프텔 - 애니 감상 및 취향저격 추천, 스트리밍",full러린,2022-03-07 00:00:00+09:00,5,0,다른건 다 좋은데 판권 만료됀작품을 한번더 판권을 요펑할 수 있게 해주셨으면 좋겠습니다 오래전에 판권만료됐는데 이제 알아서 못보는 작품도 꽤있더군요,android
https://play-lh.googleusercontent.com/w8xd-eZ2_G9YnS4q6ITfoCzWOnXTE2gNqje5j8j_GQVAB6l7Mnr20mfCwi92dLa7cQ=s180-rw,"라프텔 - 애니 감상 및 취향저격 추천, 스트리밍",OoO *,2022-03-07 00:00:00+09:00,1,14,"카카오톡 로그인이 안됩니다. 돈은 나갔고 서비스는 못 받고 있습니다. 몇 번 반복적으로 시도를 해보았으나 여전히 버퍼링만 뜰 뿐 변한 것이 없네요. 핸드폰을 바꾼 뒤에 다시 로그인을 하려고 하니 이러네요. 참고로 폰 기종은 갤럭시 s22 입니다. 저와 같은 문제로 피해를 받고 있는 분들이 꽤 많은 것 같으니, 하루 빨리 고쳐 주셨으면 좋겠습니다. 불편함이 많습니다.",android
https://play-lh.googleusercontent.com/w8xd-eZ2_G9YnS4q6ITfoCzWOnXTE2gNqje5j8j_GQVAB6l7Mnr20mfCwi92dLa7cQ=s180-rw,"라프텔 - 애니 감상 및 취향저격 추천, 스트리밍",여지현,2022-03-07 00:00:00+09:00,5,0,너무좋아요,android
https://play-lh.googleusercontent.com/w8xd-eZ2_G9YnS4q6ITfoCzWOnXTE2gNqje5j8j_GQVAB6l7Mnr20mfCwi92dLa7cQ=s180-rw,"라프텔 - 애니 감상 및 취향저격 추천, 스트리밍",리연이연,2022-03-07 00:00:00+09:00,5,8,프리미엄?인가 안 할거면 비추 광고 엄청 나옴 한화에 3개에서 4개? 오프닝이랑 이것저것 빼면 25분도 안 나오는데 + 리뷰 답변 감사합니다. 정기결제하고 프로필 더 만들어 여럿이서 보고 있어요. 다른 곳 찾아보니까 다 비슷한데 라프텔이 더 괜찮더라고요. 재밌게 보고 있습니다.,android
https://play-lh.googleusercontent.com/w8xd-eZ2_G9YnS4q6ITfoCzWOnXTE2gNqje5j8j_GQVAB6l7Mnr20mfCwi92dLa7cQ=s180-rw,"라프텔 - 애니 감상 및 취향저격 추천, 스트리밍",윤기홍,2022-03-07 00:00:00+09:00,5,0,라프텔에는 왜 장난을 잘 치는 타카키 양 2기는 없나요?/ 방영중 인것도 다 방영이 되면AD가 될수있나요,android
https://play-lh.googleusercontent.com/w8xd-eZ2_G9YnS4q6ITfoCzWOnXTE2gNqje5j8j_GQVAB6l7Mnr20mfCwi92dLa7cQ=s180-rw,"라프텔 - 애니 감상 및 취향저격 추천, 스트리밍",정효준,2022-03-07 00:00:00+09:00,5,0,좋아요,android
https://play-lh.googleusercontent.com/w8xd-eZ2_G9YnS4q6ITfoCzWOnXTE2gNqje5j8j_GQVAB6l7Mnr20mfCwi92dLa7cQ=s180-rw,"라프텔 - 애니 감상 및 취향저격 추천, 스트리밍",김꿀벌,2022-03-07 00:00:00+09:00,5,0,그냥 5*,android
https://play-lh.googleusercontent.com/w8xd-eZ2_G9YnS4q6ITfoCzWOnXTE2gNqje5j8j_GQVAB6l7Mnr20mfCwi92dLa7cQ=s180-rw,"라프텔 - 애니 감상 및 취향저격 추천, 스트리밍",고민하는테드찡,2022-03-07 00:00:00+09:00,1,0,계정을 해킹 당했는데 대처도 없으며 계정자체를 증발시킴 돈 받고 이런식으로 해도 되는건가요?,android
https://play-lh.googleusercontent.com/w8xd-eZ2_G9YnS4q6ITfoCzWOnXTE2gNqje5j8j_GQVAB6l7Mnr20mfCwi92dLa7cQ=s180-rw,"라프텔 - 애니 감상 및 취향저격 추천, 스트리밍",프랑스두더지,2022-03-07 00:00:00+09:00,1,0,왜 카카오로그인할때 무한로딩이 걸리나요 월정액 결재했는데 앱으로는 볼수가 없네요,android
https://play-lh.googleusercontent.com/w8xd-eZ2_G9YnS4q6ITfoCzWOnXTE2gNqje5j8j_GQVAB6l7Mnr20mfCwi92dLa7cQ=s180-rw,"라프텔 - 애니 감상 및 취향저격 추천, 스트리밍",강예은,2022-03-07 00:00:00+09:00,1,0,왜 성인만 가능한가요ㅠ 근대 인증하기애 귀찮은데 인증까지 해야되나요? 구지 해야되요?,android
https://play-lh.googleusercontent.com/w8xd-eZ2_G9YnS4q6ITfoCzWOnXTE2gNqje5j8j_GQVAB6l7Mnr20mfCwi92dLa7cQ=s180-rw,"라프텔 - 애니 감상 및 취향저격 추천, 스트리밍",점점,2022-03-07 00:00:00+09:00,3,0,원하는 애니 업로드속도 느림,android
https://play-lh.googleusercontent.com/w8xd-eZ2_G9YnS4q6ITfoCzWOnXTE2gNqje5j8j_GQVAB6l7Mnr20mfCwi92dLa7cQ=s180-rw,"라프텔 - 애니 감상 및 취향저격 추천, 스트리밍",박시후,2022-03-07 00:00:00+09:00,3,17,다 좋은데 광고가 너무 많아요. 그리고 한번씩 갑자기 다른 기기에서 접속 하여 동시재생 을 차단합니다 라면서 시청이 꺼져요. 제가 먼저 보고 있었는데 왜 다른분이 더늦개 보는데 왜 제가 시청이 꺼져요? 그게 의문 이예요. 그래서 3점 드림니다.,android
https://play-lh.googleusercontent.com/w8xd-eZ2_G9YnS4q6ITfoCzWOnXTE2gNqje5j8j_GQVAB6l7Mnr20mfCwi92dLa7cQ=s180-rw,"라프텔 - 애니 감상 및 취향저격 추천, 스트리밍",윤종영,2022-03-07 00:00:00+09:00,4,0,그럭저럭 쓸만하네,android
https://play-lh.googleusercontent.com/w8xd-eZ2_G9YnS4q6ITfoCzWOnXTE2gNqje5j8j_GQVAB6l7Mnr20mfCwi92dLa7cQ=s180-rw,"라프텔 - 애니 감상 및 취향저격 추천, 스트리밍",김경훈,2022-03-07 00:00:00+09:00,4,0,꽤 좋음 가성비,android
https://play-lh.googleusercontent.com/w8xd-eZ2_G9YnS4q6ITfoCzWOnXTE2gNqje5j8j_GQVAB6l7Mnr20mfCwi92dLa7cQ=s180-rw,"라프텔 - 애니 감상 및 취향저격 추천, 스트리밍",Bababanana,2022-03-06 00:00:00+09:00,4,0,다잇다 근데 내가 보고싶은건 없다 슬프다,android
https://play-lh.googleusercontent.com/w8xd-eZ2_G9YnS4q6ITfoCzWOnXTE2gNqje5j8j_GQVAB6l7Mnr20mfCwi92dLa7cQ=s180-rw,"라프텔 - 애니 감상 및 취향저격 추천, 스트리밍",Anastasia Taylor,2022-03-06 00:00:00+09:00,4,0,멤버십결제로도 볼수없는애니메이션이 너무 많아서 아쉬움 ㅠㅠ... 보고싶은 애니메이션은 다 판권이 없구..,android
https://play-lh.googleusercontent.com/w8xd-eZ2_G9YnS4q6ITfoCzWOnXTE2gNqje5j8j_GQVAB6l7Mnr20mfCwi92dLa7cQ=s180-rw,"라프텔 - 애니 감상 및 취향저격 추천, 스트리밍",과몰입연근,2022-03-06 00:00:00+09:00,3,9,ㄹ..로그인이 안됩니다..재부팅을 해도 지웠다가 다시 깔아도...다른 폰으로는 잘만 로그인되는데 바꾼 핸드폰만 로그인이 안됩니다..로그인을 못해서 못 보고 있는데 제발 해결책을 주세요..,android
https://play-lh.googleusercontent.com/w8xd-eZ2_G9YnS4q6ITfoCzWOnXTE2gNqje5j8j_GQVAB6l7Mnr20mfCwi92dLa7cQ=s180-rw,"라프텔 - 애니 감상 및 취향저격 추천, 스트리밍",슈녕,2022-03-06 00:00:00+09:00,5,0,좋음,android
https://play-lh.googleusercontent.com/w8xd-eZ2_G9YnS4q6ITfoCzWOnXTE2gNqje5j8j_GQVAB6l7Mnr20mfCwi92dLa7cQ=s180-rw,"라프텔 - 애니 감상 및 취향저격 추천, 스트리밍",송우경,2022-03-06 00:00:00+09:00,5,0,굿,android
https://play-lh.googleusercontent.com/w8xd-eZ2_G9YnS4q6ITfoCzWOnXTE2gNqje5j8j_GQVAB6l7Mnr20mfCwi92dLa7cQ=s180-rw,"라프텔 - 애니 감상 및 취향저격 추천, 스트리밍",김지원,2022-03-06 00:00:00+09:00,3,0,다 좋다고 치고 왜 카카오톡 간편로그인은 항상 무한 로딩인지 고쳐 생각도 없어보이고..,android
https://play-lh.googleusercontent.com/w8xd-eZ2_G9YnS4q6ITfoCzWOnXTE2gNqje5j8j_GQVAB6l7Mnr20mfCwi92dLa7cQ=s180-rw,"라프텔 - 애니 감상 및 취향저격 추천, 스트리밍",레아,2022-03-06 00:00:00+09:00,1,2,멤버십을 이용하고 있는데도 에피소드를 구매해야하는 것이 있다니... 이러면 멤버십은 왜 있는 건가요??,android
https://play-lh.googleusercontent.com/w8xd-eZ2_G9YnS4q6ITfoCzWOnXTE2gNqje5j8j_GQVAB6l7Mnr20mfCwi92dLa7cQ=s180-rw,"라프텔 - 애니 감상 및 취향저격 추천, 스트리밍",박태호,2022-03-06 00:00:00+09:00,1,0,걍 앱 자체가 들어가지지가 않는데요?,android
https://play-lh.googleusercontent.com/w8xd-eZ2_G9YnS4q6ITfoCzWOnXTE2gNqje5j8j_GQVAB6l7Mnr20mfCwi92dLa7cQ=s180-rw,"라프텔 - 애니 감상 및 취향저격 추천, 스트리밍",beeen,2022-03-06 00:00:00+09:00,4,1,"업데이트 전에는 작품소개에 연관된 작품이라고 2기,3기, 극장판까지 나온걸 보여줘서 정주행하기 좋았는데 업데이트후 그게 사라져서 아쉽네요 다시 만들어 주셨으면 좋겠습니다!!",android
https://play-lh.googleusercontent.com/w8xd-eZ2_G9YnS4q6ITfoCzWOnXTE2gNqje5j8j_GQVAB6l7Mnr20mfCwi92dLa7cQ=s180-rw,"라프텔 - 애니 감상 및 취향저격 추천, 스트리밍",비타,2022-03-06 00:00:00+09:00,2,0,아니 비번 잊어버려서 비밀번호 찾기 누르는데 이동이 안되고 그냥 깜빡거려요 다른 계정 만드려고 하니 로딩만 되고있고..,android
https://play-lh.googleusercontent.com/w8xd-eZ2_G9YnS4q6ITfoCzWOnXTE2gNqje5j8j_GQVAB6l7Mnr20mfCwi92dLa7cQ=s180-rw,"라프텔 - 애니 감상 및 취향저격 추천, 스트리밍",이예은,2022-03-06 00:00:00+09:00,4,0,성인인증만없으면 좋아요.,android
https://play-lh.googleusercontent.com/w8xd-eZ2_G9YnS4q6ITfoCzWOnXTE2gNqje5j8j_GQVAB6l7Mnr20mfCwi92dLa7cQ=s180-rw,"라프텔 - 애니 감상 및 취향저격 추천, 스트리밍",유샤,2022-03-06 00:00:00+09:00,5,0,진짜 너무 좋은데 가끔 진짜 유명한 있을법한 작품들이 두세개정도 없어요ㅜㅜ 얼렁 판권 부활했으면!!,android
https://play-lh.googleusercontent.com/w8xd-eZ2_G9YnS4q6ITfoCzWOnXTE2gNqje5j8j_GQVAB6l7Mnr20mfCwi92dLa7cQ=s180-rw,"라프텔 - 애니 감상 및 취향저격 추천, 스트리밍",김민서,2022-03-06 00:00:00+09:00,1,0,업데이트 이후로 재생이 자꾸 끊겨서 지웠다 깔았더니 중단됐다면서 자꾸 튕기네요,android
https://play-lh.googleusercontent.com/w8xd-eZ2_G9YnS4q6ITfoCzWOnXTE2gNqje5j8j_GQVAB6l7Mnr20mfCwi92dLa7cQ=s180-rw,"라프텔 - 애니 감상 및 취향저격 추천, 스트리밍",후안리온,2022-03-05 00:00:00+09:00,3,0,평소에 잘 사용하던 앱이었는데 휴대폰을 바꾸고서 카카오톡 로그인을 하려고하면 무한로딩에 걸려서 로그인이 안돼요.,android
https://play-lh.googleusercontent.com/w8xd-eZ2_G9YnS4q6ITfoCzWOnXTE2gNqje5j8j_GQVAB6l7Mnr20mfCwi92dLa7cQ=s180-rw,"라프텔 - 애니 감상 및 취향저격 추천, 스트리밍",최수민,2022-03-05 00:00:00+09:00,4,0,제가 애니를 보고있을때 가끔식 다른기기에서 작동? 한다고 뜨더라고요 저는 다른기기에서 로그인도 안하고 설치하지도 안았는데 왜이러죠?ㅠㅠ,android
https://play-lh.googleusercontent.com/w8xd-eZ2_G9YnS4q6ITfoCzWOnXTE2gNqje5j8j_GQVAB6l7Mnr20mfCwi92dLa7cQ=s180-rw,"라프텔 - 애니 감상 및 취향저격 추천, 스트리밍",깜짝손,2022-03-05 00:00:00+09:00,5,0,미애니는 넣을 생각 없으신가용,android
https://play-lh.googleusercontent.com/w8xd-eZ2_G9YnS4q6ITfoCzWOnXTE2gNqje5j8j_GQVAB6l7Mnr20mfCwi92dLa7cQ=s180-rw,"라프텔 - 애니 감상 및 취향저격 추천, 스트리밍",이지운,2022-03-05 00:00:00+09:00,5,0,굿,android
https://play-lh.googleusercontent.com/w8xd-eZ2_G9YnS4q6ITfoCzWOnXTE2gNqje5j8j_GQVAB6l7Mnr20mfCwi92dLa7cQ=s180-rw,"라프텔 - 애니 감상 및 취향저격 추천, 스트리밍",기서현,2022-03-05 00:00:00+09:00,5,0,정말 좋아요!,android
https://play-lh.googleusercontent.com/w8xd-eZ2_G9YnS4q6ITfoCzWOnXTE2gNqje5j8j_GQVAB6l7Mnr20mfCwi92dLa7cQ=s180-rw,"라프텔 - 애니 감상 및 취향저격 추천, 스트리밍",브레혁,2022-03-05 00:00:00+09:00,3,0,카툰네트워크 작품들을 보고 싶어서 끊었는데 이미 판권이 만료라고 하네요 하지만 그 점만 빼면 괜찮은 것 같아요,android
https://play-lh.googleusercontent.com/w8xd-eZ2_G9YnS4q6ITfoCzWOnXTE2gNqje5j8j_GQVAB6l7Mnr20mfCwi92dLa7cQ=s180-rw,"라프텔 - 애니 감상 및 취향저격 추천, 스트리밍",In So,2022-03-05 00:00:00+09:00,5,0,참 좋아요.,android
https://play-lh.googleusercontent.com/w8xd-eZ2_G9YnS4q6ITfoCzWOnXTE2gNqje5j8j_GQVAB6l7Mnr20mfCwi92dLa7cQ=s180-rw,"라프텔 - 애니 감상 및 취향저격 추천, 스트리밍",정은정,2022-03-05 00:00:00+09:00,4,0,좋아요^^ 가끔 티비 연결이 어려운 거 빼고요.,android
https://play-lh.googleusercontent.com/w8xd-eZ2_G9YnS4q6ITfoCzWOnXTE2gNqje5j8j_GQVAB6l7Mnr20mfCwi92dLa7cQ=s180-rw,"라프텔 - 애니 감상 및 취향저격 추천, 스트리밍",송은빈,2022-03-05 00:00:00+09:00,3,0,보는건 정말 좋은데 광고가 진짜 너무 많이서 불편하네요..!,android
https://play-lh.googleusercontent.com/w8xd-eZ2_G9YnS4q6ITfoCzWOnXTE2gNqje5j8j_GQVAB6l7Mnr20mfCwi92dLa7cQ=s180-rw,"라프텔 - 애니 감상 및 취향저격 추천, 스트리밍",이동준,2022-03-05 00:00:00+09:00,5,0,진짜 재밌는애니 많아서 좋네요.,android
https://play-lh.googleusercontent.com/w8xd-eZ2_G9YnS4q6ITfoCzWOnXTE2gNqje5j8j_GQVAB6l7Mnr20mfCwi92dLa7cQ=s180-rw,"라프텔 - 애니 감상 및 취향저격 추천, 스트리밍",홓호호,2022-03-05 00:00:00+09:00,3,0,제가 2021년도 초반쯤? 라프텔을 깔았는데 그때는 몆추간 무료로 동영상을 볼 수 있었는데 왜 지금은 앱을 계속 지웟다 깔고 폰 전원을 껏다 켜도 1화밖에 못보나요..? 5화 까지라도만 무료로 볼 수 있으면 광고가 더 많이나와도 여한이 없네요..,android
https://play-lh.googleusercontent.com/w8xd-eZ2_G9YnS4q6ITfoCzWOnXTE2gNqje5j8j_GQVAB6l7Mnr20mfCwi92dLa7cQ=s180-rw,"라프텔 - 애니 감상 및 취향저격 추천, 스트리밍",쿠쿠루삥뽕김잼민,2022-03-05 00:00:00+09:00,5,0,1등,android
https://play-lh.googleusercontent.com/w8xd-eZ2_G9YnS4q6ITfoCzWOnXTE2gNqje5j8j_GQVAB6l7Mnr20mfCwi92dLa7cQ=s180-rw,"라프텔 - 애니 감상 및 취향저격 추천, 스트리밍",ᄒ,2022-03-05 00:00:00+09:00,1,0,카톡으로 로그인하려고 하는데 안되여,android
https://play-lh.googleusercontent.com/w8xd-eZ2_G9YnS4q6ITfoCzWOnXTE2gNqje5j8j_GQVAB6l7Mnr20mfCwi92dLa7cQ=s180-rw,"라프텔 - 애니 감상 및 취향저격 추천, 스트리밍",양민석,2022-03-05 00:00:00+09:00,5,0,👍👍👍👍👍,android
https://play-lh.googleusercontent.com/w8xd-eZ2_G9YnS4q6ITfoCzWOnXTE2gNqje5j8j_GQVAB6l7Mnr20mfCwi92dLa7cQ=s180-rw,"라프텔 - 애니 감상 및 취향저격 추천, 스트리밍",김은영,2022-03-05 00:00:00+09:00,4,0,"재밌긴 한데,로그인이나,그런거는 없었을면 좋겠어요.그리고 애니 볼때 로그인을 하고 봐야 돼서 많이 어려워요ㅠㅠ",android
https://play-lh.googleusercontent.com/w8xd-eZ2_G9YnS4q6ITfoCzWOnXTE2gNqje5j8j_GQVAB6l7Mnr20mfCwi92dLa7cQ=s180-rw,"라프텔 - 애니 감상 및 취향저격 추천, 스트리밍",수빈.,2022-03-05 00:00:00+09:00,5,0,몇몇 애니가 19금이 풀려있네요,android
https://play-lh.googleusercontent.com/w8xd-eZ2_G9YnS4q6ITfoCzWOnXTE2gNqje5j8j_GQVAB6l7Mnr20mfCwi92dLa7cQ=s180-rw,"라프텔 - 애니 감상 및 취향저격 추천, 스트리밍",김준영,2022-03-05 00:00:00+09:00,5,0,잘 작동되고있어요,android
https://play-lh.googleusercontent.com/w8xd-eZ2_G9YnS4q6ITfoCzWOnXTE2gNqje5j8j_GQVAB6l7Mnr20mfCwi92dLa7cQ=s180-rw,"라프텔 - 애니 감상 및 취향저격 추천, 스트리밍",강서윤,2022-03-05 00:00:00+09:00,4,0,무료체험으로 유료 쓰고있는데 광고도 안나오고 좋더라고요 근데 무료는 너무 광고가 많이 나와요.. 좀 적당히 나오면 좋겠어요!,android
https://play-lh.googleusercontent.com/w8xd-eZ2_G9YnS4q6ITfoCzWOnXTE2gNqje5j8j_GQVAB6l7Mnr20mfCwi92dLa7cQ=s180-rw,"라프텔 - 애니 감상 및 취향저격 추천, 스트리밍",김지은,2022-03-05 00:00:00+09:00,1,3,"진짜 별 한개도 아까워요 계속 실행 안돼서 기꺼이 갤러리에 있는 사진 다 관리하고, 지워서 다시 설치했는데 저장공간 때문인지는 몰라도 어제 이후로 계속 앱이 실행이 안돼네요. . .",android
https://play-lh.googleusercontent.com/w8xd-eZ2_G9YnS4q6ITfoCzWOnXTE2gNqje5j8j_GQVAB6l7Mnr20mfCwi92dLa7cQ=s180-rw,"라프텔 - 애니 감상 및 취향저격 추천, 스트리밍",유동후,2022-03-04 00:00:00+09:00,5,0,제작가님너무재밌어요앞으로더재밌는영화를만들어주시면감사하겠습니다(제목은하늘의유신물)입니다,android
https://play-lh.googleusercontent.com/w8xd-eZ2_G9YnS4q6ITfoCzWOnXTE2gNqje5j8j_GQVAB6l7Mnr20mfCwi92dLa7cQ=s180-rw,"라프텔 - 애니 감상 및 취향저격 추천, 스트리밍",무성이무성,2022-03-04 00:00:00+09:00,5,15,정말 다 좋지만 아쉬운건 리뷰 글자 최대 갯수가 부족합니다... 저는 애니를 보고 이 애니의 장점과 단점을 적어 해당 애니에 대한 가치성과 순수한 작가의 의도?를 알려주고 싶은 취지로 리뷰를 작성하고는 하는데 글자 수가 항상 부족했다 라는 느낌을 받았습니다. 개인적으로 350 ~ 400 정도만 늘어나도 충분할 것 같다는 느낌을 받았습니다,android
https://play-lh.googleusercontent.com/w8xd-eZ2_G9YnS4q6ITfoCzWOnXTE2gNqje5j8j_GQVAB6l7Mnr20mfCwi92dLa7cQ=s180-rw,"라프텔 - 애니 감상 및 취향저격 추천, 스트리밍",김지후,2022-03-04 00:00:00+09:00,1,0,이거귀칼보러면무차편 보려면 로그인해야합니다 이거하지세요 이거꽁자줄알고했는데 귀칼무차편 꽁자로안줄거면이거사라져야돼,android
https://play-lh.googleusercontent.com/w8xd-eZ2_G9YnS4q6ITfoCzWOnXTE2gNqje5j8j_GQVAB6l7Mnr20mfCwi92dLa7cQ=s180-rw,"라프텔 - 애니 감상 및 취향저격 추천, 스트리밍",MIN esoTw,2022-03-04 00:00:00+09:00,5,0,good,android
https://play-lh.googleusercontent.com/w8xd-eZ2_G9YnS4q6ITfoCzWOnXTE2gNqje5j8j_GQVAB6l7Mnr20mfCwi92dLa7cQ=s180-rw,"라프텔 - 애니 감상 및 취향저격 추천, 스트리밍",박씨,2022-03-04 00:00:00+09:00,1,0,비추요. 한달에 1만원씩 내면서 보고있는데 에피소드 개별 구매해야하는게 너무 많아요 특히 인기많은 신작.. 굳이 만원 내야하나 십음,android
https://play-lh.googleusercontent.com/w8xd-eZ2_G9YnS4q6ITfoCzWOnXTE2gNqje5j8j_GQVAB6l7Mnr20mfCwi92dLa7cQ=s180-rw,"라프텔 - 애니 감상 및 취향저격 추천, 스트리밍",임수현,2022-03-04 00:00:00+09:00,5,0,이거로 입덕했는데 솔직히 적당하게 애니 볼꺼면 이앱이 짱임,android
https://play-lh.googleusercontent.com/w8xd-eZ2_G9YnS4q6ITfoCzWOnXTE2gNqje5j8j_GQVAB6l7Mnr20mfCwi92dLa7cQ=s180-rw,"라프텔 - 애니 감상 및 취향저격 추천, 스트리밍",김송현,2022-03-04 00:00:00+09:00,5,0,굿잡,android
https://play-lh.googleusercontent.com/w8xd-eZ2_G9YnS4q6ITfoCzWOnXTE2gNqje5j8j_GQVAB6l7Mnr20mfCwi92dLa7cQ=s180-rw,"라프텔 - 애니 감상 및 취향저격 추천, 스트리밍",MJ K,2022-03-04 00:00:00+09:00,5,0,안녕하세요 라프텔을 깔아보니 로그인만 하면 여러가지를 볼수있는데 조금 아쉬운게 성인인증인데 제가 17살이라 아쉽더라고요 그렇지만 여러개의 영화.만화.그라마같은게 있어여 너무 재밌어요 여러분도 1번 깔아보세요 광고도 없어요!❤,android
https://play-lh.googleusercontent.com/w8xd-eZ2_G9YnS4q6ITfoCzWOnXTE2gNqje5j8j_GQVAB6l7Mnr20mfCwi92dLa7cQ=s180-rw,"라프텔 - 애니 감상 및 취향저격 추천, 스트리밍",Laihourn Khorn,2022-03-04 00:00:00+09:00,5,0,"안녕하세요 앙스타 극장판 내주셔서 감사합니다 딴건됬고 진짜 감사해요 사랑해요 라ㅍ, 아니 갓프텔",android
https://play-lh.googleusercontent.com/w8xd-eZ2_G9YnS4q6ITfoCzWOnXTE2gNqje5j8j_GQVAB6l7Mnr20mfCwi92dLa7cQ=s180-rw,"라프텔 - 애니 감상 및 취향저격 추천, 스트리밍",리베,2022-03-04 00:00:00+09:00,2,0,판권 만료가 되어서 못 보는 영상도 있던데.....그걸 보고싶어서 이 앱을 사용하는 사람들은 불편해요,android
https://play-lh.googleusercontent.com/w8xd-eZ2_G9YnS4q6ITfoCzWOnXTE2gNqje5j8j_GQVAB6l7Mnr20mfCwi92dLa7cQ=s180-rw,"라프텔 - 애니 감상 및 취향저격 추천, 스트리밍",천마,2022-03-04 00:00:00+09:00,5,0,광고가 많으면 정기결제를 하세요.,android
https://play-lh.googleusercontent.com/w8xd-eZ2_G9YnS4q6ITfoCzWOnXTE2gNqje5j8j_GQVAB6l7Mnr20mfCwi92dLa7cQ=s180-rw,"라프텔 - 애니 감상 및 취향저격 추천, 스트리밍",렝그,2022-03-03 00:00:00+09:00,1,0,왜 다운로드가 안됌?,android
https://play-lh.googleusercontent.com/w8xd-eZ2_G9YnS4q6ITfoCzWOnXTE2gNqje5j8j_GQVAB6l7Mnr20mfCwi92dLa7cQ=s180-rw,"라프텔 - 애니 감상 및 취향저격 추천, 스트리밍",황청아,2022-03-03 00:00:00+09:00,5,0,조하요,android
https://play-lh.googleusercontent.com/w8xd-eZ2_G9YnS4q6ITfoCzWOnXTE2gNqje5j8j_GQVAB6l7Mnr20mfCwi92dLa7cQ=s180-rw,"라프텔 - 애니 감상 및 취향저격 추천, 스트리밍",악으,2022-03-03 00:00:00+09:00,5,0,다운로드 오류 굉장히 심함 다음달부터 결제 안할듯,android
https://play-lh.googleusercontent.com/w8xd-eZ2_G9YnS4q6ITfoCzWOnXTE2gNqje5j8j_GQVAB6l7Mnr20mfCwi92dLa7cQ=s180-rw,"라프텔 - 애니 감상 및 취향저격 추천, 스트리밍",s z,2022-03-03 00:00:00+09:00,3,0,프로필 잠금기능 만들어주세요 같이 프리미엄 이용하는 사람들이 실수로라도 들어오는게 싫어요,android
https://play-lh.googleusercontent.com/w8xd-eZ2_G9YnS4q6ITfoCzWOnXTE2gNqje5j8j_GQVAB6l7Mnr20mfCwi92dLa7cQ=s180-rw,"라프텔 - 애니 감상 및 취향저격 추천, 스트리밍",パンパン,2022-03-03 00:00:00+09:00,5,0,좋슴다,android
https://play-lh.googleusercontent.com/w8xd-eZ2_G9YnS4q6ITfoCzWOnXTE2gNqje5j8j_GQVAB6l7Mnr20mfCwi92dLa7cQ=s180-rw,"라프텔 - 애니 감상 및 취향저격 추천, 스트리밍",seon nyeo kim,2022-03-03 00:00:00+09:00,3,0,Good,android
https://play-lh.googleusercontent.com/w8xd-eZ2_G9YnS4q6ITfoCzWOnXTE2gNqje5j8j_GQVAB6l7Mnr20mfCwi92dLa7cQ=s180-rw,"라프텔 - 애니 감상 및 취향저격 추천, 스트리밍",이민호,2022-03-03 00:00:00+09:00,3,55,5점 주고 싶은데 문제가 극장판이나 몇몇의 애니는 따로 결제를 해야지 시청 할 수있습니다. 멤버십 결제를 해도 못 봅니다 적어도 프리미엄 결제 한 사람이라도 볼 수있게 해줘야되지 않을까요? 다른건 좋은데 몇몇의 애니를 따로 결제해서 시청 해야하는게 많이 아쉬울 뿐입니다...,android
