APP_IMG,APP_NAME,USER,DATE,STAR,LIKE,COMMENT,OS
https://play-lh.googleusercontent.com/w8xd-eZ2_G9YnS4q6ITfoCzWOnXTE2gNqje5j8j_GQVAB6l7Mnr20mfCwi92dLa7cQ=s180-rw,"라프텔 - 애니 감상 및 취향저격 추천, 스트리밍",뿡,2022-03-14 00:00:00+09:00,2,0,이용권을 구매하고도 돈을 따로 더 내서 대여권을 사야만 시청 가능한 것이 있네요.. 그것도 꽤 비싸요. 그리고 웹은 괜찮은데 앱으로 볼 경우 중간에 자꾸 멈춥니다. 여러 기기로 이용해봐도 그러네요.,android
https://play-lh.googleusercontent.com/w8xd-eZ2_G9YnS4q6ITfoCzWOnXTE2gNqje5j8j_GQVAB6l7Mnr20mfCwi92dLa7cQ=s180-rw,"라프텔 - 애니 감상 및 취향저격 추천, 스트리밍",김기원,2022-03-13 00:00:00+09:00,5,0,애니보기 좋은 어플,android
https://play-lh.googleusercontent.com/w8xd-eZ2_G9YnS4q6ITfoCzWOnXTE2gNqje5j8j_GQVAB6l7Mnr20mfCwi92dLa7cQ=s180-rw,"라프텔 - 애니 감상 및 취향저격 추천, 스트리밍",한정균,2022-03-13 00:00:00+09:00,5,0,야매때,android
https://play-lh.googleusercontent.com/w8xd-eZ2_G9YnS4q6ITfoCzWOnXTE2gNqje5j8j_GQVAB6l7Mnr20mfCwi92dLa7cQ=s180-rw,"라프텔 - 애니 감상 및 취향저격 추천, 스트리밍",즈치,2022-03-13 00:00:00+09:00,4,0,광고에서 나온 애니 찾을라고 2시간 걸렸지만 만족....,android
https://play-lh.googleusercontent.com/w8xd-eZ2_G9YnS4q6ITfoCzWOnXTE2gNqje5j8j_GQVAB6l7Mnr20mfCwi92dLa7cQ=s180-rw,"라프텔 - 애니 감상 및 취향저격 추천, 스트리밍",쩡규,2022-03-13 00:00:00+09:00,5,0,매우매우 좋아유!!,android
https://play-lh.googleusercontent.com/w8xd-eZ2_G9YnS4q6ITfoCzWOnXTE2gNqje5j8j_GQVAB6l7Mnr20mfCwi92dLa7cQ=s180-rw,"라프텔 - 애니 감상 및 취향저격 추천, 스트리밍",은경,2022-03-13 00:00:00+09:00,3,0,다양한 애니들이 있어서 좋은 데 광고가 넘 많이 나와요ㅠㅠ 광고 많이 나와서 미안하다면서 1분 동안 빗소리 듣거나 손 마사지 하는 거는 왜 나오는 거죠ㅠㅠ,android
https://play-lh.googleusercontent.com/w8xd-eZ2_G9YnS4q6ITfoCzWOnXTE2gNqje5j8j_GQVAB6l7Mnr20mfCwi92dLa7cQ=s180-rw,"라프텔 - 애니 감상 및 취향저격 추천, 스트리밍",김아현,2022-03-13 00:00:00+09:00,4,0,컬문결제가 사라져 아쉬워요,android
https://play-lh.googleusercontent.com/w8xd-eZ2_G9YnS4q6ITfoCzWOnXTE2gNqje5j8j_GQVAB6l7Mnr20mfCwi92dLa7cQ=s180-rw,"라프텔 - 애니 감상 및 취향저격 추천, 스트리밍",김혜량,2022-03-13 00:00:00+09:00,5,0,다 좋습니다 모브사이코 판권부활시켜주셔서 감사해요 그치만 몇일전부터 접속이되지않아 보지못하고있는 상태입니다.. 저장공간 때문인가 싶어 싹 정리한 뒤 실행해보았지만 작동되지않았고 라프텔 이외의 다른 앱은 모두 정상작동하였습니다.. 폰 기종은 갤럭시A30이고 잘사용했는데 갑자기 이러네요.. 빨리 애니 보고싶어요~!,android
https://play-lh.googleusercontent.com/w8xd-eZ2_G9YnS4q6ITfoCzWOnXTE2gNqje5j8j_GQVAB6l7Mnr20mfCwi92dLa7cQ=s180-rw,"라프텔 - 애니 감상 및 취향저격 추천, 스트리밍",남선미,2022-03-13 00:00:00+09:00,3,0,라프텔이 들어가지지 않아요... 들어갈려하면 바로 튕기구... 지웠다가 다시 깔아두 안되요...ㅠ,android
https://play-lh.googleusercontent.com/w8xd-eZ2_G9YnS4q6ITfoCzWOnXTE2gNqje5j8j_GQVAB6l7Mnr20mfCwi92dLa7cQ=s180-rw,"라프텔 - 애니 감상 및 취향저격 추천, 스트리밍",김김미영,2022-03-13 00:00:00+09:00,3,0,카카오로로그인하기가 어플에서안되서 웹으로만봐야하네요 개선해주세요,android
https://play-lh.googleusercontent.com/w8xd-eZ2_G9YnS4q6ITfoCzWOnXTE2gNqje5j8j_GQVAB6l7Mnr20mfCwi92dLa7cQ=s180-rw,"라프텔 - 애니 감상 및 취향저격 추천, 스트리밍",뽀끼,2022-03-13 00:00:00+09:00,5,6,"친구랑 프리미엄 공동 구매해서 사용하고 있는데 애니가 너무 미쳣어요,,ㅠㅠㅜ 천관사복, 호리미야, 반요 야샤히메, 오란고교 사교클럽... 너무 재밌게 봤어요!! 라프텔 사랑합니다💕 천관사복같은 애니 많이 내주세요~!!",android
https://play-lh.googleusercontent.com/w8xd-eZ2_G9YnS4q6ITfoCzWOnXTE2gNqje5j8j_GQVAB6l7Mnr20mfCwi92dLa7cQ=s180-rw,"라프텔 - 애니 감상 및 취향저격 추천, 스트리밍",이동희,2022-03-13 00:00:00+09:00,1,0,설명이 전혀 없음,android
https://play-lh.googleusercontent.com/w8xd-eZ2_G9YnS4q6ITfoCzWOnXTE2gNqje5j8j_GQVAB6l7Mnr20mfCwi92dLa7cQ=s180-rw,"라프텔 - 애니 감상 및 취향저격 추천, 스트리밍",최한빛,2022-03-13 00:00:00+09:00,5,0,좋아요,android
https://play-lh.googleusercontent.com/w8xd-eZ2_G9YnS4q6ITfoCzWOnXTE2gNqje5j8j_GQVAB6l7Mnr20mfCwi92dLa7cQ=s180-rw,"라프텔 - 애니 감상 및 취향저격 추천, 스트리밍",전지훈,2022-03-13 00:00:00+09:00,5,0,내가 보고싶은게 있는데 조금 부족하다,android
https://play-lh.googleusercontent.com/w8xd-eZ2_G9YnS4q6ITfoCzWOnXTE2gNqje5j8j_GQVAB6l7Mnr20mfCwi92dLa7cQ=s180-rw,"라프텔 - 애니 감상 및 취향저격 추천, 스트리밍",이정원,2022-03-13 00:00:00+09:00,3,0,갤럭시 탭 A7으로 사용중입니다. 자주 응답 없음 상태가 됩니다.,android
https://play-lh.googleusercontent.com/w8xd-eZ2_G9YnS4q6ITfoCzWOnXTE2gNqje5j8j_GQVAB6l7Mnr20mfCwi92dLa7cQ=s180-rw,"라프텔 - 애니 감상 및 취향저격 추천, 스트리밍",누로 Nuro YouTube,2022-03-13 00:00:00+09:00,3,0,애니도 많고 좋은데 뭔 광고가 1분에 한번씩 나와요,android
https://play-lh.googleusercontent.com/w8xd-eZ2_G9YnS4q6ITfoCzWOnXTE2gNqje5j8j_GQVAB6l7Mnr20mfCwi92dLa7cQ=s180-rw,"라프텔 - 애니 감상 및 취향저격 추천, 스트리밍",슬피,2022-03-13 00:00:00+09:00,3,0,좋긴한데 그놈의 판권이슈... 돈 받는만큼 했으면 좋겠음,android
https://play-lh.googleusercontent.com/w8xd-eZ2_G9YnS4q6ITfoCzWOnXTE2gNqje5j8j_GQVAB6l7Mnr20mfCwi92dLa7cQ=s180-rw,"라프텔 - 애니 감상 및 취향저격 추천, 스트리밍",송치훈,2022-03-13 00:00:00+09:00,5,0,덕양소님 추천으로 보기 시작했는데 유투브에서 리뷰했던 작품 볼수있어서 좋았습니다,android
https://play-lh.googleusercontent.com/w8xd-eZ2_G9YnS4q6ITfoCzWOnXTE2gNqje5j8j_GQVAB6l7Mnr20mfCwi92dLa7cQ=s180-rw,"라프텔 - 애니 감상 및 취향저격 추천, 스트리밍",박중수,2022-03-13 00:00:00+09:00,5,0,좋네,android
https://play-lh.googleusercontent.com/w8xd-eZ2_G9YnS4q6ITfoCzWOnXTE2gNqje5j8j_GQVAB6l7Mnr20mfCwi92dLa7cQ=s180-rw,"라프텔 - 애니 감상 및 취향저격 추천, 스트리밍",배진수,2022-03-13 00:00:00+09:00,3,0,랙이 너무 많이 걸려요. 보기싫은 장면이 나와서 넘길려고 해도 랙이 걸리고 좋아하는 장면으로 넘길려고 해도 네모칸에 그림이 않보여서 걸리적 거리기만 해요,android
https://play-lh.googleusercontent.com/w8xd-eZ2_G9YnS4q6ITfoCzWOnXTE2gNqje5j8j_GQVAB6l7Mnr20mfCwi92dLa7cQ=s180-rw,"라프텔 - 애니 감상 및 취향저격 추천, 스트리밍",문시,2022-03-13 00:00:00+09:00,1,1,앱이 안 들어가지고 자꾸 튕기네요.,android
https://play-lh.googleusercontent.com/w8xd-eZ2_G9YnS4q6ITfoCzWOnXTE2gNqje5j8j_GQVAB6l7Mnr20mfCwi92dLa7cQ=s180-rw,"라프텔 - 애니 감상 및 취향저격 추천, 스트리밍",Yeong Jin Jeong,2022-03-13 00:00:00+09:00,3,0,실행만 하면 앱이 강제종료가 되는 현상이 있네요. 조치 부탁드려요,android
https://play-lh.googleusercontent.com/w8xd-eZ2_G9YnS4q6ITfoCzWOnXTE2gNqje5j8j_GQVAB6l7Mnr20mfCwi92dLa7cQ=s180-rw,"라프텔 - 애니 감상 및 취향저격 추천, 스트리밍",이한나,2022-03-13 00:00:00+09:00,1,1,와 진짜 별로내요 제가 잘보고있었는데 깐지 몇일안됬는데 갑자기 앱이 않열리네요?ㅋㅋ이건 뭔경우져 폰도 껐다 켜봤고 앱도 지웠다 깔아봤도 저장공간도 넉넉한데 왜 않켜지는 걸.까.요.?진짜 짜증나네요 이 앱 절대 깔지마세요,android
https://play-lh.googleusercontent.com/w8xd-eZ2_G9YnS4q6ITfoCzWOnXTE2gNqje5j8j_GQVAB6l7Mnr20mfCwi92dLa7cQ=s180-rw,"라프텔 - 애니 감상 및 취향저격 추천, 스트리밍",조찬웅,2022-03-12 00:00:00+09:00,4,0,없는게 많아서 아쉽 그치만 편함,android
https://play-lh.googleusercontent.com/w8xd-eZ2_G9YnS4q6ITfoCzWOnXTE2gNqje5j8j_GQVAB6l7Mnr20mfCwi92dLa7cQ=s180-rw,"라프텔 - 애니 감상 및 취향저격 추천, 스트리밍",헬레니,2022-03-12 00:00:00+09:00,5,0,올해 가장 잘 한일. 라프텔 구독. (판권만료는 가끔가다 쓰읍..),android
https://play-lh.googleusercontent.com/w8xd-eZ2_G9YnS4q6ITfoCzWOnXTE2gNqje5j8j_GQVAB6l7Mnr20mfCwi92dLa7cQ=s180-rw,"라프텔 - 애니 감상 및 취향저격 추천, 스트리밍",장예준,2022-03-12 00:00:00+09:00,5,0,광고가 쫌금 만타,android
https://play-lh.googleusercontent.com/w8xd-eZ2_G9YnS4q6ITfoCzWOnXTE2gNqje5j8j_GQVAB6l7Mnr20mfCwi92dLa7cQ=s180-rw,"라프텔 - 애니 감상 및 취향저격 추천, 스트리밍",아모야ᅳᅳ,2022-03-12 00:00:00+09:00,3,0,Pc에서 카카오톡 계정으로 구매했는데 앱에서는 카카오톡 로그인이 로딩버그 때문에 되지않네요,android
https://play-lh.googleusercontent.com/w8xd-eZ2_G9YnS4q6ITfoCzWOnXTE2gNqje5j8j_GQVAB6l7Mnr20mfCwi92dLa7cQ=s180-rw,"라프텔 - 애니 감상 및 취향저격 추천, 스트리밍",이한,2022-03-12 00:00:00+09:00,1,1,왜 카카오톡으로 로그인이 안되는거죠? 지웠다 깔아도 안되네요. 이럴거면 계정이라도 다른거로 바꾸게 해주시지요. 멤버쉽 가입하고 몇 달을 썼는데 이런 불편이 생겨서 아쉽네요.,android
https://play-lh.googleusercontent.com/w8xd-eZ2_G9YnS4q6ITfoCzWOnXTE2gNqje5j8j_GQVAB6l7Mnr20mfCwi92dLa7cQ=s180-rw,"라프텔 - 애니 감상 및 취향저격 추천, 스트리밍",백서안,2022-03-12 00:00:00+09:00,3,1,광고가 너무 많이 나오고 일부 애니들은 결재르르 해야 봏수있습니다 그리고 광고가 10초 아님 20초면 괜찮은데 30초 아님 1분씩 나와서 불편합니다ㅠㅠ,android
https://play-lh.googleusercontent.com/w8xd-eZ2_G9YnS4q6ITfoCzWOnXTE2gNqje5j8j_GQVAB6l7Mnr20mfCwi92dLa7cQ=s180-rw,"라프텔 - 애니 감상 및 취향저격 추천, 스트리밍",heejae kim,2022-03-12 00:00:00+09:00,5,0,애니 맞춤 추천 해주는 기능등 그런건 아주 만족,android
https://play-lh.googleusercontent.com/w8xd-eZ2_G9YnS4q6ITfoCzWOnXTE2gNqje5j8j_GQVAB6l7Mnr20mfCwi92dLa7cQ=s180-rw,"라프텔 - 애니 감상 및 취향저격 추천, 스트리밍",오렌지,2022-03-12 00:00:00+09:00,3,0,한달에 멤버십을 해도 판권을 따로 사야되는게 있는게 좀 그렇네요ㅜㅠㅠ또 판권 부활을 자주 해주면 좋겠어요 보고싶은건 다 볼 수 가없어서ㅠ,android
https://play-lh.googleusercontent.com/w8xd-eZ2_G9YnS4q6ITfoCzWOnXTE2gNqje5j8j_GQVAB6l7Mnr20mfCwi92dLa7cQ=s180-rw,"라프텔 - 애니 감상 및 취향저격 추천, 스트리밍",남이인성,2022-03-12 00:00:00+09:00,5,0,재미있어요,android
https://play-lh.googleusercontent.com/w8xd-eZ2_G9YnS4q6ITfoCzWOnXTE2gNqje5j8j_GQVAB6l7Mnr20mfCwi92dLa7cQ=s180-rw,"라프텔 - 애니 감상 및 취향저격 추천, 스트리밍",김동용,2022-03-12 00:00:00+09:00,5,0,좋아!,android
https://play-lh.googleusercontent.com/w8xd-eZ2_G9YnS4q6ITfoCzWOnXTE2gNqje5j8j_GQVAB6l7Mnr20mfCwi92dLa7cQ=s180-rw,"라프텔 - 애니 감상 및 취향저격 추천, 스트리밍",권미순,2022-03-12 00:00:00+09:00,2,1,너무 좋지만 무슨 영상을 12분보는데 광고가 3개나 나오네요;;; 그냥 차라리 유료앱이라고 해도 과언이 안될거에요,android
https://play-lh.googleusercontent.com/w8xd-eZ2_G9YnS4q6ITfoCzWOnXTE2gNqje5j8j_GQVAB6l7Mnr20mfCwi92dLa7cQ=s180-rw,"라프텔 - 애니 감상 및 취향저격 추천, 스트리밍",ソヒ,2022-03-12 00:00:00+09:00,5,0,너무 재밌습니다!!,android
https://play-lh.googleusercontent.com/w8xd-eZ2_G9YnS4q6ITfoCzWOnXTE2gNqje5j8j_GQVAB6l7Mnr20mfCwi92dLa7cQ=s180-rw,"라프텔 - 애니 감상 및 취향저격 추천, 스트리밍",저 새끼 뭐야?,2022-03-12 00:00:00+09:00,1,0,원래 카드결제 19번 클릭하면 문상결제 나오던거 았었는데 왜없어짐?,android
https://play-lh.googleusercontent.com/w8xd-eZ2_G9YnS4q6ITfoCzWOnXTE2gNqje5j8j_GQVAB6l7Mnr20mfCwi92dLa7cQ=s180-rw,"라프텔 - 애니 감상 및 취향저격 추천, 스트리밍",쀼딧,2022-03-12 00:00:00+09:00,1,0,오랜만에 애니 보고싶어서 카카오로 재로그인 하는데 카카오 로그인창이 아예 안켜지네요. ;,android
https://play-lh.googleusercontent.com/w8xd-eZ2_G9YnS4q6ITfoCzWOnXTE2gNqje5j8j_GQVAB6l7Mnr20mfCwi92dLa7cQ=s180-rw,"라프텔 - 애니 감상 및 취향저격 추천, 스트리밍",총옗,2022-03-12 00:00:00+09:00,1,0,솔직히 왜 사람들이 갓프텔 갓프텔 거리는지 1도 모르겠음 진짜 폰 문제도 아니고 자꾸 오류 떴다 아님 일치한 정보가 아니라고 하는데 다시봐도 여리봐도 맞는 정본데 자꾸 그런 문자만 뜨고 뭘 볼 수가 없네염 어디 다른 앱에 이런 오류 고치는 방법 이렇게 저렇게도 해봤는데 안고치는 갓망텔 역시 대단합니당 그리고 결제해도 오류 때문인지 모르겠지만 ㅋㅋㅋㅋㅋ 아니 장난하시나요 작은 돈이지만 제 돈 돌려내요 환불도 어떻게 할려해도 안돼겅 결제했는데 뭘 못보는건 뭔 경우죵 ㅇㅡㅇ 로그인도 다했고욤,android
https://play-lh.googleusercontent.com/w8xd-eZ2_G9YnS4q6ITfoCzWOnXTE2gNqje5j8j_GQVAB6l7Mnr20mfCwi92dLa7cQ=s180-rw,"라프텔 - 애니 감상 및 취향저격 추천, 스트리밍",동인쌤 STYLE,2022-03-12 00:00:00+09:00,5,0,19금 볼 때 검열이 많은 것 빼고는 다 좋네요,android
https://play-lh.googleusercontent.com/w8xd-eZ2_G9YnS4q6ITfoCzWOnXTE2gNqje5j8j_GQVAB6l7Mnr20mfCwi92dLa7cQ=s180-rw,"라프텔 - 애니 감상 및 취향저격 추천, 스트리밍",남두선,2022-03-12 00:00:00+09:00,1,0,돈네야 함 ㅅㄱ,android
https://play-lh.googleusercontent.com/w8xd-eZ2_G9YnS4q6ITfoCzWOnXTE2gNqje5j8j_GQVAB6l7Mnr20mfCwi92dLa7cQ=s180-rw,"라프텔 - 애니 감상 및 취향저격 추천, 스트리밍",류설,2022-03-12 00:00:00+09:00,5,0,굿!!,android
https://play-lh.googleusercontent.com/w8xd-eZ2_G9YnS4q6ITfoCzWOnXTE2gNqje5j8j_GQVAB6l7Mnr20mfCwi92dLa7cQ=s180-rw,"라프텔 - 애니 감상 및 취향저격 추천, 스트리밍",김예인,2022-03-12 00:00:00+09:00,5,0,오~~넘 죠아영,android
https://play-lh.googleusercontent.com/w8xd-eZ2_G9YnS4q6ITfoCzWOnXTE2gNqje5j8j_GQVAB6l7Mnr20mfCwi92dLa7cQ=s180-rw,"라프텔 - 애니 감상 및 취향저격 추천, 스트리밍",리니,2022-03-12 00:00:00+09:00,1,0,광고엔 무료라고 했으면서 설치해 보니까 왜 유료임? 어이가 없네,android
https://play-lh.googleusercontent.com/w8xd-eZ2_G9YnS4q6ITfoCzWOnXTE2gNqje5j8j_GQVAB6l7Mnr20mfCwi92dLa7cQ=s180-rw,"라프텔 - 애니 감상 및 취향저격 추천, 스트리밍",이현주,2022-03-12 00:00:00+09:00,1,1,이겜인성 무엇?이거 계속 무지성으로 광고 나와서 겜하다가 걍 지알아서 튕김 니들때매 내 승급전 날리면 책임 질거냐? 후..,android
https://play-lh.googleusercontent.com/w8xd-eZ2_G9YnS4q6ITfoCzWOnXTE2gNqje5j8j_GQVAB6l7Mnr20mfCwi92dLa7cQ=s180-rw,"라프텔 - 애니 감상 및 취향저격 추천, 스트리밍",하트뿅,2022-03-12 00:00:00+09:00,4,0,업데이트 괜히함 계속 중간에 오류뜨고 튕김.. 업데이트하면 좋아지나 햇더니 ㅠㅠ똥망,android
https://play-lh.googleusercontent.com/w8xd-eZ2_G9YnS4q6ITfoCzWOnXTE2gNqje5j8j_GQVAB6l7Mnr20mfCwi92dLa7cQ=s180-rw,"라프텔 - 애니 감상 및 취향저격 추천, 스트리밍",여박명자,2022-03-12 00:00:00+09:00,5,0,너무 좋은 데 한 애니에 6번은 나오는 것 같아요. 광고 조금씩 나오게 해주세요.,android
https://play-lh.googleusercontent.com/w8xd-eZ2_G9YnS4q6ITfoCzWOnXTE2gNqje5j8j_GQVAB6l7Mnr20mfCwi92dLa7cQ=s180-rw,"라프텔 - 애니 감상 및 취향저격 추천, 스트리밍",현준,2022-03-12 00:00:00+09:00,4,0,좋아요,android
https://play-lh.googleusercontent.com/w8xd-eZ2_G9YnS4q6ITfoCzWOnXTE2gNqje5j8j_GQVAB6l7Mnr20mfCwi92dLa7cQ=s180-rw,"라프텔 - 애니 감상 및 취향저격 추천, 스트리밍",완이,2022-03-12 00:00:00+09:00,3,0,애니 볼 수 잇는건 좋은데 가끔 들어갈 때 몇초 로딩이 되고 바로 홈화면으로 나와지더라구요.저번에는 해결햇는데 이번에는 지웟다가 깔아도 안들어가지네요..,android
https://play-lh.googleusercontent.com/w8xd-eZ2_G9YnS4q6ITfoCzWOnXTE2gNqje5j8j_GQVAB6l7Mnr20mfCwi92dLa7cQ=s180-rw,"라프텔 - 애니 감상 및 취향저격 추천, 스트리밍",송우진,2022-03-11 00:00:00+09:00,1,0,로그인이 안된다고요 설명이라도 해봐요,android
https://play-lh.googleusercontent.com/w8xd-eZ2_G9YnS4q6ITfoCzWOnXTE2gNqje5j8j_GQVAB6l7Mnr20mfCwi92dLa7cQ=s180-rw,"라프텔 - 애니 감상 및 취향저격 추천, 스트리밍",봉봉,2022-03-11 00:00:00+09:00,5,0,꺅진자..익잔아 넘 쓰기도편하구 짱좋다니간 저 지금 엄청 오래쓰고잇어요 가격도 비싸지두안코......넘짱짱조음 그리거 제가 찾던거 거의 다 잇어서 넘조아요 다른곳은업엇단말이애응에,android
https://play-lh.googleusercontent.com/w8xd-eZ2_G9YnS4q6ITfoCzWOnXTE2gNqje5j8j_GQVAB6l7Mnr20mfCwi92dLa7cQ=s180-rw,"라프텔 - 애니 감상 및 취향저격 추천, 스트리밍",허금별,2022-03-11 00:00:00+09:00,3,6,비밀번호를 까먹어서 비밀번호 찾기를 눌렀는데 뭔 변화가 없어요 하루 빨리 다시 라프털을 볼 수 있으면 좋겠습니다...ㅠ,android
https://play-lh.googleusercontent.com/w8xd-eZ2_G9YnS4q6ITfoCzWOnXTE2gNqje5j8j_GQVAB6l7Mnr20mfCwi92dLa7cQ=s180-rw,"라프텔 - 애니 감상 및 취향저격 추천, 스트리밍",김지명,2022-03-11 00:00:00+09:00,1,1,안 들어가져요 완전망했음....,android
https://play-lh.googleusercontent.com/w8xd-eZ2_G9YnS4q6ITfoCzWOnXTE2gNqje5j8j_GQVAB6l7Mnr20mfCwi92dLa7cQ=s180-rw,"라프텔 - 애니 감상 및 취향저격 추천, 스트리밍",서,2022-03-11 00:00:00+09:00,1,1,일주일에 한두번 꼴로 앱실행 자체가 안되는 현상발생,android
https://play-lh.googleusercontent.com/w8xd-eZ2_G9YnS4q6ITfoCzWOnXTE2gNqje5j8j_GQVAB6l7Mnr20mfCwi92dLa7cQ=s180-rw,"라프텔 - 애니 감상 및 취향저격 추천, 스트리밍",박수연,2022-03-11 00:00:00+09:00,4,0,광고는만치만그래두재미있어요근데라프텔십이너무만아요,android
https://play-lh.googleusercontent.com/w8xd-eZ2_G9YnS4q6ITfoCzWOnXTE2gNqje5j8j_GQVAB6l7Mnr20mfCwi92dLa7cQ=s180-rw,"라프텔 - 애니 감상 및 취향저격 추천, 스트리밍",뭘봐,2022-03-11 00:00:00+09:00,5,0,다좋은데 멤버십 1인과 4인 말고 2인도 만들어 주시면 안될까요? 동생이랑 단둘이 사용하는데 4인 말고 2인이 필요해서요. 만약 2인 멤버십 추가가 가능하시다면 한번 부탁합니다... 그거말곤 다좋은거 같습니다. ^^,android
https://play-lh.googleusercontent.com/w8xd-eZ2_G9YnS4q6ITfoCzWOnXTE2gNqje5j8j_GQVAB6l7Mnr20mfCwi92dLa7cQ=s180-rw,"라프텔 - 애니 감상 및 취향저격 추천, 스트리밍",아 뭘째려봐 ᄏ,2022-03-11 00:00:00+09:00,2,1,볼려고 애니에들어가자마자 광고가나오고 또 몇분도 안돼서 광고나오고요 화질도 멤버십?해야되고 광고도 안볼려면 멤버십해야돼서 좀 짜증이나네요,android
https://play-lh.googleusercontent.com/w8xd-eZ2_G9YnS4q6ITfoCzWOnXTE2gNqje5j8j_GQVAB6l7Mnr20mfCwi92dLa7cQ=s180-rw,"라프텔 - 애니 감상 및 취향저격 추천, 스트리밍",시안,2022-03-11 00:00:00+09:00,5,0,"넷플에 애니가 많이 없어서 끊고 라프텔 끊은바로 후회는 안하고있습니다. 다만, 소형 플레이어로 전환하고 보고있을때 한화가 끝나면 플레이어가 꺼지는게 좀 불만이네요..",android
https://play-lh.googleusercontent.com/w8xd-eZ2_G9YnS4q6ITfoCzWOnXTE2gNqje5j8j_GQVAB6l7Mnr20mfCwi92dLa7cQ=s180-rw,"라프텔 - 애니 감상 및 취향저격 추천, 스트리밍",ppy ha,2022-03-11 00:00:00+09:00,4,0,갑자기 안 들어가집니다,android
https://play-lh.googleusercontent.com/w8xd-eZ2_G9YnS4q6ITfoCzWOnXTE2gNqje5j8j_GQVAB6l7Mnr20mfCwi92dLa7cQ=s180-rw,"라프텔 - 애니 감상 및 취향저격 추천, 스트리밍",김채윤,2022-03-11 00:00:00+09:00,1,0,아니 앱이 자꾸 튕겨서 지우고 다시 깔았는데도 안되고 계속 튕기기만해서 짜증남,android
https://play-lh.googleusercontent.com/w8xd-eZ2_G9YnS4q6ITfoCzWOnXTE2gNqje5j8j_GQVAB6l7Mnr20mfCwi92dLa7cQ=s180-rw,"라프텔 - 애니 감상 및 취향저격 추천, 스트리밍",오다연,2022-03-11 00:00:00+09:00,4,0,이거 왜 인증번호가 않오는건가요?,android
https://play-lh.googleusercontent.com/w8xd-eZ2_G9YnS4q6ITfoCzWOnXTE2gNqje5j8j_GQVAB6l7Mnr20mfCwi92dLa7cQ=s180-rw,"라프텔 - 애니 감상 및 취향저격 추천, 스트리밍",조현철,2022-03-11 00:00:00+09:00,5,0,ㅅㅅ좋아용,android
https://play-lh.googleusercontent.com/w8xd-eZ2_G9YnS4q6ITfoCzWOnXTE2gNqje5j8j_GQVAB6l7Mnr20mfCwi92dLa7cQ=s180-rw,"라프텔 - 애니 감상 및 취향저격 추천, 스트리밍",박하민,2022-03-11 00:00:00+09:00,2,0,19세나 청불인데 장면편집이나 모자이크처리가 너무 많아요 그럴거면 19세를 왜 하셨는지 모르겠네요 이것만 고치면별점 5점입니다,android
https://play-lh.googleusercontent.com/w8xd-eZ2_G9YnS4q6ITfoCzWOnXTE2gNqje5j8j_GQVAB6l7Mnr20mfCwi92dLa7cQ=s180-rw,"라프텔 - 애니 감상 및 취향저격 추천, 스트리밍",진혜정,2022-03-10 00:00:00+09:00,5,0,좋네요 재미고,android
https://play-lh.googleusercontent.com/w8xd-eZ2_G9YnS4q6ITfoCzWOnXTE2gNqje5j8j_GQVAB6l7Mnr20mfCwi92dLa7cQ=s180-rw,"라프텔 - 애니 감상 및 취향저격 추천, 스트리밍",이현준,2022-03-10 00:00:00+09:00,2,0,라노벨이나 원작 만화 관심 하나도 없습니다. 작품 들어갈때마다 화면 하단에 알림 생기고 상담 목록이라며 광고마냥 누적되는데 정작 차단하는 기능조차 없으니 작품 감상도 전에 뭣같은 광고부터 보는것 같네요ㅎㅎ,android
https://play-lh.googleusercontent.com/w8xd-eZ2_G9YnS4q6ITfoCzWOnXTE2gNqje5j8j_GQVAB6l7Mnr20mfCwi92dLa7cQ=s180-rw,"라프텔 - 애니 감상 및 취향저격 추천, 스트리밍",넥터,2022-03-10 00:00:00+09:00,1,52,"원하는 작품이 모두 판권이 만료랍니다. 이럴꺼면 왜 결제해야 되는지도 모르겠습니다. 제가 1~2개 찾아본것이 아닌 벤10시리즈,유희왕시리즈,흑의계약자시리즈,제로의사역마시리즈 모두 일부 원하는 작품들이 판권이 만료되어 시청 불가능 합니다. 고전 애니를 즐기는 사람으로 이 앱의 이용가치가 아예 존재하지 않습니다.",android
https://play-lh.googleusercontent.com/w8xd-eZ2_G9YnS4q6ITfoCzWOnXTE2gNqje5j8j_GQVAB6l7Mnr20mfCwi92dLa7cQ=s180-rw,"라프텔 - 애니 감상 및 취향저격 추천, 스트리밍",이형세,2022-03-10 00:00:00+09:00,4,0,그런대이거 카드결제하면 계속 돈나감,android
https://play-lh.googleusercontent.com/w8xd-eZ2_G9YnS4q6ITfoCzWOnXTE2gNqje5j8j_GQVAB6l7Mnr20mfCwi92dLa7cQ=s180-rw,"라프텔 - 애니 감상 및 취향저격 추천, 스트리밍",김아린,2022-03-10 00:00:00+09:00,5,0,재미있다,android
https://play-lh.googleusercontent.com/w8xd-eZ2_G9YnS4q6ITfoCzWOnXTE2gNqje5j8j_GQVAB6l7Mnr20mfCwi92dLa7cQ=s180-rw,"라프텔 - 애니 감상 및 취향저격 추천, 스트리밍",비올레트,2022-03-10 00:00:00+09:00,5,0,라프텔 없인 한시도 못 살아요. 꾸준한 신작 업데이트 기대할게요 감사합니다,android
https://play-lh.googleusercontent.com/w8xd-eZ2_G9YnS4q6ITfoCzWOnXTE2gNqje5j8j_GQVAB6l7Mnr20mfCwi92dLa7cQ=s180-rw,"라프텔 - 애니 감상 및 취향저격 추천, 스트리밍",최댕댕,2022-03-10 00:00:00+09:00,2,0,이게 광고지 휴식시간 인가요..,android
https://play-lh.googleusercontent.com/w8xd-eZ2_G9YnS4q6ITfoCzWOnXTE2gNqje5j8j_GQVAB6l7Mnr20mfCwi92dLa7cQ=s180-rw,"라프텔 - 애니 감상 및 취향저격 추천, 스트리밍",토토로,2022-03-10 00:00:00+09:00,5,0,저 카카오톡으로회원가입할려는데 로딩이좀길어요ㅜㅠ그거말고는 다괜찮은데ㅜㅜ,android
https://play-lh.googleusercontent.com/w8xd-eZ2_G9YnS4q6ITfoCzWOnXTE2gNqje5j8j_GQVAB6l7Mnr20mfCwi92dLa7cQ=s180-rw,"라프텔 - 애니 감상 및 취향저격 추천, 스트리밍",윤아중,2022-03-10 00:00:00+09:00,3,0,이메일로 로그인을 하는데 등록되지 않은 이메일이라면서 로그인이 막힙니다,android
https://play-lh.googleusercontent.com/w8xd-eZ2_G9YnS4q6ITfoCzWOnXTE2gNqje5j8j_GQVAB6l7Mnr20mfCwi92dLa7cQ=s180-rw,"라프텔 - 애니 감상 및 취향저격 추천, 스트리밍",이선욱,2022-03-09 00:00:00+09:00,4,0,계속 튕겨요,android
https://play-lh.googleusercontent.com/w8xd-eZ2_G9YnS4q6ITfoCzWOnXTE2gNqje5j8j_GQVAB6l7Mnr20mfCwi92dLa7cQ=s180-rw,"라프텔 - 애니 감상 및 취향저격 추천, 스트리밍",가오리,2022-03-09 00:00:00+09:00,5,0,👍,android
https://play-lh.googleusercontent.com/w8xd-eZ2_G9YnS4q6ITfoCzWOnXTE2gNqje5j8j_GQVAB6l7Mnr20mfCwi92dLa7cQ=s180-rw,"라프텔 - 애니 감상 및 취향저격 추천, 스트리밍",백은선,2022-03-09 00:00:00+09:00,5,0,👍,android
https://play-lh.googleusercontent.com/w8xd-eZ2_G9YnS4q6ITfoCzWOnXTE2gNqje5j8j_GQVAB6l7Mnr20mfCwi92dLa7cQ=s180-rw,"라프텔 - 애니 감상 및 취향저격 추천, 스트리밍",최강현,2022-03-09 00:00:00+09:00,5,0,굿,android
