APP_IMG,APP_NAME,USER,DATE,STAR,LIKE,COMMENT,OS
https://play-lh.googleusercontent.com/W43xj43ErMIs5BQgCdMKEa0NXCoUUW8DjQc5SxcDfLrC26H8sHDmoFIUWLYmsQahpo0=s180-rw,카카오페이,jaebeom cho,2022-01-29 00:00:00+09:00,3,54,"사용자 환경이 좀 더 직관적으로 바뀌어야 될 것 같습니다. 솔직히 카카오페이(카카오페이증권)에서 뭔가 획기적인 앱을 만들거라 기대했는데.. 써본 느낌으로는 솔직히 토스, 미니스탁보다도 디자인이나 사용자 환경이 많이 떨어집니다. 직관적이지도 않고 군더더기만 많은 느낌입니다. 굳이 주식투자자들이 기존에 사용하던 증권 어플들을 버리고 이동해야 할 메리트가 느껴지지 않습니다;; 국민들이 카카오에 바라는 눈높이에 맞게, 카카오페이 앱의 사용자 환경도 전반적으로 확 개선되어야 할 듯 합니다.(개인적으로 webull처럼 직관적이면 좋겠습니다.)...전체 리뷰",android
https://play-lh.googleusercontent.com/W43xj43ErMIs5BQgCdMKEa0NXCoUUW8DjQc5SxcDfLrC26H8sHDmoFIUWLYmsQahpo0=s180-rw,카카오페이,Da Nan,2022-01-29 00:00:00+09:00,3,90,결제용 앱... 그냥 간단하게 결제할 때만 사용해야되는 앱. 카카오페이 앱이지만 일부 기능은 카카오톡으로 가야 이용 가능. 심지어 메뉴조차 없어 이용 불가능한 기능도 존재... 메인에 즐겨찾기 기능 이외에 전체 기능을 찾기 힘든 디자인이라고 생각함. 그냥 카카오톡에 있는 페이 정도가 제일 적당하다고 생각함.,android
https://play-lh.googleusercontent.com/W43xj43ErMIs5BQgCdMKEa0NXCoUUW8DjQc5SxcDfLrC26H8sHDmoFIUWLYmsQahpo0=s180-rw,카카오페이,테레사미소,2022-01-29 00:00:00+09:00,1,0,도대체가 뭐가 휴먼계정이라고 나오는데 비번 재설정해도 없다고 하면서 계속 휴먼계정이라고만 뜨고 어쩌라는건지,android
https://play-lh.googleusercontent.com/W43xj43ErMIs5BQgCdMKEa0NXCoUUW8DjQc5SxcDfLrC26H8sHDmoFIUWLYmsQahpo0=s180-rw,카카오페이,김진희,2022-01-29 00:00:00+09:00,2,0,로그인이 어렵다,android
https://play-lh.googleusercontent.com/W43xj43ErMIs5BQgCdMKEa0NXCoUUW8DjQc5SxcDfLrC26H8sHDmoFIUWLYmsQahpo0=s180-rw,카카오페이,Peter Z,2022-01-29 00:00:00+09:00,2,1,"토스,네이버페이보다 내용이나 기술적으로나 많이 뒤쳐진다. 증권은 베타버전치고는 괜찮던데 이것부터 제대로 만들어보고, 페이 앱 전반적으로도 개선시켜 나가길.",android
https://play-lh.googleusercontent.com/W43xj43ErMIs5BQgCdMKEa0NXCoUUW8DjQc5SxcDfLrC26H8sHDmoFIUWLYmsQahpo0=s180-rw,카카오페이,영순김,2022-01-29 00:00:00+09:00,5,0,좋아요 ^^,android
https://play-lh.googleusercontent.com/W43xj43ErMIs5BQgCdMKEa0NXCoUUW8DjQc5SxcDfLrC26H8sHDmoFIUWLYmsQahpo0=s180-rw,카카오페이,Jayden,2022-01-28 00:00:00+09:00,1,0,아... 이거 미장 애프터마켓 거래불가입니까... 아.... 젠장,android
https://play-lh.googleusercontent.com/W43xj43ErMIs5BQgCdMKEa0NXCoUUW8DjQc5SxcDfLrC26H8sHDmoFIUWLYmsQahpo0=s180-rw,카카오페이,홍지혜,2022-01-28 00:00:00+09:00,2,2,문제가 생겼어요 본인인증하면 카카오계정 이미 연결되있다고 그걸로 로그인하라카고 카카오계정으로 로그인할라카면 본인인증하라하고 뒷골이 ..,android
https://play-lh.googleusercontent.com/W43xj43ErMIs5BQgCdMKEa0NXCoUUW8DjQc5SxcDfLrC26H8sHDmoFIUWLYmsQahpo0=s180-rw,카카오페이,유소리,2022-01-28 00:00:00+09:00,1,11,이번에 무슨일이죠.. 제 폰에서만 계속 알수없는 오류로 접근할 수 없는걸까요ㅠㅠ 카카오페이.. 증권사맞는거죠??? 돈...조회도 버퍼걸려서 보기어렵고.. 미니금고에넣는것도 에러 5번은 넘게걸린거같고.. 송금도...지금안되서..하다하다ㅠㅠ 앱평가 남깁니다ㅠ,android
https://play-lh.googleusercontent.com/W43xj43ErMIs5BQgCdMKEa0NXCoUUW8DjQc5SxcDfLrC26H8sHDmoFIUWLYmsQahpo0=s180-rw,카카오페이,주수열,2022-01-28 00:00:00+09:00,1,4,현재 안드로이드12(one ui 4.0)인데 잔액 충전시 알수없는 오류가뜨면서 3ㅡ4번 앱재실행해야 제대로되네요. 불편해서 이제 토스로 넘어가야겟어요.,android
https://play-lh.googleusercontent.com/W43xj43ErMIs5BQgCdMKEa0NXCoUUW8DjQc5SxcDfLrC26H8sHDmoFIUWLYmsQahpo0=s180-rw,카카오페이,최영광,2022-01-28 00:00:00+09:00,5,0,Perfect,android
https://play-lh.googleusercontent.com/W43xj43ErMIs5BQgCdMKEa0NXCoUUW8DjQc5SxcDfLrC26H8sHDmoFIUWLYmsQahpo0=s180-rw,카카오페이,KY Y,2022-01-27 00:00:00+09:00,4,15,"다른기능은 별로 필요없고 주식거래에 집중하고싶은데요. 증권앱 별도로 만들지는 않을테고, 초기화면을 선택하게 해주세요. 앱 켜고 주식탭 따로 누르기 귀찮아요",android
https://play-lh.googleusercontent.com/W43xj43ErMIs5BQgCdMKEa0NXCoUUW8DjQc5SxcDfLrC26H8sHDmoFIUWLYmsQahpo0=s180-rw,카카오페이,전현진,2022-01-27 00:00:00+09:00,1,0,알수없는 오류가 너무뜹니다,android
https://play-lh.googleusercontent.com/W43xj43ErMIs5BQgCdMKEa0NXCoUUW8DjQc5SxcDfLrC26H8sHDmoFIUWLYmsQahpo0=s180-rw,카카오페이,김정은,2022-01-27 00:00:00+09:00,1,0,"돈 금액이 이상한데 무슨오류인가요? 10만원 송금받고 알리워드 -16원 하고 +35원인데 잔액이 99,984원 뭐죠?",android
https://play-lh.googleusercontent.com/W43xj43ErMIs5BQgCdMKEa0NXCoUUW8DjQc5SxcDfLrC26H8sHDmoFIUWLYmsQahpo0=s180-rw,카카오페이,박태일,2022-01-27 00:00:00+09:00,5,0,쓰기도편리하고 다양한혜택이 많이 좋아요~,android
https://play-lh.googleusercontent.com/W43xj43ErMIs5BQgCdMKEa0NXCoUUW8DjQc5SxcDfLrC26H8sHDmoFIUWLYmsQahpo0=s180-rw,카카오페이,김대표,2022-01-26 00:00:00+09:00,5,0,편리하게 잘사용하고있어요,android
https://play-lh.googleusercontent.com/W43xj43ErMIs5BQgCdMKEa0NXCoUUW8DjQc5SxcDfLrC26H8sHDmoFIUWLYmsQahpo0=s180-rw,카카오페이,문준영,2022-01-25 00:00:00+09:00,1,0,카카오페이 증권 만 사용하고 있었는데 첫 화면에서 사랴졌어요,android
https://play-lh.googleusercontent.com/W43xj43ErMIs5BQgCdMKEa0NXCoUUW8DjQc5SxcDfLrC26H8sHDmoFIUWLYmsQahpo0=s180-rw,카카오페이,o v o,2022-01-25 00:00:00+09:00,1,7,도대체 왜 휴대폰에서만 사용이 가능하다는 건지... 아이패드에서 이용이 불가능해 너무 불편하네요. 안드로이드는 아이패드 쓰지 말라는 건가 싶기도 하고요.,android
https://play-lh.googleusercontent.com/W43xj43ErMIs5BQgCdMKEa0NXCoUUW8DjQc5SxcDfLrC26H8sHDmoFIUWLYmsQahpo0=s180-rw,카카오페이,서정민,2022-01-25 00:00:00+09:00,5,0,조으다,android
https://play-lh.googleusercontent.com/W43xj43ErMIs5BQgCdMKEa0NXCoUUW8DjQc5SxcDfLrC26H8sHDmoFIUWLYmsQahpo0=s180-rw,카카오페이,김대호,2022-01-25 00:00:00+09:00,1,0,하루종일 깔고있어?,android
https://play-lh.googleusercontent.com/W43xj43ErMIs5BQgCdMKEa0NXCoUUW8DjQc5SxcDfLrC26H8sHDmoFIUWLYmsQahpo0=s180-rw,카카오페이,중수유튜브,2022-01-25 00:00:00+09:00,2,0,주민등록 메시지 안옴 안와서뭐임 고치세요,android
https://play-lh.googleusercontent.com/W43xj43ErMIs5BQgCdMKEa0NXCoUUW8DjQc5SxcDfLrC26H8sHDmoFIUWLYmsQahpo0=s180-rw,카카오페이,김진국,2022-01-25 00:00:00+09:00,5,0,기초생활수급자지정,android
https://play-lh.googleusercontent.com/W43xj43ErMIs5BQgCdMKEa0NXCoUUW8DjQc5SxcDfLrC26H8sHDmoFIUWLYmsQahpo0=s180-rw,카카오페이,조보근,2022-01-24 00:00:00+09:00,5,0,굿,android
https://play-lh.googleusercontent.com/W43xj43ErMIs5BQgCdMKEa0NXCoUUW8DjQc5SxcDfLrC26H8sHDmoFIUWLYmsQahpo0=s180-rw,카카오페이,킴카일,2022-01-24 00:00:00+09:00,1,0,펀드 서비스 시작하고 코로나 떡락 오더니... 주식 서비스 시작 시점도 기가 막히네,android
https://play-lh.googleusercontent.com/W43xj43ErMIs5BQgCdMKEa0NXCoUUW8DjQc5SxcDfLrC26H8sHDmoFIUWLYmsQahpo0=s180-rw,카카오페이,정광엽,2022-01-24 00:00:00+09:00,3,1,펀드투자한게 안보요어케하는지모르겠어요,android
https://play-lh.googleusercontent.com/W43xj43ErMIs5BQgCdMKEa0NXCoUUW8DjQc5SxcDfLrC26H8sHDmoFIUWLYmsQahpo0=s180-rw,카카오페이,해남윤씨,2022-01-23 00:00:00+09:00,1,1,카카오페이 펀드 알모으기로 이용중이었는데 왜 갑자기 안보이게되었죠? 얼마나 모였는지 보려고 들어갔는데 찾지도 못하고 아예 안보이더군요.,android
https://play-lh.googleusercontent.com/W43xj43ErMIs5BQgCdMKEa0NXCoUUW8DjQc5SxcDfLrC26H8sHDmoFIUWLYmsQahpo0=s180-rw,카카오페이,강수영,2022-01-23 00:00:00+09:00,4,0,넘나 편리해서 이용하기가 좋아요,android
https://play-lh.googleusercontent.com/W43xj43ErMIs5BQgCdMKEa0NXCoUUW8DjQc5SxcDfLrC26H8sHDmoFIUWLYmsQahpo0=s180-rw,카카오페이,루씨앗,2022-01-23 00:00:00+09:00,1,4,변경된 사항들 때문에 못 쓰겠네요 쉽게 바뀐다면서 무슨 어렵게 바뀌고 있어요 간편결제 외에는 안 쓸것 같습니다 차라리 업데이트 안 했을 때가 훨씬 좋았던 것 같네요,android
https://play-lh.googleusercontent.com/W43xj43ErMIs5BQgCdMKEa0NXCoUUW8DjQc5SxcDfLrC26H8sHDmoFIUWLYmsQahpo0=s180-rw,카카오페이,wv wv,2022-01-22 00:00:00+09:00,1,0,아니 왜 카카오페이 로그인이 안되는건가요 ㅆ 발 시키는 대로 다 했는데,android
https://play-lh.googleusercontent.com/W43xj43ErMIs5BQgCdMKEa0NXCoUUW8DjQc5SxcDfLrC26H8sHDmoFIUWLYmsQahpo0=s180-rw,카카오페이,리사마리李,2022-01-22 00:00:00+09:00,5,0,너무너무좋은거야,android
https://play-lh.googleusercontent.com/W43xj43ErMIs5BQgCdMKEa0NXCoUUW8DjQc5SxcDfLrC26H8sHDmoFIUWLYmsQahpo0=s180-rw,카카오페이,김동호,2022-01-22 00:00:00+09:00,1,0,카카오페이몇백만원쌓아도한푼도 못사용 해 카카오 사용자 기만 하고 있습니다 카카오 김회장 사용하면서,android
https://play-lh.googleusercontent.com/W43xj43ErMIs5BQgCdMKEa0NXCoUUW8DjQc5SxcDfLrC26H8sHDmoFIUWLYmsQahpo0=s180-rw,카카오페이,Bei•ᴗ•,2022-01-22 00:00:00+09:00,1,0,업데이트 후 최악임 불편해서 못쓰겠음 이전버전으로 돌려줘요,android
https://play-lh.googleusercontent.com/W43xj43ErMIs5BQgCdMKEa0NXCoUUW8DjQc5SxcDfLrC26H8sHDmoFIUWLYmsQahpo0=s180-rw,카카오페이,Stepp Hong,2022-01-22 00:00:00+09:00,1,0,"카카오투자는 어디서봐야하나요,,,?",android
https://play-lh.googleusercontent.com/W43xj43ErMIs5BQgCdMKEa0NXCoUUW8DjQc5SxcDfLrC26H8sHDmoFIUWLYmsQahpo0=s180-rw,카카오페이,지우개,2022-01-21 00:00:00+09:00,1,0,아니 주식좀해보려고 신분증인증해서 계좌도만들었구만 신분증미인증계좌라고 들어가질못하네ㅋㅋㅋㅋㅋ,android
https://play-lh.googleusercontent.com/W43xj43ErMIs5BQgCdMKEa0NXCoUUW8DjQc5SxcDfLrC26H8sHDmoFIUWLYmsQahpo0=s180-rw,카카오페이,저기저편,2022-01-21 00:00:00+09:00,1,0,미니금고 입출금 못 함?,android
https://play-lh.googleusercontent.com/W43xj43ErMIs5BQgCdMKEa0NXCoUUW8DjQc5SxcDfLrC26H8sHDmoFIUWLYmsQahpo0=s180-rw,카카오페이,정진현,2022-01-21 00:00:00+09:00,1,5,고객센터 전화좀 받어라 ㅋㅋ 궁금증이 생김→알아먹기 어려운 안내→고객센터 전화→아침10시부터 오후4시까지 틈만나면 전화→통화량이 많아 연결안됨,android
https://play-lh.googleusercontent.com/W43xj43ErMIs5BQgCdMKEa0NXCoUUW8DjQc5SxcDfLrC26H8sHDmoFIUWLYmsQahpo0=s180-rw,카카오페이,강기혁,2022-01-21 00:00:00+09:00,2,0,앱 내에서 메뉴 로드가 너무 오래 걸리고 안 되는 경우가 많음,android
https://play-lh.googleusercontent.com/W43xj43ErMIs5BQgCdMKEa0NXCoUUW8DjQc5SxcDfLrC26H8sHDmoFIUWLYmsQahpo0=s180-rw,카카오페이,이진혁,2022-01-21 00:00:00+09:00,1,0,카카오페이 이용을 못해요 고객센터 문의해도 메크로 답변만 돌아오고...,android
https://play-lh.googleusercontent.com/W43xj43ErMIs5BQgCdMKEa0NXCoUUW8DjQc5SxcDfLrC26H8sHDmoFIUWLYmsQahpo0=s180-rw,카카오페이,샤라랴,2022-01-21 00:00:00+09:00,1,2,아니 지금 카카오페이 인증자체가 안되여 거기다 어플 뜨는 속도도 너무느리고 ㅡㅡ 업비트관련된 부분을 여러번 시도해도 안되는데 미치겠네여,android
https://play-lh.googleusercontent.com/W43xj43ErMIs5BQgCdMKEa0NXCoUUW8DjQc5SxcDfLrC26H8sHDmoFIUWLYmsQahpo0=s180-rw,카카오페이,권빛,2022-01-21 00:00:00+09:00,1,2,카카오톡에서 송금 안되서 깔았더니 랙 엄청나고 되지도 않네 좀 고쳐요 제발. 카카오페이 다신 쓰나봐라 3일내내 안되네. 업데이트 했지 갤 20쓰지 껏다켜보고 다른거 다 되는데 왜 송금만 오류가 뜨냐구요.,android
https://play-lh.googleusercontent.com/W43xj43ErMIs5BQgCdMKEa0NXCoUUW8DjQc5SxcDfLrC26H8sHDmoFIUWLYmsQahpo0=s180-rw,카카오페이,젬송,2022-01-21 00:00:00+09:00,1,0,카카오펀드 어떻게 관리하나요? 기존 탭을 없애서 펀드 입금일 바꾸고 싶어도 못 바꾸게해놨네?,android
https://play-lh.googleusercontent.com/W43xj43ErMIs5BQgCdMKEa0NXCoUUW8DjQc5SxcDfLrC26H8sHDmoFIUWLYmsQahpo0=s180-rw,카카오페이,이의영,2022-01-21 00:00:00+09:00,1,32,업데이트할때마다 버퍼링. 혹시나 와이파이잡아서 해야하나생각되서 와이파이서 업데이트하는데도 매 한가지네요. 돈잔치하기 급급해서 기술쪽 업그레이드는 신경쓰기힘드신가봐요?,android
https://play-lh.googleusercontent.com/W43xj43ErMIs5BQgCdMKEa0NXCoUUW8DjQc5SxcDfLrC26H8sHDmoFIUWLYmsQahpo0=s180-rw,카카오페이,김기상,2022-01-20 00:00:00+09:00,5,0,편하고 좋은데 안되는 곳도 많은게 흠,android
https://play-lh.googleusercontent.com/W43xj43ErMIs5BQgCdMKEa0NXCoUUW8DjQc5SxcDfLrC26H8sHDmoFIUWLYmsQahpo0=s180-rw,카카오페이,김도석,2022-01-20 00:00:00+09:00,5,0,편리하다,android
https://play-lh.googleusercontent.com/W43xj43ErMIs5BQgCdMKEa0NXCoUUW8DjQc5SxcDfLrC26H8sHDmoFIUWLYmsQahpo0=s180-rw,카카오페이,두두두,2022-01-20 00:00:00+09:00,1,4,카카오페이 투자화면탭이 안열려요 자산관리탭은 보이는데 새로개선한게 안보이게 해놓은건지.... 펀드를 사지도못하고 팔지도못하고.... 웨뷰제거해도 안되요 언제고쳐지는거죠?,android
https://play-lh.googleusercontent.com/W43xj43ErMIs5BQgCdMKEa0NXCoUUW8DjQc5SxcDfLrC26H8sHDmoFIUWLYmsQahpo0=s180-rw,카카오페이,차차,2022-01-20 00:00:00+09:00,1,0,아니 왜 송금이 안되냐고요 리뷰 삭제하지 말고 좀 어떻게 좀 해봐요 ㅡㅡ;;,android
https://play-lh.googleusercontent.com/W43xj43ErMIs5BQgCdMKEa0NXCoUUW8DjQc5SxcDfLrC26H8sHDmoFIUWLYmsQahpo0=s180-rw,카카오페이,김용진,2022-01-20 00:00:00+09:00,1,0,이거 망했나?,android
https://play-lh.googleusercontent.com/W43xj43ErMIs5BQgCdMKEa0NXCoUUW8DjQc5SxcDfLrC26H8sHDmoFIUWLYmsQahpo0=s180-rw,카카오페이,탁후,2022-01-20 00:00:00+09:00,1,0,제발..,android
https://play-lh.googleusercontent.com/W43xj43ErMIs5BQgCdMKEa0NXCoUUW8DjQc5SxcDfLrC26H8sHDmoFIUWLYmsQahpo0=s180-rw,카카오페이,유kiss,2022-01-20 00:00:00+09:00,1,0,업데이트 이후 접촉불량 연결상태 문구가 계속뜸,android
https://play-lh.googleusercontent.com/W43xj43ErMIs5BQgCdMKEa0NXCoUUW8DjQc5SxcDfLrC26H8sHDmoFIUWLYmsQahpo0=s180-rw,카카오페이,이두중,2022-01-20 00:00:00+09:00,3,0,카카오 페이 계정 여러게 만들수 있나요 아이디만 여러게 이고 계정은 하나만 만들 수 있나요,android
https://play-lh.googleusercontent.com/W43xj43ErMIs5BQgCdMKEa0NXCoUUW8DjQc5SxcDfLrC26H8sHDmoFIUWLYmsQahpo0=s180-rw,카카오페이,화야,2022-01-20 00:00:00+09:00,1,0,송금이 계속 안됩니다!,android
https://play-lh.googleusercontent.com/W43xj43ErMIs5BQgCdMKEa0NXCoUUW8DjQc5SxcDfLrC26H8sHDmoFIUWLYmsQahpo0=s180-rw,카카오페이,EJ L,2022-01-19 00:00:00+09:00,1,0,어제까지 되던 교통카드가 갑자기 안되는게 말이 됩니까?,android
https://play-lh.googleusercontent.com/W43xj43ErMIs5BQgCdMKEa0NXCoUUW8DjQc5SxcDfLrC26H8sHDmoFIUWLYmsQahpo0=s180-rw,카카오페이,김대식,2022-01-19 00:00:00+09:00,1,0,투자중인 펀드 어디서 확인해야 하나요? 주식만 되고 확인 방법이 없네요,android
https://play-lh.googleusercontent.com/W43xj43ErMIs5BQgCdMKEa0NXCoUUW8DjQc5SxcDfLrC26H8sHDmoFIUWLYmsQahpo0=s180-rw,카카오페이,김태이,2022-01-19 00:00:00+09:00,1,0,펀드투자중인 내역은 어디 들어가서 보나요 돈은 나가고 보려하면 메뉴에 펀드가 없고 어쩌란거죠????!,android
https://play-lh.googleusercontent.com/W43xj43ErMIs5BQgCdMKEa0NXCoUUW8DjQc5SxcDfLrC26H8sHDmoFIUWLYmsQahpo0=s180-rw,카카오페이,쩡_으늬,2022-01-19 00:00:00+09:00,4,0,페이 인증서비스에서 다른 인증방법은 없나요? 사정상 발신이 안되는 상황이라서요,android
https://play-lh.googleusercontent.com/W43xj43ErMIs5BQgCdMKEa0NXCoUUW8DjQc5SxcDfLrC26H8sHDmoFIUWLYmsQahpo0=s180-rw,카카오페이,James Yang,2022-01-19 00:00:00+09:00,1,0,왜 카카오 페이를 해야될지 너무 불편해 카드 통장 증원 투자 소비 분석 하다 못해 카카어페이 권유로 추천해준 자동투자도 한번 들어가기 힘듦 카카오증권 들어가면 대기 8만번? 뭘 하겟단건지 토스쓰다 카카오페이 보먄 개짜증이 남 사용카드 릿.트 벌라거 할때마드 연결하기 뜨고 카드 내용을 볼때마다 인증서 확인 하고 그럴꺼면 텅합을 왜하는지 토는 바로 되는데 내가 왜 카카오페일 써야 되죠?,android
https://play-lh.googleusercontent.com/W43xj43ErMIs5BQgCdMKEa0NXCoUUW8DjQc5SxcDfLrC26H8sHDmoFIUWLYmsQahpo0=s180-rw,카카오페이,Yun ho Roh,2022-01-19 00:00:00+09:00,3,1,위젯에서 멤버십 바코드 크기가 작아 스캔이 잘안되네요. 너무 안읽혀서 매번 앱실행해서 하는데 위젯하는 의미가 없습니다.,android
https://play-lh.googleusercontent.com/W43xj43ErMIs5BQgCdMKEa0NXCoUUW8DjQc5SxcDfLrC26H8sHDmoFIUWLYmsQahpo0=s180-rw,카카오페이,Creatie.ellie Choi,2022-01-19 00:00:00+09:00,1,22,업데이트 되고 메뉴가 늘어나는데..도대체 충전버튼은 어디있나요? 기본기능이 좀 쉬웠음좋겠는데 충전버튼 찾다가 스트레스받아서 카톡들어가서 함. 짜증나서 앱 지움.,android
https://play-lh.googleusercontent.com/W43xj43ErMIs5BQgCdMKEa0NXCoUUW8DjQc5SxcDfLrC26H8sHDmoFIUWLYmsQahpo0=s180-rw,카카오페이,한병윤,2022-01-18 00:00:00+09:00,3,0,자산분석 파이 그래프에 카카오로 투자한 펀드 투자자산이 표시되지 않아서 불편해요. 그리고 여기 매크로 같은 답변은 안하니만 못합니다.,android
https://play-lh.googleusercontent.com/W43xj43ErMIs5BQgCdMKEa0NXCoUUW8DjQc5SxcDfLrC26H8sHDmoFIUWLYmsQahpo0=s180-rw,카카오페이,뀨뀨,2022-01-18 00:00:00+09:00,1,0,충전금 결제했는데 돈도 없다고나오고 해지하면 환불한다고 했는데 환불안해주고 돈만 없어지게하면 이건 사기 페이지 카카오페이 대표나와서 왜이렇게하는지 사과 안하면 저는 신고뿐이 밖에 없네요,android
https://play-lh.googleusercontent.com/W43xj43ErMIs5BQgCdMKEa0NXCoUUW8DjQc5SxcDfLrC26H8sHDmoFIUWLYmsQahpo0=s180-rw,카카오페이,Soo Mr,2022-01-18 00:00:00+09:00,1,0,민증 인증 오류 쩌네 ㅋㅋ 으휴,android
https://play-lh.googleusercontent.com/W43xj43ErMIs5BQgCdMKEa0NXCoUUW8DjQc5SxcDfLrC26H8sHDmoFIUWLYmsQahpo0=s180-rw,카카오페이,이영준,2022-01-18 00:00:00+09:00,1,0,카가오페이증권은 어디로 들어가야하는지 갑자기 안보이네...,android
https://play-lh.googleusercontent.com/W43xj43ErMIs5BQgCdMKEa0NXCoUUW8DjQc5SxcDfLrC26H8sHDmoFIUWLYmsQahpo0=s180-rw,카카오페이,김문형,2022-01-17 00:00:00+09:00,5,0,좋와요,android
https://play-lh.googleusercontent.com/W43xj43ErMIs5BQgCdMKEa0NXCoUUW8DjQc5SxcDfLrC26H8sHDmoFIUWLYmsQahpo0=s180-rw,카카오페이,배고픈거위,2022-01-17 00:00:00+09:00,1,1,카카오페이증권 베너를 없에버리면 그 돈은 어떻게 확인하라는 거임,android
https://play-lh.googleusercontent.com/W43xj43ErMIs5BQgCdMKEa0NXCoUUW8DjQc5SxcDfLrC26H8sHDmoFIUWLYmsQahpo0=s180-rw,카카오페이,컷네임,2022-01-17 00:00:00+09:00,3,0,금액 충전해야 하는데 충전해야 할곳이 어디있는지 모르겠어요,android
https://play-lh.googleusercontent.com/W43xj43ErMIs5BQgCdMKEa0NXCoUUW8DjQc5SxcDfLrC26H8sHDmoFIUWLYmsQahpo0=s180-rw,카카오페이,손지숙,2022-01-17 00:00:00+09:00,1,0,내가하는 펀드가 안보임 복잡함,android
https://play-lh.googleusercontent.com/W43xj43ErMIs5BQgCdMKEa0NXCoUUW8DjQc5SxcDfLrC26H8sHDmoFIUWLYmsQahpo0=s180-rw,카카오페이,줭이,2022-01-17 00:00:00+09:00,3,0,펀드는 어디로 간건가요... Ui가 너무 자주 바뀌는것 같아요,android
https://play-lh.googleusercontent.com/W43xj43ErMIs5BQgCdMKEa0NXCoUUW8DjQc5SxcDfLrC26H8sHDmoFIUWLYmsQahpo0=s180-rw,카카오페이,G hyeok lee,2022-01-17 00:00:00+09:00,5,0,여러므로 게이득 ㅋ,android
https://play-lh.googleusercontent.com/W43xj43ErMIs5BQgCdMKEa0NXCoUUW8DjQc5SxcDfLrC26H8sHDmoFIUWLYmsQahpo0=s180-rw,카카오페이,Sunny K,2022-01-17 00:00:00+09:00,1,2,주식 탭이 생기면서 투자 탭이 사라졌는데 어디서 볼 수 있죠....？ 설정에도 탭 뷰 설정은 없는 것 같은데....,android
https://play-lh.googleusercontent.com/W43xj43ErMIs5BQgCdMKEa0NXCoUUW8DjQc5SxcDfLrC26H8sHDmoFIUWLYmsQahpo0=s180-rw,카카오페이,peon Kim,2022-01-16 00:00:00+09:00,1,0,"아놔 자동투자하기 어디로감? 확인좀 해보려고 하니까 조회하는거 아무리 찾아봐도 없네, 수익률도 그저 그렇고 가벼운 맛에 쓰는데 점점 무거워지는게 이참에 손절할때 됐네",android
https://play-lh.googleusercontent.com/W43xj43ErMIs5BQgCdMKEa0NXCoUUW8DjQc5SxcDfLrC26H8sHDmoFIUWLYmsQahpo0=s180-rw,카카오페이,서로이,2022-01-16 00:00:00+09:00,1,0,1년 전 대출내역은뭐냐 현행화 안하냐,android
https://play-lh.googleusercontent.com/W43xj43ErMIs5BQgCdMKEa0NXCoUUW8DjQc5SxcDfLrC26H8sHDmoFIUWLYmsQahpo0=s180-rw,카카오페이,전협,2022-01-16 00:00:00+09:00,2,0,업데이트후 펀드는 어디로 들어가야 되나요?,android
https://play-lh.googleusercontent.com/W43xj43ErMIs5BQgCdMKEa0NXCoUUW8DjQc5SxcDfLrC26H8sHDmoFIUWLYmsQahpo0=s180-rw,카카오페이,yun-hee han,2022-01-16 00:00:00+09:00,1,17,업뎃이후 투자중인 펀드내역을 확인할수가 없습니다. 투자 버튼 누르면 바로 확인 가능했었는데 그 버튼은.없고 주식버튼을 눌렀더니 아 진짜;;;; 진심 화가 마니 납니다. 이런 거지같은 업뎃은 첨 당해봐서 할말이 없네요,android
https://play-lh.googleusercontent.com/W43xj43ErMIs5BQgCdMKEa0NXCoUUW8DjQc5SxcDfLrC26H8sHDmoFIUWLYmsQahpo0=s180-rw,카카오페이,hong zeus,2022-01-16 00:00:00+09:00,1,0,양아치같은 카카소 오너들..,android
https://play-lh.googleusercontent.com/W43xj43ErMIs5BQgCdMKEa0NXCoUUW8DjQc5SxcDfLrC26H8sHDmoFIUWLYmsQahpo0=s180-rw,카카오페이,악플러의특징은해당분야초보자,2022-01-16 00:00:00+09:00,1,10,니들은 업뎃을 할때마다 돈 충전하는 위치를 바꾸는게 문제야... 니들 기능 이용하기 싫고 그냥 가스비 출금만 할건데 왜 자꾸 니들 기능을 강제로 이용하게 만드냐고,android
https://play-lh.googleusercontent.com/W43xj43ErMIs5BQgCdMKEa0NXCoUUW8DjQc5SxcDfLrC26H8sHDmoFIUWLYmsQahpo0=s180-rw,카카오페이,MA MA,2022-01-16 00:00:00+09:00,1,0,펀드를 어디서 찾나요? 펀드창이 안보여요.,android
https://play-lh.googleusercontent.com/W43xj43ErMIs5BQgCdMKEa0NXCoUUW8DjQc5SxcDfLrC26H8sHDmoFIUWLYmsQahpo0=s180-rw,카카오페이,2329홍유빈,2022-01-16 00:00:00+09:00,5,0,진짜 다 좋은데 13세 이상도 되게 해주세요ㅠㅠ..,android
https://play-lh.googleusercontent.com/W43xj43ErMIs5BQgCdMKEa0NXCoUUW8DjQc5SxcDfLrC26H8sHDmoFIUWLYmsQahpo0=s180-rw,카카오페이,정정봉진,2022-01-15 00:00:00+09:00,5,3,카카오페이 초보자가 쓰기에 아주 좋은 프로그램 입니다~많이 쓰시기를 바랍니다~,android
https://play-lh.googleusercontent.com/W43xj43ErMIs5BQgCdMKEa0NXCoUUW8DjQc5SxcDfLrC26H8sHDmoFIUWLYmsQahpo0=s180-rw,카카오페이,안상수,2022-01-15 00:00:00+09:00,5,0,굿,android
https://play-lh.googleusercontent.com/W43xj43ErMIs5BQgCdMKEa0NXCoUUW8DjQc5SxcDfLrC26H8sHDmoFIUWLYmsQahpo0=s180-rw,카카오페이,이지혜,2022-01-15 00:00:00+09:00,1,1,너무짜증나요 자산연결하는것도 자꾸실패하고ㅡㅡ 투자 카카오증권연결도 자꾸실패하고 어쩌란건지ㅡㅡ연결도안되고 어디로들어가서확인하란건데요?,android
https://play-lh.googleusercontent.com/W43xj43ErMIs5BQgCdMKEa0NXCoUUW8DjQc5SxcDfLrC26H8sHDmoFIUWLYmsQahpo0=s180-rw,카카오페이,준영,2022-01-15 00:00:00+09:00,1,0,갈수록 불편해지고 뜬금없이 내자산을 바꾸는건 먼짓인가요,android
https://play-lh.googleusercontent.com/W43xj43ErMIs5BQgCdMKEa0NXCoUUW8DjQc5SxcDfLrC26H8sHDmoFIUWLYmsQahpo0=s180-rw,카카오페이,설화,2022-01-15 00:00:00+09:00,3,0,카카오 페이 로그인 했는데 이후 인증 번호와 주민 등록 번호와 계좌 번호를 넣으라고 하더라고요 증권과 계좌번호와 연결이 되어 있나요?연결된 계좌에서 나도 모르게 자동 이체 되는건 아닌지 불안 하네요 그냥 돈 받고 다른 통장으로 이체하려고 하는데 이 페이를 사용하는게 맞나요?증권만 관련 있는게 아닌가요?주소도 모두 넣으라고 하는데 저는 증권하지 않아요 이 페이는 증권과 관련 있는지 처음 사용할때 로그인 할때시 카카오 계정으로 로그인하고 그다음 계좌번호와 주민번호와 계좌 비번을 기입했는데 안내 창에서 증권 자동이체가 날짜에 될것이라고 ...전체 리뷰,android
https://play-lh.googleusercontent.com/W43xj43ErMIs5BQgCdMKEa0NXCoUUW8DjQc5SxcDfLrC26H8sHDmoFIUWLYmsQahpo0=s180-rw,카카오페이,1028462880 bt,2022-01-15 00:00:00+09:00,1,0,실명노출; 탈퇴,android
