APP_IMG,APP_NAME,USER,DATE,STAR,LIKE,COMMENT,OS
https://play-lh.googleusercontent.com/W43xj43ErMIs5BQgCdMKEa0NXCoUUW8DjQc5SxcDfLrC26H8sHDmoFIUWLYmsQahpo0=s180-rw,카카오페이,just nick,2022-04-13 00:00:00+09:00,1,0,다단계같은 이벤트좀 하지마 다단계회사야?,android
https://play-lh.googleusercontent.com/W43xj43ErMIs5BQgCdMKEa0NXCoUUW8DjQc5SxcDfLrC26H8sHDmoFIUWLYmsQahpo0=s180-rw,카카오페이,강철희,2022-04-12 00:00:00+09:00,5,0,최고,android
https://play-lh.googleusercontent.com/W43xj43ErMIs5BQgCdMKEa0NXCoUUW8DjQc5SxcDfLrC26H8sHDmoFIUWLYmsQahpo0=s180-rw,카카오페이,김민성,2022-04-12 00:00:00+09:00,1,0,미성년자한테 왜 본인확인에 민증이랑 면허증을 왜 확인시킵니까 이것 땜에 지금 송금을 못하고 있어요,android
https://play-lh.googleusercontent.com/W43xj43ErMIs5BQgCdMKEa0NXCoUUW8DjQc5SxcDfLrC26H8sHDmoFIUWLYmsQahpo0=s180-rw,카카오페이,은은석준,2022-04-12 00:00:00+09:00,5,0,좋음,android
https://play-lh.googleusercontent.com/W43xj43ErMIs5BQgCdMKEa0NXCoUUW8DjQc5SxcDfLrC26H8sHDmoFIUWLYmsQahpo0=s180-rw,카카오페이,황화영,2022-04-12 00:00:00+09:00,5,0,이런저런 페이 많이써봤는데 카카오페이가 제일 편리하내요,android
https://play-lh.googleusercontent.com/W43xj43ErMIs5BQgCdMKEa0NXCoUUW8DjQc5SxcDfLrC26H8sHDmoFIUWLYmsQahpo0=s180-rw,카카오페이,대왕오징어,2022-04-12 00:00:00+09:00,1,0,개웃기네... 이벤트로 다 줄 것처럼 광고하고는 친구 초대 ^^ 사용자에게 스팸 보내라는 마케팅이 카겜이랑 똑같네요 ㅋㅋㅋㅋ,android
https://play-lh.googleusercontent.com/W43xj43ErMIs5BQgCdMKEa0NXCoUUW8DjQc5SxcDfLrC26H8sHDmoFIUWLYmsQahpo0=s180-rw,카카오페이,고범석,2022-04-12 00:00:00+09:00,5,0,다른 앱처럼 종목 별로 나눌 수 있는 기능이 있었으면 좋겠네요 아니면 메모를 해서 어느 종목인지 구별할 수 있으면 좋겠습니다 시외거래도 할 수 있음 좋겠네요 답변 부탁드립니다,android
https://play-lh.googleusercontent.com/W43xj43ErMIs5BQgCdMKEa0NXCoUUW8DjQc5SxcDfLrC26H8sHDmoFIUWLYmsQahpo0=s180-rw,카카오페이,노을과 바다,2022-04-12 00:00:00+09:00,5,0,편리하고 좋아요,android
https://play-lh.googleusercontent.com/W43xj43ErMIs5BQgCdMKEa0NXCoUUW8DjQc5SxcDfLrC26H8sHDmoFIUWLYmsQahpo0=s180-rw,카카오페이,김시현,2022-04-12 00:00:00+09:00,1,0,아니 도대체 제 생일선물 노트북을 포기하고 그냥 용돈 받으려고 엄마한테 페이 20000원 받으려는데 갑자기 왠 본인인증을 하래요??? 심지어 저는 주민등록증도 아직 발급되지 않았는데 도대체 왜그러시는거에요??? 진짜 날 안좋을때만 계속 막으시네요. 진짜 싫어요. 카카오페이 본인인증만 아니었어도 20000원은 금방 받았을거에요. 이 앱은 내 인생을 망쳤어요. 맘대로 하세요.,android
https://play-lh.googleusercontent.com/W43xj43ErMIs5BQgCdMKEa0NXCoUUW8DjQc5SxcDfLrC26H8sHDmoFIUWLYmsQahpo0=s180-rw,카카오페이,SINRA 26,2022-04-12 00:00:00+09:00,2,0,아무리 미자라도... 그래도 계좌랑 연결이 되야하지않나... 쓸수있는게 선불충전밖에 없네...,android
https://play-lh.googleusercontent.com/W43xj43ErMIs5BQgCdMKEa0NXCoUUW8DjQc5SxcDfLrC26H8sHDmoFIUWLYmsQahpo0=s180-rw,카카오페이,노도향,2022-04-12 00:00:00+09:00,5,0,좋아요,android
https://play-lh.googleusercontent.com/W43xj43ErMIs5BQgCdMKEa0NXCoUUW8DjQc5SxcDfLrC26H8sHDmoFIUWLYmsQahpo0=s180-rw,카카오페이,Llll Lll,2022-04-12 00:00:00+09:00,5,0,좋으,android
https://play-lh.googleusercontent.com/W43xj43ErMIs5BQgCdMKEa0NXCoUUW8DjQc5SxcDfLrC26H8sHDmoFIUWLYmsQahpo0=s180-rw,카카오페이,준식,2022-04-11 00:00:00+09:00,1,1,아니 폰바꾸고나서 사용하려니까 자꾸인증을하는데 신분증확인을하네여 발급아직안했는데 자꾸 확인하라하는데 어떻하죠,android
https://play-lh.googleusercontent.com/W43xj43ErMIs5BQgCdMKEa0NXCoUUW8DjQc5SxcDfLrC26H8sHDmoFIUWLYmsQahpo0=s180-rw,카카오페이,김현지,2022-04-11 00:00:00+09:00,1,1,갑자기 본인인증 하라고해서 하는데 발급일자 가 계속 틀리다고 하네요;;;,android
https://play-lh.googleusercontent.com/W43xj43ErMIs5BQgCdMKEa0NXCoUUW8DjQc5SxcDfLrC26H8sHDmoFIUWLYmsQahpo0=s180-rw,카카오페이,박성빈,2022-04-11 00:00:00+09:00,1,0,갑자기 본인인증을 하라며 주민등록증 정보를 요구하는데 정확하게 써도 맞는 정보가 아니라고 뜸,android
https://play-lh.googleusercontent.com/W43xj43ErMIs5BQgCdMKEa0NXCoUUW8DjQc5SxcDfLrC26H8sHDmoFIUWLYmsQahpo0=s180-rw,카카오페이,아무거나,2022-04-11 00:00:00+09:00,1,0,학생이라서 근뎅 너어어무 불 편함 결제는 잘됬지만 문제가 있음. 취소어떻게 하는징 모르겠음,android
https://play-lh.googleusercontent.com/W43xj43ErMIs5BQgCdMKEa0NXCoUUW8DjQc5SxcDfLrC26H8sHDmoFIUWLYmsQahpo0=s180-rw,카카오페이,이승준,2022-04-10 00:00:00+09:00,1,1,미성년자인데 민증이 어딨냐고.. 내돈내놔,android
https://play-lh.googleusercontent.com/W43xj43ErMIs5BQgCdMKEa0NXCoUUW8DjQc5SxcDfLrC26H8sHDmoFIUWLYmsQahpo0=s180-rw,카카오페이,l sh,2022-04-10 00:00:00+09:00,3,1,아직 민증 발급을 못 했는데 민증 없으면 아예 사용을 못하네여..?ㅠㅠㅠ,android
https://play-lh.googleusercontent.com/W43xj43ErMIs5BQgCdMKEa0NXCoUUW8DjQc5SxcDfLrC26H8sHDmoFIUWLYmsQahpo0=s180-rw,카카오페이,정현로,2022-04-10 00:00:00+09:00,1,3,멜론 이용권 구매하려고 카카오페이 결제를 사용했는데 남은 잔액을 쓰려고 카카오페이를 로그인하려니까 주민등록증 발급날짜를 입력하라는데 저는 아직 주민등록증을 만들지못했는데 어떻게하죠?,android
https://play-lh.googleusercontent.com/W43xj43ErMIs5BQgCdMKEa0NXCoUUW8DjQc5SxcDfLrC26H8sHDmoFIUWLYmsQahpo0=s180-rw,카카오페이,김수빈,2022-04-10 00:00:00+09:00,5,2,아니 리뷰 삭제하지 마시고...ㅠ 고쳐달라구요😭😭 고쳐주세요 미성년자도 사용가능하게🤦‍♀️,android
https://play-lh.googleusercontent.com/W43xj43ErMIs5BQgCdMKEa0NXCoUUW8DjQc5SxcDfLrC26H8sHDmoFIUWLYmsQahpo0=s180-rw,카카오페이,2-4 21조유진,2022-04-10 00:00:00+09:00,1,2,아직 주민등록증을 발급받지않았는데 인증하라고 합니다 이건 어떻게 해야할까요.?,android
https://play-lh.googleusercontent.com/W43xj43ErMIs5BQgCdMKEa0NXCoUUW8DjQc5SxcDfLrC26H8sHDmoFIUWLYmsQahpo0=s180-rw,카카오페이,임채원,2022-04-10 00:00:00+09:00,1,1,고등학생인데 본인인증 하라는데 본인인증칸에 주민등록증이나 운전면허만 있는데 주민등록증 발급 받은적이 없는데 어떡하나요 갑자기 잘되다가 이러네요. 전에는 돈 받기는 가능했는데 이젠 그것도 안되네요,android
https://play-lh.googleusercontent.com/W43xj43ErMIs5BQgCdMKEa0NXCoUUW8DjQc5SxcDfLrC26H8sHDmoFIUWLYmsQahpo0=s180-rw,카카오페이,김도훈,2022-04-10 00:00:00+09:00,1,0,토스 처럼 아이들도 사용할 수 있게 해 주세요 업데이트 부탁드립니다,android
https://play-lh.googleusercontent.com/W43xj43ErMIs5BQgCdMKEa0NXCoUUW8DjQc5SxcDfLrC26H8sHDmoFIUWLYmsQahpo0=s180-rw,카카오페이,나다,2022-04-09 00:00:00+09:00,2,2,아직 주민등록증 신청 안해서 현재 없는 상태인데 본인 확인을 성인 기준으로 하니까 어이없음. 선택지를 좀 늘려줬으면 좋겠음,android
https://play-lh.googleusercontent.com/W43xj43ErMIs5BQgCdMKEa0NXCoUUW8DjQc5SxcDfLrC26H8sHDmoFIUWLYmsQahpo0=s180-rw,카카오페이,chanz,2022-04-09 00:00:00+09:00,1,2,아니 제가 미성년자라서 카카오페이에 여태 모아놓은 돈을 못쓰는게 말인가요 방군가요;;ㅋ 아니 주민등록 발급일 장난하냐고요... 지금 뭐지? 싶어서 시도했다가 5번 실패했다고 잠기고 카카오톡 친구로 문의 하려니까 또 발급일 인증하라하고;;;;;; 지금 돈 쓸곳도 있어서 급한데 어이가없네요,android
https://play-lh.googleusercontent.com/W43xj43ErMIs5BQgCdMKEa0NXCoUUW8DjQc5SxcDfLrC26H8sHDmoFIUWLYmsQahpo0=s180-rw,카카오페이,남정대섭,2022-04-09 00:00:00+09:00,5,0,간편함,android
https://play-lh.googleusercontent.com/W43xj43ErMIs5BQgCdMKEa0NXCoUUW8DjQc5SxcDfLrC26H8sHDmoFIUWLYmsQahpo0=s180-rw,카카오페이,지울,2022-04-09 00:00:00+09:00,3,0,로그인 유지를 해놨는데 갑자기 로그아웃되고 본인인증을 하라고해서 정보를 알맟게 입력했는데도 틀렸다고만하네요,android
https://play-lh.googleusercontent.com/W43xj43ErMIs5BQgCdMKEa0NXCoUUW8DjQc5SxcDfLrC26H8sHDmoFIUWLYmsQahpo0=s180-rw,카카오페이,현이에욥,2022-04-09 00:00:00+09:00,3,2,카카오페이 새로 인증하라하던데 민증발급전이라 인증못하는데 카카오페이에 남아있던 돈 못쓰게됐네요 돈 안돌려주나요 ㅋㅋㅋㅋㅋ돈 뜯어가기쉽네,android
https://play-lh.googleusercontent.com/W43xj43ErMIs5BQgCdMKEa0NXCoUUW8DjQc5SxcDfLrC26H8sHDmoFIUWLYmsQahpo0=s180-rw,카카오페이,리라,2022-04-09 00:00:00+09:00,1,3,아니 정신 나갔나요 진짜ㅋㅋㅋㅋ 아직 민증 발급 생각도 안 하고 있었는데 갑자기 민증 인증 아니면 돈도 못쓰게 하네;; 지금 충전해놓은 내 돈 어떻게 하시려구요ㅋㅋㅋㅋ;; 앱 하나때문에 민증 발급해야하는 수고를 해야하나?,android
https://play-lh.googleusercontent.com/W43xj43ErMIs5BQgCdMKEa0NXCoUUW8DjQc5SxcDfLrC26H8sHDmoFIUWLYmsQahpo0=s180-rw,카카오페이,YS C,2022-04-09 00:00:00+09:00,1,1,생일 이제 막 지난 18살인데 인증수단이 주민등록증이랑 운전면허증 밖에 없으면 어떡하나요ㅋㅋㅋㅋㅋ 아직 민증 발급 계획 없는데 발급하기 전까진 쓰지도 말라는 건가요?ㅋㅋㅋ 며칠 전까지만 해도 잘 쓰고 있었는데 갑자기 이러시면 어떡해요;; 그전에 돈이라도 뺄 수 있게 미리 팝업을 띄워서 안내해주셔야 하는거 아닌가요? 송금도 안 되고 결제도 안 되고... 고객센터챗봇에서는 관련내용을 찾을 수가 없네요,android
https://play-lh.googleusercontent.com/W43xj43ErMIs5BQgCdMKEa0NXCoUUW8DjQc5SxcDfLrC26H8sHDmoFIUWLYmsQahpo0=s180-rw,카카오페이,왁싱샵왁싱하고가는엄준식,2022-04-08 00:00:00+09:00,1,0,"학생인데 돈 아끼려고 용돈 받으면 카카오페이에 넣으면서 저금 하고 있었는데요.. 오늘 카카오페이 들어가니까 인증 하라고 뜨길래 까짓거 하면 되지 하는 마음으로 인증을 하려는데 인증 수단이 주민등록증, 운전면허증 이 두 가지 밖에 없어서 민증이 없는 미성년자인 저는 로그인조차 되지 않습니다... 카카오페이에 넣어 놓은 돈은 뺄 수도 없구요.... 문의를 어디에 넣어야할지 몰라 여기에 씁니다",android
https://play-lh.googleusercontent.com/W43xj43ErMIs5BQgCdMKEa0NXCoUUW8DjQc5SxcDfLrC26H8sHDmoFIUWLYmsQahpo0=s180-rw,카카오페이,정은훈,2022-04-08 00:00:00+09:00,5,0,좋아요,android
https://play-lh.googleusercontent.com/W43xj43ErMIs5BQgCdMKEa0NXCoUUW8DjQc5SxcDfLrC26H8sHDmoFIUWLYmsQahpo0=s180-rw,카카오페이,워니's,2022-04-07 00:00:00+09:00,5,0,굿,android
https://play-lh.googleusercontent.com/W43xj43ErMIs5BQgCdMKEa0NXCoUUW8DjQc5SxcDfLrC26H8sHDmoFIUWLYmsQahpo0=s180-rw,카카오페이,rara ra,2022-04-07 00:00:00+09:00,5,0,빠른 이체 조아요,android
https://play-lh.googleusercontent.com/W43xj43ErMIs5BQgCdMKEa0NXCoUUW8DjQc5SxcDfLrC26H8sHDmoFIUWLYmsQahpo0=s180-rw,카카오페이,김기태,2022-04-06 00:00:00+09:00,2,0,주식할지 모르는 놈이 만들었다,android
https://play-lh.googleusercontent.com/W43xj43ErMIs5BQgCdMKEa0NXCoUUW8DjQc5SxcDfLrC26H8sHDmoFIUWLYmsQahpo0=s180-rw,카카오페이,S.Y H,2022-04-06 00:00:00+09:00,1,0,"사용중인 계정,형식이다른 이용할수없는 계정 통합 유도하고 이건 로그인 가능 근데 다른건 불가및사용중인계정 신뢰가 안가는 카카오 20년 넘게 사용한 다음도 폐기 해야될 상황",android
https://play-lh.googleusercontent.com/W43xj43ErMIs5BQgCdMKEa0NXCoUUW8DjQc5SxcDfLrC26H8sHDmoFIUWLYmsQahpo0=s180-rw,카카오페이,박양미,2022-04-05 00:00:00+09:00,1,0,페이가 왜 있어야하지요?,android
https://play-lh.googleusercontent.com/W43xj43ErMIs5BQgCdMKEa0NXCoUUW8DjQc5SxcDfLrC26H8sHDmoFIUWLYmsQahpo0=s180-rw,카카오페이,편영호,2022-04-05 00:00:00+09:00,1,0,안좋다 카카오페이 나쁘다,android
https://play-lh.googleusercontent.com/W43xj43ErMIs5BQgCdMKEa0NXCoUUW8DjQc5SxcDfLrC26H8sHDmoFIUWLYmsQahpo0=s180-rw,카카오페이,Wonpyo Kim,2022-04-05 00:00:00+09:00,5,0,2.7.0 (android6.0) 부터 미국주식 소수점거래(미국주식 소수점 거래가능 전 종목 거래가능),android
https://play-lh.googleusercontent.com/W43xj43ErMIs5BQgCdMKEa0NXCoUUW8DjQc5SxcDfLrC26H8sHDmoFIUWLYmsQahpo0=s180-rw,카카오페이,박진희,2022-04-05 00:00:00+09:00,3,3,자동매도 기간걸어서 할 수 있게 해주세요 목표가 도달하면 채결해주는거요 당연히 있을 줄 알았는데 아님 제가 못 찾나요? 예약하기는 아닌거 같던데 주식 옮길수 없으니 들어는 오는데 저 기능 없으면 다시 쓸일은 없을 듯 합니다 UI나 수익율에 따라 캐릭터 변하는건 너무 귀엽고 좋아요^^,android
https://play-lh.googleusercontent.com/W43xj43ErMIs5BQgCdMKEa0NXCoUUW8DjQc5SxcDfLrC26H8sHDmoFIUWLYmsQahpo0=s180-rw,카카오페이,J,2022-04-05 00:00:00+09:00,1,0,카드서명변경 도대체 어디있어요??????? 카드서비스 해지를 해야 다시 등록할 수 있다는데 서비스 해지는 또 어딨음?,android
https://play-lh.googleusercontent.com/W43xj43ErMIs5BQgCdMKEa0NXCoUUW8DjQc5SxcDfLrC26H8sHDmoFIUWLYmsQahpo0=s180-rw,카카오페이,춍댤,2022-04-04 00:00:00+09:00,1,2,"미성년잔데. 본인인증 신분증 확인이 안돼서 사용 못함. 오늘 들어와서 돈 충전하려고 했는데, 인증하래 미잔데 신분증이 어디있냐고 . 사용 못하게 만들어버리네 진짜 짜증나게",android
https://play-lh.googleusercontent.com/W43xj43ErMIs5BQgCdMKEa0NXCoUUW8DjQc5SxcDfLrC26H8sHDmoFIUWLYmsQahpo0=s180-rw,카카오페이,매운소다,2022-04-04 00:00:00+09:00,1,0,값 맞게 있는데 결제 안되는건 무슨 이유죠?,android
https://play-lh.googleusercontent.com/W43xj43ErMIs5BQgCdMKEa0NXCoUUW8DjQc5SxcDfLrC26H8sHDmoFIUWLYmsQahpo0=s180-rw,카카오페이,천경희,2022-04-03 00:00:00+09:00,4,0,송금 수수료 부분이 좋습니다.,android
https://play-lh.googleusercontent.com/W43xj43ErMIs5BQgCdMKEa0NXCoUUW8DjQc5SxcDfLrC26H8sHDmoFIUWLYmsQahpo0=s180-rw,카카오페이,예진,2022-04-02 00:00:00+09:00,1,0,설치할때 대기중이라고 뜨네요ㅜ,android
https://play-lh.googleusercontent.com/W43xj43ErMIs5BQgCdMKEa0NXCoUUW8DjQc5SxcDfLrC26H8sHDmoFIUWLYmsQahpo0=s180-rw,카카오페이,이윤재,2022-04-02 00:00:00+09:00,3,2,최근에 핸드폰을 초기화해 다시깔아 로그인을 하는데 본인인증까지 했지만 계좌인증을 하라고하네요.계좌번호와 증권이 없는 조로써는 어떻게해야할지 모르겠네요.평소에 잘 쓰고있던 앱이라서 해결해주시만 감사하겠습니다.,android
https://play-lh.googleusercontent.com/W43xj43ErMIs5BQgCdMKEa0NXCoUUW8DjQc5SxcDfLrC26H8sHDmoFIUWLYmsQahpo0=s180-rw,카카오페이,전동건,2022-04-01 00:00:00+09:00,1,1,주민등록증 아니면 운전면허증 으로 인증하라는데 청소년은 쓰지 말라는건가?,android
https://play-lh.googleusercontent.com/W43xj43ErMIs5BQgCdMKEa0NXCoUUW8DjQc5SxcDfLrC26H8sHDmoFIUWLYmsQahpo0=s180-rw,카카오페이,심태연,2022-04-01 00:00:00+09:00,1,0,카뱅에 있는 내 계좌에 돈 보낼때도 수수료를 내라고? 좀 그렇네요 ㅋㅋ,android
https://play-lh.googleusercontent.com/W43xj43ErMIs5BQgCdMKEa0NXCoUUW8DjQc5SxcDfLrC26H8sHDmoFIUWLYmsQahpo0=s180-rw,카카오페이,윤종환,2022-03-30 00:00:00+09:00,5,0,감사합니다,android
https://play-lh.googleusercontent.com/W43xj43ErMIs5BQgCdMKEa0NXCoUUW8DjQc5SxcDfLrC26H8sHDmoFIUWLYmsQahpo0=s180-rw,카카오페이,신의아들,2022-03-30 00:00:00+09:00,1,0,업비트 입출금신청해서 인증하려고하면 튕깁니다. 돈 쓸 일 급한데 왜 오늘부터 안되는건가요?,android
https://play-lh.googleusercontent.com/W43xj43ErMIs5BQgCdMKEa0NXCoUUW8DjQc5SxcDfLrC26H8sHDmoFIUWLYmsQahpo0=s180-rw,카카오페이,SW B,2022-03-29 00:00:00+09:00,5,0,굿,android
https://play-lh.googleusercontent.com/W43xj43ErMIs5BQgCdMKEa0NXCoUUW8DjQc5SxcDfLrC26H8sHDmoFIUWLYmsQahpo0=s180-rw,카카오페이,Petros N.,2022-03-28 00:00:00+09:00,3,70,"이런 저런 정보를 보는 차원에서는 좋습니다만, 거래용으로는 좀... 특히 몇 초 차이로 거래 안되거나 주문 정정등이 안되서 손해를 많이 봤는데... 진짜 생체 인식은 에러임. 빠른 매매를 위해 전용단말기 선정 등으로 주문속도를 높이는 것이 필요할 것 같습니다. 커스터마이징이 되어서 예약매매, 미체결매매정정 등에 대한 직관적 세팅이 가능하면 좋겠습니다. HTS만큼은 아니지만 카카오의 강점인 직관성을 이용하면 기존 엑셀+차트만 보는 매매패턴에서 진일보 할 수 있을 듯.",android
https://play-lh.googleusercontent.com/W43xj43ErMIs5BQgCdMKEa0NXCoUUW8DjQc5SxcDfLrC26H8sHDmoFIUWLYmsQahpo0=s180-rw,카카오페이,서옥주,2022-03-28 00:00:00+09:00,3,0,만보걷기요금은ㅇㅓ덯게하면받을수이는지아러켜주세요,android
https://play-lh.googleusercontent.com/W43xj43ErMIs5BQgCdMKEa0NXCoUUW8DjQc5SxcDfLrC26H8sHDmoFIUWLYmsQahpo0=s180-rw,카카오페이,소재원,2022-03-28 00:00:00+09:00,3,2,토스.핀크.네이버페이.이런앱은 송금수수료가 무료인데 카카오페이는 5회이상 넘어가면 수수료받는것 같던데 왜 그렇게 방침을 바꾸셨나요? 요즘은 무료송금이 대세인데^^,android
https://play-lh.googleusercontent.com/W43xj43ErMIs5BQgCdMKEa0NXCoUUW8DjQc5SxcDfLrC26H8sHDmoFIUWLYmsQahpo0=s180-rw,카카오페이,박성민,2022-03-26 00:00:00+09:00,5,0,너무좋네요^~,android
https://play-lh.googleusercontent.com/W43xj43ErMIs5BQgCdMKEa0NXCoUUW8DjQc5SxcDfLrC26H8sHDmoFIUWLYmsQahpo0=s180-rw,카카오페이,박성권,2022-03-26 00:00:00+09:00,3,0,주식 내주문 항목에 정렬되게해주세요 금액 주식별 구매 판매 판매손익 종목이 늘어나니까 헷갈려요 동일조건주문을 유지하도록 기간설정가능하게 해주세요 어제랑 똑같이 하려니까 힘들어요,android
https://play-lh.googleusercontent.com/W43xj43ErMIs5BQgCdMKEa0NXCoUUW8DjQc5SxcDfLrC26H8sHDmoFIUWLYmsQahpo0=s180-rw,카카오페이,SangGil Han,2022-03-25 00:00:00+09:00,1,0,인증이 되지않아서 다음단계로 넝어가질 않네요,android
https://play-lh.googleusercontent.com/W43xj43ErMIs5BQgCdMKEa0NXCoUUW8DjQc5SxcDfLrC26H8sHDmoFIUWLYmsQahpo0=s180-rw,카카오페이,호성입니다만,2022-03-24 00:00:00+09:00,3,0,혹시 카카오뱅크는 결제가 안되나요? 게임에서?,android
https://play-lh.googleusercontent.com/W43xj43ErMIs5BQgCdMKEa0NXCoUUW8DjQc5SxcDfLrC26H8sHDmoFIUWLYmsQahpo0=s180-rw,카카오페이,유한나,2022-03-24 00:00:00+09:00,4,0,지문인식 설정이 계속 오류가나요,android
https://play-lh.googleusercontent.com/W43xj43ErMIs5BQgCdMKEa0NXCoUUW8DjQc5SxcDfLrC26H8sHDmoFIUWLYmsQahpo0=s180-rw,카카오페이,최정근,2022-03-24 00:00:00+09:00,3,0,너무 느리네요,android
https://play-lh.googleusercontent.com/W43xj43ErMIs5BQgCdMKEa0NXCoUUW8DjQc5SxcDfLrC26H8sHDmoFIUWLYmsQahpo0=s180-rw,카카오페이,아썬니,2022-03-22 00:00:00+09:00,5,0,편해요,android
https://play-lh.googleusercontent.com/W43xj43ErMIs5BQgCdMKEa0NXCoUUW8DjQc5SxcDfLrC26H8sHDmoFIUWLYmsQahpo0=s180-rw,카카오페이,ᄒᄒ,2022-03-22 00:00:00+09:00,4,0,페이카드3로 버스 한번 탈때 초기충전금 2만원에 있던 돈과 제 카카오계좌에 있던 돈들이 같이 빠지는데 원래 그런 건 가요?,android
https://play-lh.googleusercontent.com/W43xj43ErMIs5BQgCdMKEa0NXCoUUW8DjQc5SxcDfLrC26H8sHDmoFIUWLYmsQahpo0=s180-rw,카카오페이,김윤재,2022-03-22 00:00:00+09:00,5,0,최고,android
https://play-lh.googleusercontent.com/W43xj43ErMIs5BQgCdMKEa0NXCoUUW8DjQc5SxcDfLrC26H8sHDmoFIUWLYmsQahpo0=s180-rw,카카오페이,로즈,2022-03-20 00:00:00+09:00,1,17,예전부터 계속 저도 모르게 플레이스토어로 연결된 상태에서 5500원씩 한 달에 한 번씩 정기 결제가 되어서 비밀번호도 바꾸고 플레이스토어랑 연결도 끊었는데 또 5500원이 결제되었습니다. 환불 요청을 하려고 해도 플레이스토어에 요청하라고 되어있는데 플레이스토어엔 결제 내역이 없어서 환불도 안되고 진짜 최악,android
https://play-lh.googleusercontent.com/W43xj43ErMIs5BQgCdMKEa0NXCoUUW8DjQc5SxcDfLrC26H8sHDmoFIUWLYmsQahpo0=s180-rw,카카오페이,권도엽,2022-03-20 00:00:00+09:00,5,28,언제 어디서든 쉽고 편하게 결제를 할수있어서 좋고 카드를 연결해서 사용할 수 있는점도 너무 좋다고 생각해요. 하지만 삼성페이처럼 홈화면이나 꺼진화면에서 하단바를 끌어올려서 카드결제를 하는 방법이 없어서 너무 아쉬워요ㅜㅜ 앱으로들어가서 결제를해야하는게 조금 시간이 걸리는게 제가 생각하는 단점이에요. 이러한 기능도 추가해주세요~,android
https://play-lh.googleusercontent.com/W43xj43ErMIs5BQgCdMKEa0NXCoUUW8DjQc5SxcDfLrC26H8sHDmoFIUWLYmsQahpo0=s180-rw,카카오페이,MIYANG KIM,2022-03-20 00:00:00+09:00,5,0,너무 편리해요♡♡♡,android
https://play-lh.googleusercontent.com/W43xj43ErMIs5BQgCdMKEa0NXCoUUW8DjQc5SxcDfLrC26H8sHDmoFIUWLYmsQahpo0=s180-rw,카카오페이,노성열,2022-03-20 00:00:00+09:00,5,0,좋네요,android
https://play-lh.googleusercontent.com/W43xj43ErMIs5BQgCdMKEa0NXCoUUW8DjQc5SxcDfLrC26H8sHDmoFIUWLYmsQahpo0=s180-rw,카카오페이,아름아름,2022-03-19 00:00:00+09:00,1,1,5분지났는데도 인증 못하게 함 예전 계정에 있는 카카오페이 그거 때문에 가서 햐지좀 하려고 했더니쳐 막아쌈 이게 진짜 뭐하는 짓거리임? 아니 그냥 간단한 인등 하는 앱들 많은데 카카오페이만 유독 유난떰 집착이 거의 네이버 수준임 진짜 개빡쳐서 새벽내내 몇번 하다가 포기함 그냥 다른 계정 로그인 할때 그 계정에 있는 카카오페이는 자동탈퇴좀 되게 하면 안되나? 무슨 철저한 보안임 그냥 연동서비스 안되는걸로 밖에 안보임 카카오톡 전 계정은 이미 탈퇴 삭제 처리해서 들어가지도 못하는대 어카라는거임? 이메일 바꾼 사람은 그럼 어카라고?진심 ...전체 리뷰,android
https://play-lh.googleusercontent.com/W43xj43ErMIs5BQgCdMKEa0NXCoUUW8DjQc5SxcDfLrC26H8sHDmoFIUWLYmsQahpo0=s180-rw,카카오페이,백관현,2022-03-19 00:00:00+09:00,4,0,좋아요,android
https://play-lh.googleusercontent.com/W43xj43ErMIs5BQgCdMKEa0NXCoUUW8DjQc5SxcDfLrC26H8sHDmoFIUWLYmsQahpo0=s180-rw,카카오페이,박일현,2022-03-19 00:00:00+09:00,5,0,좋습니다,android
https://play-lh.googleusercontent.com/W43xj43ErMIs5BQgCdMKEa0NXCoUUW8DjQc5SxcDfLrC26H8sHDmoFIUWLYmsQahpo0=s180-rw,카카오페이,와우,2022-03-18 00:00:00+09:00,1,0,진짜 추하다 베라 이벤트 한다 해서 깔아봤더니 아무리 친구들이 이벤트 받게 도와줘도 재료 안 줌 그 리고 걸국 다음날 주더니 이벤트 종료되었다고 이럴꺼면 그냥 망해라 차라리 카카오보다 네어버가 모인트 많이 줌 카톡도 사라졌으면 ..ㅋ,android
https://play-lh.googleusercontent.com/W43xj43ErMIs5BQgCdMKEa0NXCoUUW8DjQc5SxcDfLrC26H8sHDmoFIUWLYmsQahpo0=s180-rw,카카오페이,조헌일,2022-03-17 00:00:00+09:00,5,0,9q88c,android
https://play-lh.googleusercontent.com/W43xj43ErMIs5BQgCdMKEa0NXCoUUW8DjQc5SxcDfLrC26H8sHDmoFIUWLYmsQahpo0=s180-rw,카카오페이,라오니TV,2022-03-17 00:00:00+09:00,1,0,주식접속이 안되면 어쩌잔건지. 오전장 다 놓치고. ㅡㅡ,android
https://play-lh.googleusercontent.com/W43xj43ErMIs5BQgCdMKEa0NXCoUUW8DjQc5SxcDfLrC26H8sHDmoFIUWLYmsQahpo0=s180-rw,카카오페이,JJ mom,2022-03-17 00:00:00+09:00,1,0,트레이딩중 접속장애??? 아진짜 돈이한두푼이야 돈빠지면물어줄꺼냐고 뭐하는짓이야 진짜 주식이 애들장난도아니고,android
https://play-lh.googleusercontent.com/W43xj43ErMIs5BQgCdMKEa0NXCoUUW8DjQc5SxcDfLrC26H8sHDmoFIUWLYmsQahpo0=s180-rw,카카오페이,Google Lee,2022-03-17 00:00:00+09:00,1,0,주식이 안열리는데.. Mts를 따로 만들이 페이 멤버십 주식을 왜 다 모아놓은건지.,android
https://play-lh.googleusercontent.com/W43xj43ErMIs5BQgCdMKEa0NXCoUUW8DjQc5SxcDfLrC26H8sHDmoFIUWLYmsQahpo0=s180-rw,카카오페이,장현성,2022-03-17 00:00:00+09:00,1,0,안해야겠다 본전 넘어서 팔려했는데 애비 먹통이여,android
https://play-lh.googleusercontent.com/W43xj43ErMIs5BQgCdMKEa0NXCoUUW8DjQc5SxcDfLrC26H8sHDmoFIUWLYmsQahpo0=s180-rw,카카오페이,조정수,2022-03-17 00:00:00+09:00,1,0,오늘은 접속도 안되네...진짜 짜증난다 소액도 아깝~,android
https://play-lh.googleusercontent.com/W43xj43ErMIs5BQgCdMKEa0NXCoUUW8DjQc5SxcDfLrC26H8sHDmoFIUWLYmsQahpo0=s180-rw,카카오페이,forever H.O.T,2022-03-17 00:00:00+09:00,1,1,현재 오류나서 접속도 안됨. 주식 정리하는대로 다시는 카카오페이 증권 안쓴다.,android
https://play-lh.googleusercontent.com/W43xj43ErMIs5BQgCdMKEa0NXCoUUW8DjQc5SxcDfLrC26H8sHDmoFIUWLYmsQahpo0=s180-rw,카카오페이,김정의,2022-03-17 00:00:00+09:00,4,0,아주 유용합니다,android
https://play-lh.googleusercontent.com/W43xj43ErMIs5BQgCdMKEa0NXCoUUW8DjQc5SxcDfLrC26H8sHDmoFIUWLYmsQahpo0=s180-rw,카카오페이,나연이짱짱,2022-03-17 00:00:00+09:00,1,1,증권 오류 언제 고치는데요 너무떨어져서 팔아야하는데,android
