APP_IMG,APP_NAME,USER,DATE,STAR,LIKE,COMMENT,OS
https://play-lh.googleusercontent.com/W43xj43ErMIs5BQgCdMKEa0NXCoUUW8DjQc5SxcDfLrC26H8sHDmoFIUWLYmsQahpo0=s180-rw,카카오페이,UNICORN SLIME KOREA,2022-02-23 00:00:00+09:00,1,3,"라이언이 춤추네 마네 하는 것도 좋지만 기본적인 기능, 특히 주식 선물하기 기능 좀 언능 넣어주세요😔😔 선물 준다할때 받아야되는데 기능이 없어요ㅜㅜ",android
https://play-lh.googleusercontent.com/W43xj43ErMIs5BQgCdMKEa0NXCoUUW8DjQc5SxcDfLrC26H8sHDmoFIUWLYmsQahpo0=s180-rw,카카오페이,J Y__h,2022-02-23 00:00:00+09:00,2,0,투자관련 ui 불편 뭔 펀드 투자하려하는데 찾아들어가기 개 힘듬. 따로 투자앱이나 증권앱을 만들던지 투자 관련 메뉴 커스텀도 안되고 조속히 수정바람 솔직히 토스보다 많이 떨어짐 펀드도 몇개 없어서 검색 안해도 됨.... 아 이게 뭥미,android
https://play-lh.googleusercontent.com/W43xj43ErMIs5BQgCdMKEa0NXCoUUW8DjQc5SxcDfLrC26H8sHDmoFIUWLYmsQahpo0=s180-rw,카카오페이,장슬기,2022-02-22 00:00:00+09:00,3,0,카카오페이 가입하려니 일시적인 시스템오류라는데 왜그러는걸까요?,android
https://play-lh.googleusercontent.com/W43xj43ErMIs5BQgCdMKEa0NXCoUUW8DjQc5SxcDfLrC26H8sHDmoFIUWLYmsQahpo0=s180-rw,카카오페이,신민호,2022-02-22 00:00:00+09:00,1,0,돈 송금 보네는데요 돈 안들어 갓네요 어터케 되는겁니까 ㅠ,android
https://play-lh.googleusercontent.com/W43xj43ErMIs5BQgCdMKEa0NXCoUUW8DjQc5SxcDfLrC26H8sHDmoFIUWLYmsQahpo0=s180-rw,카카오페이,꼬오오,2022-02-21 00:00:00+09:00,1,3,자동투자취소하고 정산금출금까지했는데 지들맘대로 다시연결하고 취소하고송금하려니 마지막단계까지가서 업데이트하라고튕기고 진짜가지가지여러가지한다,android
https://play-lh.googleusercontent.com/W43xj43ErMIs5BQgCdMKEa0NXCoUUW8DjQc5SxcDfLrC26H8sHDmoFIUWLYmsQahpo0=s180-rw,카카오페이,heesung yun,2022-02-20 00:00:00+09:00,3,10,사용하기편하기는한데 위젯에서 결제바로가기누르면 내가 설정한카드로 나오게 좀 해주세요 네이버페이처럼... 카카오머니는 쓰지도않는데 위젯결제버튼누르면 그게 제일먼저 튀어나오니 불편해요 개선해주세요,android
https://play-lh.googleusercontent.com/W43xj43ErMIs5BQgCdMKEa0NXCoUUW8DjQc5SxcDfLrC26H8sHDmoFIUWLYmsQahpo0=s180-rw,카카오페이,최유순,2022-02-19 00:00:00+09:00,5,0,"아직,,모름❤!!",android
https://play-lh.googleusercontent.com/W43xj43ErMIs5BQgCdMKEa0NXCoUUW8DjQc5SxcDfLrC26H8sHDmoFIUWLYmsQahpo0=s180-rw,카카오페이,신재원,2022-02-19 00:00:00+09:00,1,0,리뷰 올리자 마자 내리네 뭐하는 놈들이야 이거,android
https://play-lh.googleusercontent.com/W43xj43ErMIs5BQgCdMKEa0NXCoUUW8DjQc5SxcDfLrC26H8sHDmoFIUWLYmsQahpo0=s180-rw,카카오페이,블루엔젤,2022-02-18 00:00:00+09:00,5,0,굿,android
https://play-lh.googleusercontent.com/W43xj43ErMIs5BQgCdMKEa0NXCoUUW8DjQc5SxcDfLrC26H8sHDmoFIUWLYmsQahpo0=s180-rw,카카오페이,김호석,2022-02-17 00:00:00+09:00,5,0,수고하세요,android
https://play-lh.googleusercontent.com/W43xj43ErMIs5BQgCdMKEa0NXCoUUW8DjQc5SxcDfLrC26H8sHDmoFIUWLYmsQahpo0=s180-rw,카카오페이,최종우,2022-02-17 00:00:00+09:00,3,0,컬쳐캐쉬는 카카오캐쉬로 바꿀 수 없는건가요 제가 사려는게 있는데. ㅠ,android
https://play-lh.googleusercontent.com/W43xj43ErMIs5BQgCdMKEa0NXCoUUW8DjQc5SxcDfLrC26H8sHDmoFIUWLYmsQahpo0=s180-rw,카카오페이,강채윤,2022-02-17 00:00:00+09:00,4,20,"안녕하세요 단말기 변경 후 접속하려고하니 이름 칸에서 자판이 안나옵니다 아래 주민번호, 전화번호는 자판이 뜨는데 이름만 자판이 뜨지 않아서 넘어갈 수가 없어요 지우고 다시 깔아도 같습니다 어떻게 해야하나요? +) 방금 키보드를 따로 연결해서 작성했습니다. 하지만 해당 오류는 고쳐야할 것 같네요",android
https://play-lh.googleusercontent.com/W43xj43ErMIs5BQgCdMKEa0NXCoUUW8DjQc5SxcDfLrC26H8sHDmoFIUWLYmsQahpo0=s180-rw,카카오페이,마이더스손,2022-02-17 00:00:00+09:00,1,0,별로,android
https://play-lh.googleusercontent.com/W43xj43ErMIs5BQgCdMKEa0NXCoUUW8DjQc5SxcDfLrC26H8sHDmoFIUWLYmsQahpo0=s180-rw,카카오페이,김행복한 하루현기,2022-02-17 00:00:00+09:00,5,0,감사합니다,android
https://play-lh.googleusercontent.com/W43xj43ErMIs5BQgCdMKEa0NXCoUUW8DjQc5SxcDfLrC26H8sHDmoFIUWLYmsQahpo0=s180-rw,카카오페이,정우진,2022-02-16 00:00:00+09:00,5,0,카카오페이 짱,android
https://play-lh.googleusercontent.com/W43xj43ErMIs5BQgCdMKEa0NXCoUUW8DjQc5SxcDfLrC26H8sHDmoFIUWLYmsQahpo0=s180-rw,카카오페이,서지호,2022-02-16 00:00:00+09:00,1,0,이건 만 14세 미만도 가능 한가요?,android
https://play-lh.googleusercontent.com/W43xj43ErMIs5BQgCdMKEa0NXCoUUW8DjQc5SxcDfLrC26H8sHDmoFIUWLYmsQahpo0=s180-rw,카카오페이,이나영,2022-02-16 00:00:00+09:00,1,10,계좌 선택에 카카오미니도 추가해주시면 안되나요? 카카오페이로 결제할일이 많은데 은행 선택부터 막히니.... 진짜 불편해요 계좌추가 1번선택지에 카카오미니도 넣어주세요,android
https://play-lh.googleusercontent.com/W43xj43ErMIs5BQgCdMKEa0NXCoUUW8DjQc5SxcDfLrC26H8sHDmoFIUWLYmsQahpo0=s180-rw,카카오페이,jongkuk park,2022-02-16 00:00:00+09:00,4,0,갤럭시도 아이폰처럼 위젯만들어주세요,android
https://play-lh.googleusercontent.com/W43xj43ErMIs5BQgCdMKEa0NXCoUUW8DjQc5SxcDfLrC26H8sHDmoFIUWLYmsQahpo0=s180-rw,카카오페이,jack lee,2022-02-16 00:00:00+09:00,5,0,굿,android
https://play-lh.googleusercontent.com/W43xj43ErMIs5BQgCdMKEa0NXCoUUW8DjQc5SxcDfLrC26H8sHDmoFIUWLYmsQahpo0=s180-rw,카카오페이,김유정,2022-02-16 00:00:00+09:00,1,0,😞😞😵😵😡😡🤮🤮,android
https://play-lh.googleusercontent.com/W43xj43ErMIs5BQgCdMKEa0NXCoUUW8DjQc5SxcDfLrC26H8sHDmoFIUWLYmsQahpo0=s180-rw,카카오페이,유우정,2022-02-16 00:00:00+09:00,5,0,저 17살인데요 계좌못만들어요 어떻게해요,android
https://play-lh.googleusercontent.com/W43xj43ErMIs5BQgCdMKEa0NXCoUUW8DjQc5SxcDfLrC26H8sHDmoFIUWLYmsQahpo0=s180-rw,카카오페이,강현지,2022-02-16 00:00:00+09:00,1,3,인증불가로 쓸수가 없습니다.. 아무리 인증해봐도 본인인증이 안된다네요...ㅎㅎㅎㅎ 몇년째 문의중인데 누가 해결해주시나요?,android
https://play-lh.googleusercontent.com/W43xj43ErMIs5BQgCdMKEa0NXCoUUW8DjQc5SxcDfLrC26H8sHDmoFIUWLYmsQahpo0=s180-rw,카카오페이,조영은,2022-02-16 00:00:00+09:00,1,0,내가 살다살다 안쓰는앱 웹툰결제하다가 깔게되는건 처음이넼ㅋㅋㅋㅋ 평소랑 아무위화감없이 정기결제???? 캐쉬충전하는건줄 알았는데 정기결제???? 난 필요금액 충전한다 그랬지 언제 정기결제페이지로 넘어가달라던???? 좀 다르게 표시해두던갘ㅋㅋㅋ 사람을 이렇게 속여먹네? 그래서 앱깔았더니 여기서는 정기결제한거 취소못한다고??? 그런거면 카카오페이지에 정기결제취소하는거 자세히 어디서 하는지 적어두던가ㅎ 전부다 뒤져봤네 돈미새들아 ㅎㅎ 1점도 아까운데 제일 낮은게 1점이네 1점도 고맙게받아 버러지들아,android
https://play-lh.googleusercontent.com/W43xj43ErMIs5BQgCdMKEa0NXCoUUW8DjQc5SxcDfLrC26H8sHDmoFIUWLYmsQahpo0=s180-rw,카카오페이,van Gogh Vincent,2022-02-16 00:00:00+09:00,5,3,유용하게 쓰고있습니다. 연동계좌목록에 KB증권계좌도 하루빨리 추가되었으면 좋겠습니다.,android
https://play-lh.googleusercontent.com/W43xj43ErMIs5BQgCdMKEa0NXCoUUW8DjQc5SxcDfLrC26H8sHDmoFIUWLYmsQahpo0=s180-rw,카카오페이,김용수,2022-02-16 00:00:00+09:00,5,0,사용이 무쟈게 편리하고 좋네요,android
https://play-lh.googleusercontent.com/W43xj43ErMIs5BQgCdMKEa0NXCoUUW8DjQc5SxcDfLrC26H8sHDmoFIUWLYmsQahpo0=s180-rw,카카오페이,H H,2022-02-15 00:00:00+09:00,5,0,이젠 충전 안되요? 카카오페이로 계산 많이했는데 복잡해졌네요,android
https://play-lh.googleusercontent.com/W43xj43ErMIs5BQgCdMKEa0NXCoUUW8DjQc5SxcDfLrC26H8sHDmoFIUWLYmsQahpo0=s180-rw,카카오페이,Dobby free,2022-02-15 00:00:00+09:00,1,5,갑자기 본인인증 안되어서 초기화하는데 필요한 서류가 너무 많음..귀찮아서 영원히 안 쓸 것 같음,android
https://play-lh.googleusercontent.com/W43xj43ErMIs5BQgCdMKEa0NXCoUUW8DjQc5SxcDfLrC26H8sHDmoFIUWLYmsQahpo0=s180-rw,카카오페이,마릴린,2022-02-15 00:00:00+09:00,2,1,주식때문에 사용하고 있는데 느립니다.. 다른 어플 갔다오면 먹통되는건 기본이고ㅠ,android
https://play-lh.googleusercontent.com/W43xj43ErMIs5BQgCdMKEa0NXCoUUW8DjQc5SxcDfLrC26H8sHDmoFIUWLYmsQahpo0=s180-rw,카카오페이,김윤호,2022-02-15 00:00:00+09:00,5,0,자 오늘은 제가 카오 팽이 하는데요 돈이 쳐 맞네요 저는 돈이 30만 원밖에 없는 줄 알았는데요,android
https://play-lh.googleusercontent.com/W43xj43ErMIs5BQgCdMKEa0NXCoUUW8DjQc5SxcDfLrC26H8sHDmoFIUWLYmsQahpo0=s180-rw,카카오페이,노벨,2022-02-15 00:00:00+09:00,5,22,복잡하지도 않고 간편하고 실패도없고 쓸데없는 기술을 쓰지않아서 좋습니다 토스같은 버러지보단 한... 2000배 나아요 업데이트로 불편해진건 폰 환경 문제일뿐 어플 관련해서는 딱히 불편하지도않구요 최소 제가써본 금융어플중 젤 편하고 좋았음 뭐ㅋㅋ 저만 그런건지는 모르겠지만 편하면 된거아닌가여?😁😁기능이 간편하여 믿고쓸수있고 아마 평~생 쓸수있을거 같네여 I Love Kakao!!,android
https://play-lh.googleusercontent.com/W43xj43ErMIs5BQgCdMKEa0NXCoUUW8DjQc5SxcDfLrC26H8sHDmoFIUWLYmsQahpo0=s180-rw,카카오페이,구월이,2022-02-14 00:00:00+09:00,3,0,입출금 계좌 미니도 되게 해주세요 진짜 개빡쳐요,android
https://play-lh.googleusercontent.com/W43xj43ErMIs5BQgCdMKEa0NXCoUUW8DjQc5SxcDfLrC26H8sHDmoFIUWLYmsQahpo0=s180-rw,카카오페이,단호박,2022-02-13 00:00:00+09:00,3,30,"쇼핑 앱에서 카카오페이 앱으로 넘어가면 결제가 잘되는데, 똑같은 쇼핑 사이트여도 인터넷에서 카카오페이로 넘어가면 결제가 자꾸 튕겨요. 삼성 인터넷 앱으로 이니스프리에서 카카오페이 결제할 때는 4번이나 해도 안되더니 이니스프리 앱에서 하니까 한번에 되네요",android
https://play-lh.googleusercontent.com/W43xj43ErMIs5BQgCdMKEa0NXCoUUW8DjQc5SxcDfLrC26H8sHDmoFIUWLYmsQahpo0=s180-rw,카카오페이,다정,2022-02-13 00:00:00+09:00,1,9,저 예전에 이거 리뷰 썼던 것 같은데 사라져있네요 제가 이거 카드 만들었는데 집에 카드가 배달 올 때 집에 아무도 없어서 못 받았었고 그래서 다시 재배송 신청도 해놨는데 배송예정 이라는 문자만 오고 카드가 안 오더니 며칠 뒤에 아무 말 없이 제 카드를 폐기 처리 한다고 하더라구요 그래서 문의 넣었는데 해결 방법도 안 주시고... 그래서 걍 포기 했습니다,android
https://play-lh.googleusercontent.com/W43xj43ErMIs5BQgCdMKEa0NXCoUUW8DjQc5SxcDfLrC26H8sHDmoFIUWLYmsQahpo0=s180-rw,카카오페이,요이요이,2022-02-13 00:00:00+09:00,1,0,아니 계좌 만들라길래 카카오뱅크 연결하는거 기다렸는데 무슨 30분동안 가만히 있냐...? 혹시 와이파이 문제인가 했는데 다른건 다 멀쩡하게 되고.. 기다리다 못해서 카카오뱅크로 따로 들어갔는데 대포통장 때문에 안된데.... 아니 그건 이해하겠는데 앱 상태가 왜이런거야..? 이렇게 느리고 이해안되게 만든 앱 처음봤다.... 좀더 이해하기 쉽게 만들면 좋을 것 같음......,android
https://play-lh.googleusercontent.com/W43xj43ErMIs5BQgCdMKEa0NXCoUUW8DjQc5SxcDfLrC26H8sHDmoFIUWLYmsQahpo0=s180-rw,카카오페이,"이재윤 ,로드튜브 Korea Road Tube",2022-02-13 00:00:00+09:00,5,0,사용하기 좋아요,android
https://play-lh.googleusercontent.com/W43xj43ErMIs5BQgCdMKEa0NXCoUUW8DjQc5SxcDfLrC26H8sHDmoFIUWLYmsQahpo0=s180-rw,카카오페이,댕댕이,2022-02-12 00:00:00+09:00,1,0,진짜 갈수록 불편해지네,android
https://play-lh.googleusercontent.com/W43xj43ErMIs5BQgCdMKEa0NXCoUUW8DjQc5SxcDfLrC26H8sHDmoFIUWLYmsQahpo0=s180-rw,카카오페이,박예신,2022-02-11 00:00:00+09:00,5,0,지난번에 리뷰했던 사람인데요. 만12세까지는 아니니까 만나이말고요. 그냥14세도 되게해주시면 안됄까요?(생일 않지나도 되게요),android
https://play-lh.googleusercontent.com/W43xj43ErMIs5BQgCdMKEa0NXCoUUW8DjQc5SxcDfLrC26H8sHDmoFIUWLYmsQahpo0=s180-rw,카카오페이,유피스,2022-02-11 00:00:00+09:00,1,0,뭐가텅비엇네..,android
https://play-lh.googleusercontent.com/W43xj43ErMIs5BQgCdMKEa0NXCoUUW8DjQc5SxcDfLrC26H8sHDmoFIUWLYmsQahpo0=s180-rw,카카오페이,unclesurf wook,2022-02-11 00:00:00+09:00,5,0,👍👍,android
https://play-lh.googleusercontent.com/W43xj43ErMIs5BQgCdMKEa0NXCoUUW8DjQc5SxcDfLrC26H8sHDmoFIUWLYmsQahpo0=s180-rw,카카오페이,김민지,2022-02-10 00:00:00+09:00,1,0,안돼서 못해요..,android
https://play-lh.googleusercontent.com/W43xj43ErMIs5BQgCdMKEa0NXCoUUW8DjQc5SxcDfLrC26H8sHDmoFIUWLYmsQahpo0=s180-rw,카카오페이,pi Ti,2022-02-10 00:00:00+09:00,1,0,뭐누를때마다 진동되는데 끄는법없나요 핸드폰은 무음상태 되어 있는데 자꾸진동울려요,android
https://play-lh.googleusercontent.com/W43xj43ErMIs5BQgCdMKEa0NXCoUUW8DjQc5SxcDfLrC26H8sHDmoFIUWLYmsQahpo0=s180-rw,카카오페이,진진aqsw Asd,2022-02-10 00:00:00+09:00,1,11,버킷리스트 퍼센테이지 어디로 갔나요. 그리고 계좌 보이는거 설정할 때 색깔 있으면 보이는건줄 알았는데 숨기기였더라고요. 인터페이스가 직관적이지 않네요.,android
https://play-lh.googleusercontent.com/W43xj43ErMIs5BQgCdMKEa0NXCoUUW8DjQc5SxcDfLrC26H8sHDmoFIUWLYmsQahpo0=s180-rw,카카오페이,k쓰르라미,2022-02-10 00:00:00+09:00,2,1,저기 펀드보는게 안보여요,android
https://play-lh.googleusercontent.com/W43xj43ErMIs5BQgCdMKEa0NXCoUUW8DjQc5SxcDfLrC26H8sHDmoFIUWLYmsQahpo0=s180-rw,카카오페이,오승현,2022-02-10 00:00:00+09:00,2,6,펀드투자를 했는데 메뉴를 찾아들어가기 너무 어려움. 기능이 아무리 좋아도 사용자가 친화적이지 않음...ux에 개선이....,android
https://play-lh.googleusercontent.com/W43xj43ErMIs5BQgCdMKEa0NXCoUUW8DjQc5SxcDfLrC26H8sHDmoFIUWLYmsQahpo0=s180-rw,카카오페이,진지맨,2022-02-09 00:00:00+09:00,1,0,주식 먹튀한 회사에서 만든어플이 이건가?,android
https://play-lh.googleusercontent.com/W43xj43ErMIs5BQgCdMKEa0NXCoUUW8DjQc5SxcDfLrC26H8sHDmoFIUWLYmsQahpo0=s180-rw,카카오페이,박종원,2022-02-09 00:00:00+09:00,4,0,굿,android
https://play-lh.googleusercontent.com/W43xj43ErMIs5BQgCdMKEa0NXCoUUW8DjQc5SxcDfLrC26H8sHDmoFIUWLYmsQahpo0=s180-rw,카카오페이,꽃가게,2022-02-09 00:00:00+09:00,2,0,페이백 혜택도 없고. 이벤트 혜택도 적고. 돈을 집어 넣어둬야 하는 이유를 못찾겠음,android
https://play-lh.googleusercontent.com/W43xj43ErMIs5BQgCdMKEa0NXCoUUW8DjQc5SxcDfLrC26H8sHDmoFIUWLYmsQahpo0=s180-rw,카카오페이,안도경,2022-02-09 00:00:00+09:00,1,0,사용자 정보가 틀리다면서 가입조차 안 시켜주고 명의도 제데로 안 바꿔주고 뱅크만 계속 이용중인데 이럴꺼면 카카오 결제 뱅크도 하게 해주세요.,android
https://play-lh.googleusercontent.com/W43xj43ErMIs5BQgCdMKEa0NXCoUUW8DjQc5SxcDfLrC26H8sHDmoFIUWLYmsQahpo0=s180-rw,카카오페이,유효석,2022-02-09 00:00:00+09:00,5,0,굿,android
https://play-lh.googleusercontent.com/W43xj43ErMIs5BQgCdMKEa0NXCoUUW8DjQc5SxcDfLrC26H8sHDmoFIUWLYmsQahpo0=s180-rw,카카오페이,요한,2022-02-09 00:00:00+09:00,1,1,"아니 페이카드때문에 고객센터에 문의 남기면 답변은 맨날 똑같이 전화로 문의하라고 하는데, 전화하면 3시간, 4시간이 지나도 전화 연결이 안됨. 사용자 농락하는건가?",android
https://play-lh.googleusercontent.com/W43xj43ErMIs5BQgCdMKEa0NXCoUUW8DjQc5SxcDfLrC26H8sHDmoFIUWLYmsQahpo0=s180-rw,카카오페이,lpu,2022-02-08 00:00:00+09:00,1,0,그냥 스레기 같은앱. 앱 수준이 경쟁사 보다 너무 떨어짐,android
https://play-lh.googleusercontent.com/W43xj43ErMIs5BQgCdMKEa0NXCoUUW8DjQc5SxcDfLrC26H8sHDmoFIUWLYmsQahpo0=s180-rw,카카오페이,YS NOH,2022-02-08 00:00:00+09:00,3,0,"일본,마카오 말고도 전국 해외에서도 카카오페이 포인트로 결제 할 수 있게 개선했으면 좋겠어요.....",android
https://play-lh.googleusercontent.com/W43xj43ErMIs5BQgCdMKEa0NXCoUUW8DjQc5SxcDfLrC26H8sHDmoFIUWLYmsQahpo0=s180-rw,카카오페이,잠청,2022-02-08 00:00:00+09:00,1,0,기본보안설정이 왜 얼굴인식으로 되어있나요 예전폰 기종이여서 지문인식만 되는데 송금이 왜 안되지 엄청 찾았는데 결국은 얼굴인식 인증으로 되어있어서 안되더군요. 덕분에 시간 많이 날렸네요,android
https://play-lh.googleusercontent.com/W43xj43ErMIs5BQgCdMKEa0NXCoUUW8DjQc5SxcDfLrC26H8sHDmoFIUWLYmsQahpo0=s180-rw,카카오페이,최일현,2022-02-08 00:00:00+09:00,2,0,새계정으로 로긘 하려하는데 계속 기존으로 로긘 하라해서 걍 카카오페이 안쓰고 네이버페이 쓰러갑니당~,android
https://play-lh.googleusercontent.com/W43xj43ErMIs5BQgCdMKEa0NXCoUUW8DjQc5SxcDfLrC26H8sHDmoFIUWLYmsQahpo0=s180-rw,카카오페이,김태진,2022-02-07 00:00:00+09:00,5,0,용돈관리하기 아주 좋습니다,android
https://play-lh.googleusercontent.com/W43xj43ErMIs5BQgCdMKEa0NXCoUUW8DjQc5SxcDfLrC26H8sHDmoFIUWLYmsQahpo0=s180-rw,카카오페이,일상탈출,2022-02-07 00:00:00+09:00,1,0,특정 주식에서 호가버튼만 누르면 프로그램이 종료 됩니다 개선부탁합니다,android
https://play-lh.googleusercontent.com/W43xj43ErMIs5BQgCdMKEa0NXCoUUW8DjQc5SxcDfLrC26H8sHDmoFIUWLYmsQahpo0=s180-rw,카카오페이,오성진,2022-02-07 00:00:00+09:00,3,0,업데이트가안되요,android
https://play-lh.googleusercontent.com/W43xj43ErMIs5BQgCdMKEa0NXCoUUW8DjQc5SxcDfLrC26H8sHDmoFIUWLYmsQahpo0=s180-rw,카카오페이,JiYoung Park,2022-02-07 00:00:00+09:00,1,36,겉으로만 그럴싸하게 보기좋은 앱. 진짜 뭐하나 찾으려고 들어가려면 엄청 헤매다 들어가든가 못찾아서 포기. 가뜩이나 카카오뱅크랑 헤갈리는데 사용자경험은 하면서 개발하시나요? 펀드 해지하는것도 복잡해서 고객센터전화연결도 한참기다리다 겨우해지했다 생각했구만 왜 또 해지버튼눌렀는데 아직도 펀드가 살아있는건지..진짜 개미지옥아니구 앱지옥이네요 너무 답답해서 글남깁니다. 서비스도 중요하지만 좀 심플하게 만들어주시죠,android
https://play-lh.googleusercontent.com/W43xj43ErMIs5BQgCdMKEa0NXCoUUW8DjQc5SxcDfLrC26H8sHDmoFIUWLYmsQahpo0=s180-rw,카카오페이,대통령,2022-02-06 00:00:00+09:00,4,0,좋아요,android
https://play-lh.googleusercontent.com/W43xj43ErMIs5BQgCdMKEa0NXCoUUW8DjQc5SxcDfLrC26H8sHDmoFIUWLYmsQahpo0=s180-rw,카카오페이,Yoomin Kim,2022-02-06 00:00:00+09:00,1,0,카카오페이 리워드 서비스도 중지했네요?? 알모으기..별로모아지지도않지만ㅋ 배가불렀네요 정말,android
https://play-lh.googleusercontent.com/W43xj43ErMIs5BQgCdMKEa0NXCoUUW8DjQc5SxcDfLrC26H8sHDmoFIUWLYmsQahpo0=s180-rw,카카오페이,김건형,2022-02-04 00:00:00+09:00,1,3,나는 대체 언제 풀어주느지..사용도 못하는거 잘못눌러서 또 입금하고 미쳤지..정보 다보냈으면 풀어줘아지요.,android
https://play-lh.googleusercontent.com/W43xj43ErMIs5BQgCdMKEa0NXCoUUW8DjQc5SxcDfLrC26H8sHDmoFIUWLYmsQahpo0=s180-rw,카카오페이,장기석,2022-02-03 00:00:00+09:00,3,2,주식을 볼때 기본적으로 캔들 차트는 벌수있게해야지 만약 설정으로 하는 거면 직관적으로 잘보이는곳에 나와야하는건데 Mts로서는 기능이 만이 부족합니다,android
https://play-lh.googleusercontent.com/W43xj43ErMIs5BQgCdMKEa0NXCoUUW8DjQc5SxcDfLrC26H8sHDmoFIUWLYmsQahpo0=s180-rw,카카오페이,J.Y Kim,2022-02-03 00:00:00+09:00,4,3,주식 기능을 잘 사용하고 있습니다. 단 해외주식 거래시 호가창과 애프터 마켓 거래의 수정이 필요해보입니다.,android
https://play-lh.googleusercontent.com/W43xj43ErMIs5BQgCdMKEa0NXCoUUW8DjQc5SxcDfLrC26H8sHDmoFIUWLYmsQahpo0=s180-rw,카카오페이,이유라,2022-02-02 00:00:00+09:00,1,0,먼저 카카오페이가 14세미만은 사용할 수 없는게 너무 불편합니다. 최대한 11년생부터 사용이 가능했으면 좋겠습니다.,android
https://play-lh.googleusercontent.com/W43xj43ErMIs5BQgCdMKEa0NXCoUUW8DjQc5SxcDfLrC26H8sHDmoFIUWLYmsQahpo0=s180-rw,카카오페이,_하유밍,2022-02-02 00:00:00+09:00,3,1,다 모르겠고 만원씩 충전되는거 개빡쳐요 5천원도 아니고 만원단위라.. 천원 이천원 결제하는데 만원 빠져나가고..,android
https://play-lh.googleusercontent.com/W43xj43ErMIs5BQgCdMKEa0NXCoUUW8DjQc5SxcDfLrC26H8sHDmoFIUWLYmsQahpo0=s180-rw,카카오페이,인간,2022-02-02 00:00:00+09:00,1,1,아니 갑자기 안들어 가지고 이상한거 나옴,android
https://play-lh.googleusercontent.com/W43xj43ErMIs5BQgCdMKEa0NXCoUUW8DjQc5SxcDfLrC26H8sHDmoFIUWLYmsQahpo0=s180-rw,카카오페이,박민제,2022-02-01 00:00:00+09:00,4,0,제한된다고나오네요개발자님,android
https://play-lh.googleusercontent.com/W43xj43ErMIs5BQgCdMKEa0NXCoUUW8DjQc5SxcDfLrC26H8sHDmoFIUWLYmsQahpo0=s180-rw,카카오페이,a1g7 a1g7,2022-01-31 00:00:00+09:00,4,10,"주식 때문에 사용하는데 매우 좋습니다! 근데 기능적인 부분에서 요청 드립니다! 해외주식은 배당이 좀 중요한데, 각 주식마다 배당락일과 과거 배당 관련해서도 정보가 있었으면 좋을 거 같습니다. 카카오페이에서는 배당 관련 정보가 없어서 미니스탁을 확인하게 됩니다!",android
https://play-lh.googleusercontent.com/W43xj43ErMIs5BQgCdMKEa0NXCoUUW8DjQc5SxcDfLrC26H8sHDmoFIUWLYmsQahpo0=s180-rw,카카오페이,DoubleJ,2022-01-31 00:00:00+09:00,1,18,카카오페이 종합 계좌번호를 보기가 너무 어렵습니다! 당장 개선시켜주세요. 돈 부치려고 해도 계좌번호를 어디서 봐야하는지 전혀 직관적이지 않습니다.,android
https://play-lh.googleusercontent.com/W43xj43ErMIs5BQgCdMKEa0NXCoUUW8DjQc5SxcDfLrC26H8sHDmoFIUWLYmsQahpo0=s180-rw,카카오페이,오리,2022-01-31 00:00:00+09:00,1,160,미성년자인 나한테 있어서는 소중한 앱. 근데 UI가 너무 불편함.. 옛날에는 화면 한개에 다 있던게 이제는 3개로 나눠져있는데다가 송금 받을때는 또 버튼 눌러야해서 옛날에 비해 불편하고 느림 거기다가 맨 왼쪽 화면 들어가면 뭘 자꾸 시켜서 빡침. 선택지에 미성년자라서 못한다는 선택지는 없음? 이럴거면 걍 업데이트 하지 말지....,android
https://play-lh.googleusercontent.com/W43xj43ErMIs5BQgCdMKEa0NXCoUUW8DjQc5SxcDfLrC26H8sHDmoFIUWLYmsQahpo0=s180-rw,카카오페이,로블록스_설이,2022-01-31 00:00:00+09:00,1,1,전부다 14세여서 13살인데 쓸수도 없어서 불편해요ᆢㅠ 만 12세도 할수 있음 해요ㅠ,android
https://play-lh.googleusercontent.com/W43xj43ErMIs5BQgCdMKEa0NXCoUUW8DjQc5SxcDfLrC26H8sHDmoFIUWLYmsQahpo0=s180-rw,카카오페이,jonggwon kim,2022-01-31 00:00:00+09:00,1,1,저 제가 카카오 페이앱으로 펀드를 했는데 해당 금액이 전부 없어졌는데 어떻게 찾아야 하나요,android
https://play-lh.googleusercontent.com/W43xj43ErMIs5BQgCdMKEa0NXCoUUW8DjQc5SxcDfLrC26H8sHDmoFIUWLYmsQahpo0=s180-rw,카카오페이,최영광,2022-01-30 00:00:00+09:00,5,0,Perfect,android
https://play-lh.googleusercontent.com/W43xj43ErMIs5BQgCdMKEa0NXCoUUW8DjQc5SxcDfLrC26H8sHDmoFIUWLYmsQahpo0=s180-rw,카카오페이,귀욤까까,2022-01-30 00:00:00+09:00,5,5,간편 결제와 더불어 현금 관리를 하는데 아주 유능한 앱.,android
https://play-lh.googleusercontent.com/W43xj43ErMIs5BQgCdMKEa0NXCoUUW8DjQc5SxcDfLrC26H8sHDmoFIUWLYmsQahpo0=s180-rw,카카오페이,天魔,2022-01-30 00:00:00+09:00,3,1,카드결제를 우선순위로 올려주세요. 카드 포인트도 안나오는데 왜 현금결제가 우선순위가 되는겁니까?,android
https://play-lh.googleusercontent.com/W43xj43ErMIs5BQgCdMKEa0NXCoUUW8DjQc5SxcDfLrC26H8sHDmoFIUWLYmsQahpo0=s180-rw,카카오페이,김창호,2022-01-30 00:00:00+09:00,5,0,버킷리스트도 다른 기능들처럼 겉에 앱처럼 꺼내놓고 들어갈수있게 해주시면 좋을듯합니다^^!,android
https://play-lh.googleusercontent.com/W43xj43ErMIs5BQgCdMKEa0NXCoUUW8DjQc5SxcDfLrC26H8sHDmoFIUWLYmsQahpo0=s180-rw,카카오페이,삼려시민교회,2022-01-30 00:00:00+09:00,1,1,왜 다운로드자체가 대기를 기다려야하나요? 확인좀 부탁드립니다 다운자체가 안돼요!!,android
https://play-lh.googleusercontent.com/W43xj43ErMIs5BQgCdMKEa0NXCoUUW8DjQc5SxcDfLrC26H8sHDmoFIUWLYmsQahpo0=s180-rw,카카오페이,최효실,2022-01-30 00:00:00+09:00,1,1,에러가 너무 심해요~ 앱개발 제대로 해주세요 ㅜㅜ,android
https://play-lh.googleusercontent.com/W43xj43ErMIs5BQgCdMKEa0NXCoUUW8DjQc5SxcDfLrC26H8sHDmoFIUWLYmsQahpo0=s180-rw,카카오페이,이기철,2022-01-30 00:00:00+09:00,5,0,굿,android
