APP_NAME,USER,DATE,STAR,LIKE,COMMENT,OS
Nebulous.io,올레드가 좋더라(?) 😎,2022-04-06 09:59:08+09:00,5,0,주의* 중독성 강합니다,ios
Nebulous.io,ㅓ년,2022-03-28 21:03:30+09:00,1,0,아니 컨트롤 버그좀 못고쳐요? 아이폰을 무시해요? 어이가없어요 제발 고쳐요,ios
Nebulous.io,놓지마정신줄ㅋㅋ,2022-03-26 15:47:12+09:00,1,0,뒤질래?,ios
Nebulous.io,오늘 내방 대청소,2022-03-24 13:06:44+09:00,4,0,이게 닉네임 지울 때 렉 걸리더라고요 나갔다 와서 고치면 되긴 하는데 그래도 좀 불편해요 고쳐주세요 그래도 게임은 재밌습니다 스킨도 많고 사람들 잡아 먹을때마다 스트레스 풀리네요(?) ㅎㅎ 그리고 사람들이 채팅창에 심한 욕을 많이 하던데요 원래 욕 하면 검열되서 *이런 별모양으로 뜨잖아요 근데 사람들이 유저들 기분 나쁘게 막 시1ㅂ 이런 식으로 욕을 하더라고요 욕좀 더 씨게(?) 막아주세요 이런 것만 고쳐주시면 좋을 것 같네용,ios
Nebulous.io,ㄱㄴㄷㄷㄴ,2022-03-18 10:25:43+09:00,5,0,매일함,ios
Nebulous.io,귀욤이 짝짝이,2022-03-15 22:48:00+09:00,3,0,아이폰은 이름 할때 자음 모음 으로 나눠서 써집니다..안드로이드는 잘 써집니다 이것만 고쳐 주시고 아 그리고 또 아이폰 텍스트 지울때 맨 마지막 지울때 랙 걸려서 먹통 되요 그것도 고쳐 주세요 이거 빼고는 사실상 남 재밌고 강추 드려요 안드로이드만 강추.아이폰은 노추 다 재밌고 이건 져도 다시 할수 있고 삭제해도 다시 깔아도 레벨만 그렇지 그거 빼고는 다시 할수 있고 와이파이 없이 할수 있고 심심할때 몰폰 할때 강추 드립니다!! 아이폰은 쓰레ㄱ.. 읽어주셔서 감사합니다,ios
Nebulous.io,ㅂㅁㅁㄴㅇㅇ,2022-03-10 23:20:08+09:00,1,0,아이폰으로 비로그인 하는 법은 없나요? 애플 게스트 계정 없앴음 좋겠네요,ios
Nebulous.io,아 쫌 어쩌라고,2022-03-10 21:38:23+09:00,1,0,진짜 게임 말아먹으려고 작정을 하셨나 힘들게 모은 10만 플라즈마 버그 때문에 날려먹고 사용자 지정스킨 경고하는거랑 아무 상관없는 스킨인데 승인 거부하길래 뭐지 하고 봤는데 스킨 산 플라즈마 만개 먹튀 ㅆ1ㅂ ㅈ 같은 게임 다시는 안한다,ios
Nebulous.io,시운뎁쇼,2022-02-27 11:16:40+09:00,3,0,제가 어제 까지만 해도 렉 하나도 안걸리고 잘하고 있었는데 오늘부터 움직일 깨 렉 걸리고 반응속도 느려요 동생폰은 삼성인데 저희 둘다 오늘 렉걸리고 이상해요,ios
Nebulous.io,xnxmdc,2022-02-26 11:53:33+09:00,5,0,실수로 구매한 거 환불 부탁드립니다,ios
Nebulous.io,yangj25,2022-02-18 01:04:12+09:00,5,0,오랜만에 하니깐 재미있어요:),ios
Nebulous.io,어쩔 다이슨 청소기,2022-02-11 20:45:46+09:00,1,0,진짜 제발 혈압오르기 싫으면 깔지마 제빌 진짜 개싫어 ㅅ1발,ios
Nebulous.io,여쥬넴뉴자,2022-02-01 22:22:08+09:00,3,0,안사져요;; 진짜 왜이럼,ios
Nebulous.io,님아위에,2022-01-22 04:15:13+09:00,1,0,튕기는거 고쳐요 제발;;;,ios
Nebulous.io,ㅗㅓㅗㅜㅗㅝ,2022-01-21 22:02:01+09:00,1,0,계속 튕겨요 개같게,ios
Nebulous.io,네뷸업뎃 ㄲ,2022-01-15 10:28:11+09:00,5,0,vip 박혀닛나요ㅠㅠㅠㅠㅠ 전 산 적이 어죠는데 ㅎ흑.,ios
Nebulous.io,서구리...,2022-01-07 20:44:06+09:00,3,0,아이폰 인데 닉 지울때 마다 렉 걸려요;;,ios
Nebulous.io,수연밍밍해,2022-01-01 00:45:46+09:00,5,0,재밋어요,ios
Nebulous.io,사령관13,2021-12-23 15:49:53+09:00,1,0,아이패드가 오래 되서 그런진 모르겠지만 이 게임이 들어가려고 하면 나가 져요... 이 문제 꼭 수정해주셨으면 좋겠습니다... 심지어 로딩도 안되고 나가 져요...,ios
Nebulous.io,Nariel1,2021-12-18 09:39:33+09:00,5,0,안녕하세요. 2년째 하고있는 유저입니다. 게임을 만들고하고있는데 어떤^ㅣ**이들어와서 트롤짓하고 저를 계속잡아먹습니다. 단체 채팅 으로 그만잡아먹어 라고 했는데 도와준다고 뻥치고 저를 계속잡아먹습니다. 한사람만 계속 10번 잡아먹으면 추방되는 그런기능을 넣어주세요. 이거보라고 별 5개,ios
Nebulous.io,김뽑보,2021-11-29 21:20:05+09:00,2,0,어제 갑자기 페이스북 로그인이 안되면서 1렙 짜리 계정으로 로그인이 되는데 이 부분 좀 봐주시면 감사하겠습니다. 아이디는 23530459 이고 1렙 계정 아이디는 26252643 입니다 이 점 한 번만 다시 봐주시면 감사하겠습니다.,ios
Nebulous.io,ㄹㅇㅋㅋ언제고치냐,2021-11-28 16:49:34+09:00,1,0,튕기는것좀 고쳐주세요 캠페인이나 풍차하다가 10-15분에 한번씩 튕겨요,ios
Nebulous.io,광고 줄여줘요 ㅠㅠ,2021-11-16 11:38:00+09:00,1,0,아니 죽을때마다 광고나오고 원래 하던 서버로 안가지고 그섭 힘들게 깼는데 진짜 1점도 주기싫음 ㄹㅇ 하지도 마셈 하다가 삭제함 그리고 5분도 안돼서 계속 연결오류라고 뜨고 안들어가지고 이게 게임임?와이파이도 꽉차있는데 뭐가 연결오류임 제작자 테스트도 안하고 게임 만들었나 무슨 제작자 뭐 리뷰같은거 안보겠지 답글단거 한개도 못 봤구만 진짜   제작자는 일안해?그리고 계속 팀도바뀌고 죽이지도 못하잖아 이 망겜 플레이한 내가 더 멍청하겠네 에휴,ios
Nebulous.io,ㅎ.!:!:,2021-11-12 17:32:17+09:00,1,0,광고제거 샀는데 왜 적용이 안되나요 계속 광고떠서 불편하고 화가 나네요 돈만 받아먹고 왜 적용이 안되는건가요? 네뷸러스 아이디: 23613566 입니다.,ios
Nebulous.io,ahdjsjjdjssjjsjski,2021-11-08 12:18:36+09:00,1,0,꾸러기 구매하는거 했는데 돈은 나가고 전혀 뭐가 되지 않았습니다....,ios
Nebulous.io,버그좀고치라,2021-11-05 17:01:02+09:00,1,0,닉네임 자동띄어쓰기되는거하고 닉네임 끝까지 지우면 튕기는거 고치라니깐 말을 잘 안듣네 우리 제작자형들이 어????????!!!!!!,ios
Nebulous.io,게임 하다 튕겨서 항의 하러 왔네요;,2021-11-04 21:14:44+09:00,1,0,처음으로 1등해서 10000까지 갔는데 갑자기 튕기네요^^ 몇몇 사람들도 이랬다는데 커지는건 기대도 하지 않을게요^^;; ㅎㅎ,ios
Nebulous.io,아기뛰다,2021-10-31 19:04:36+09:00,1,0,친목 심함,ios
Nebulous.io,돈슨의 흑우,2021-10-31 09:31:25+09:00,1,0,한 15분에 한번씩 튕겨요,ios
Nebulous.io,수민0921,2021-10-18 12:18:39+09:00,2,0,.,ios
Nebulous.io,휴 ㅈ ㅣ,2021-10-08 22:09:29+09:00,4,0,조아요,ios
Nebulous.io,zkdndjc,2021-09-29 13:29:00+09:00,5,0,아니 내가 상대보다 훨씬 커서 얼음 쓰고 먹으려는데 왜 내가 갑자기 분열돼서 죽냐? 아니 개어이없네 이딴거 게임이라고 만들고 장난하나,ios
Nebulous.io,인맥망겜,2021-09-22 21:37:26+09:00,5,0,*목질하는게 전부인게임,ios
Nebulous.io,호리ㅏ리,2021-08-21 17:06:48+09:00,1,0,정말 짜증나네요,ios
Nebulous.io,베니야우,2021-08-18 02:58:09+09:00,3,0,다 좋은데 광고좀 줄여줘요 죽기만하면 15초 광고 진짜 개짜증나요,ios
Nebulous.io,nell넬,2021-07-27 23:48:19+09:00,3,0,불편합니다,ios
Nebulous.io,인생 참..,2021-07-25 19:26:11+09:00,1,0,..,ios
Nebulous.io,asdfg1020,2021-07-24 16:42:55+09:00,5,0,근데 왜 지렁이 게임은 사라졌나요..,ios
Nebulous.io,죄송합니다wm,2021-07-24 10:09:51+09:00,1,0,죄송하지만 이게임 언제 망하나요.. 중독성도 쩔긴 하지만 깡패들이랑 인성문제 있는 애들이 너무 많아서 망했으면 좋겠어요.. 그리고 거의 망겜이고 예전까지 살아 있던 게임이니 이정도면 망해야 하는거 아닌가요..,ios
Nebulous.io,717237,2021-07-19 18:36:31+09:00,1,0,15초짜리 광고 왤케 때려 넣음? 최악,ios
Nebulous.io,아기물방개,2021-07-17 15:41:26+09:00,4,0,근데 이제 성악설을 믿게 되었습니다 사람들은 모두 악해요,ios
Nebulous.io,모마손절,2021-07-17 12:47:18+09:00,4,0,정말 재밌고 중독성있는 게임이에요  근데 잼민이들이 넘쳐 나네요 채팅창을 없애버리는거도 하나의 방법이라고 생각해요 !,ios
Nebulous.io,땡구땡칠이,2021-07-13 08:11:22+09:00,5,0,재미다,ios
Nebulous.io,군석,2021-07-11 18:51:46+09:00,5,0,너무 재밌게 플레이하는 유저인데 제가 구글 계정 연동 전에 광고제거를 산후 연동을 시켰는데 조니까 광고제거가 계속 남아있는거 같은데 제거가 안되고 게임 플레이전 닉네임을 바꿀때 모음과 자음이 합쳐지지 않습니다 ㅠㅠ14753093 아이디는 이거고 한번 확인해 주시면 감사하겠습니다,ios
Nebulous.io,젭발고쳐주세요,2021-07-07 00:30:49+09:00,1,0,캠페인 미션15부터 봇이 안보이고 안움직이고 멈춰져요 항상 이러네요 고칠수있나요 게임 못할정도네요,ios
Nebulous.io,무이니이,2021-06-24 13:46:21+09:00,1,0,유저들의  문란한 채팅문화를 바로잡아야 합니다,ios
Nebulous.io,djfkdjfkdkd,2021-06-04 23:07:01+09:00,1,0,미쳤냐진짜 스킨 적용할려고 결제했는데 왜 안주냐,ios
Nebulous.io,너무실망이네요,2021-05-17 22:01:27+09:00,1,0,너무 별로네요  요즘 네뷸러스 너무좋아하고 앞으로도 계속 열심히 할려고 하는 우저였는데 이번업뎃으로 인해서 네뷸러스 오늘부로 그만둡니다.,ios
Nebulous.io,카츠카츠카츠카츠카츠,2021-05-17 17:30:14+09:00,5,0,안녕하세요. 카츠입니다. 오늘 저는 새로운 모드를 만들어주셨으면 한 모드 추천을 들고왔습니다. 저가 생각한 모드는 캠페인에 있는 단계별 미션을 따로 원하는 모드만 골라서 할 수 있게끔 하고 싶어서 리뷰를 작성하게 되었습니다. 이를 만들어 주셨음 합니다. 감사합니다,ios
Nebulous.io,오랜만에 하는 세포키우기,2021-04-28 22:35:41+09:00,2,0,아이폰인데요..닉 지울때마다 마지막 한 글자 남기고 안지워지네요 렉같아서 몇번을 나갔다 들어와도 렉이..,ios
Nebulous.io,율랭방구,2021-04-25 17:07:22+09:00,1,0,"게임 너무 재미있어요 근데 동맹이 너무 심해요 동맹도 동맹 나름이지 팀킬하려는 목적, 그냥 그들끼리만 재미있기위한 목적이예요",ios
Nebulous.io,환불부탁 사놓고 못씀,2021-04-23 23:40:51+09:00,3,0,광고제거를 구매하였는데 적용되지도 않고 이게 뭔지 모르겠네요.  환불부탁드립니다. 환불안되면 고소하죠 뭐,ios
Nebulous.io,ㄴㄹ뱌오,2021-04-13 07:35:16+09:00,1,0,솔까 아이폰이라 그런것도 있는데요 힘들게 새포 키워놨는데 ㅋㅋㅋㅋ 갑자기 오류라면서  나가진다고 제발 제대로좀 만드세요,ios
Nebulous.io,증발한 물,2021-04-03 23:05:33+09:00,5,0,고인물들이 팀을 맺어서 뉴비들을 죽이니까 새로운 뉴비가 생기질 않아요.,ios
Nebulous.io,댕댕s,2021-03-28 22:17:30+09:00,1,0,병신겜 ㅋㅋㅋ 다시는안한다,ios
Nebulous.io,공주대가리,2021-03-18 13:54:03+09:00,1,0,게임 자체는 재밌는데 렉 개많이 걸려요,ios
Nebulous.io,이쁜윤주,2021-03-15 23:40:35+09:00,2,0,예전에는 렉도 없고 광고도 없어서 재밌게 했는데 지금은 죽으면 광고 15초짜리 있고 렉도 심해서 블렉홀만 먹으면 멈춰서 다른얘들한테 먹혀요 하다가 렉걸리면 빡쳐서 정떯어짐요,ios
Nebulous.io,해요천은사,2021-03-14 13:23:25+09:00,1,0,자꾸 에러 가 나요 로그아웃을 했는데 계속 에러 가 나네요 친구들이랑 게임 도 못하고 참;;;,ios
Nebulous.io,축구퀴즈2017 광고 개많음;;,2021-03-08 18:37:25+09:00,1,0,무슨 니 수염털 마냥 많아,ios
Nebulous.io,코오ㅗㅇ어우,2021-02-28 14:52:07+09:00,1,0,광고만 오질라게하고 광고 도중 멈춤,ios
Nebulous.io,이글 봐주세요,2021-02-22 23:58:39+09:00,1,0,제작자님 꼭 이 글 읽어 보시길 바라겠습니다 지금 현재 이 게임은 티밍이 너무나도 당연히 생각을 하고 있고 게임을 돌릴때마다 티밍을 무족권 하고 있습니다 개발자님 이건 진짜 심각한 문제입니다 이거 티밍 때문에 신규 유입하는 유저들도 게임들 못할거고 어떻게든 방안을 생각을해서 티밍을 없애거나 실시간 밴을 때리거나 게임을 녹화해서 신고를 받으면 확인을해서 영구정지를 먹인다거나 너무 티밍이 심각 합니다 이렇게 좋은 해결책이 너무나도 많아 넘치는데 대체 개발자님은 무엇을 하고 계신가요 제발 이 글을 읽어 보시고 좋은 방안을 내주셔주셨으면 좋겠습니다,ios
Nebulous.io,다빈빈빈,2021-02-13 23:26:23+09:00,4,0,아이폰으로 바꿔서 겜 하는데 .. 닉 쓸때 자음 모음이 붙어서 써지지가 않아요 !! 특히 닉네임 쓸때 ㅠㅠ,ios
Nebulous.io,안해다신,2021-02-08 19:59:16+09:00,2,0,"오른쪽 대각선으로 방향 전환 시에 분열 버튼 안눌리구요 한글 입력 시 자음,모음 떨어져서 입력됩니다 이 에러는 오래됐는데 매번 업데이트할 때 수정되질 않는데 대체 무슨 버그수정을 했다는 건가요? 그리고 광고가 많이 심합니다  이럴거면 걍 업데이트 하지 마세요",ios
Nebulous.io,ㅂㄹㅂㄹㄱㅅ,2021-02-05 14:58:54+09:00,1,0,개인전게임에서 동맹맺어서 고속(?)하니 개인전을 즐기는 맛이없군요!!,ios
Nebulous.io,rosarla,2021-02-04 09:57:28+09:00,1,0,"닉이 안써지고,고속(?) 그거때문에 게임을 잘 할수가 없네요..",ios
Nebulous.io,명별별별별별별,2021-02-02 12:54:55+09:00,3,0,60분동안 플레이가 제한됩니다 자꾸 이렇게 떠요. 전 아무것도 한게 없는데... 왜이러죠?,ios
Nebulous.io,한번만 봐주시죠,2021-02-01 21:03:39+09:00,5,0,너무 재밌어요 영원한 게임이 되세요~!,ios
Nebulous.io,반성해 라플,2021-01-25 06:45:43+09:00,2,3,아이폰이라 그런지는 몰라도 안드로이드 때는 잘됐는데 아이폰으로 하니까 닉 오류 때문에 지울때마다 렉걸려서 다시 나갔다와도 못 고치네요 너무 불편해요,ios
Nebulous.io,jgfoyftix,2021-01-22 12:52:55+09:00,1,0,좀 잘만들던가 핵노잼으로 만들어놓고 죽을때마다 뜨는데 너무 싫음  이거 인기 유지할려면 광고부터 바꿔야할듯,ios
Nebulous.io,rnjsdldks,2021-01-13 17:41:06+09:00,1,0,광고가 너무 많아요,ios
Nebulous.io,COCONAT10killer,2021-01-13 07:56:10+09:00,3,0,제가 아이패드 프로13 이고 저장공간도 별로 없는데 왜 자꾸 게임에 안들어가지고 로딩중화면만 뜨나요? 지웠다 깔아도 안되고 정말 불편합니다 뻐른 시일 내애 고쳐주십시요,ios
Nebulous.io,조지아에서 온 수래,2020-12-28 23:52:01+09:00,1,0,IOS는 포기 하신건가?그리고 다운로드를 하라는 건가요 말라는 건가요?,ios
Nebulous.io,업데이트 해줘,2020-12-18 20:49:00+09:00,1,0,아니 아이템때문에 할 수 있는게 없어요 열심히 커져도 아이템으로 작게만들고 하(;(;(;;;; 진짜 어이없네 이건 깔아도 다시 지우게 만드는 게임이에요🤬🤬🤬🤬🤬🤬🤬🤬🤬🤬🤬🤬,ios
Nebulous.io,네뷸망겜,2020-12-14 13:59:23+09:00,1,0,이 게임 하지 마세요 한국 유저도 드릅게 없고 운영자가 일을 안해요 ㅋㅋ 정지도 그냥 문의 내용 안보고 그냥 막 먹이고 죽을 때 마다 광고 떠요 무슨 ㅋㅋㅋ 그냥 이 게임 하지 마시고 다른 게임 찾아보세요,ios
Nebulous.io,아아아아ㅏ아아아아아앙ㄹ아아,2020-12-12 13:18:18+09:00,1,0,아이폰 업데이트 좀 빠르게 해주세요.,ios
Nebulous.io,관리자 걍 없애버려,2020-12-12 03:07:04+09:00,1,0,관전만 하고 얘기만했다고 팀플로 밴먹이네 진짜 어이없다 걍 관리자 일 하는척 오지네 진짜,ios
Nebulous.io,잼스뽄드,2020-12-09 14:58:02+09:00,1,0,아니 제작자님 아이폰꺼는 업뎃 안해요? 친구들이 같이 하자해서 했는데 저만 못하잖아요!!! 아이폰 없뎃좀 해줘요,ios
Nebulous.io,하하하하하하하하하핳ㅎㅎㅎㅎㅎ,2020-12-09 10:10:19+09:00,3,0,ㅈㅂ 안끊기게좀 ㅂㅌ 드림,ios
Nebulous.io,짜증나에 이거,2020-12-08 17:01:09+09:00,1,0,야 시발롬이 아이템 해서 나 지게 만들고 이거 땜에 3개 핸드폰 뿌셔 먹었느냐!,ios
Nebulous.io,ㅋㅋㄹㅃㅃ잼민잼민,2020-12-08 09:11:30+09:00,1,0,진짜 노잼 깔지마,ios
Nebulous.io,이름입력하기싫다고,2020-12-06 12:58:39+09:00,1,0,제가 아이폰 11산지 6개월도 안됐는데 제 핸드폰이 안좋아서 그런건 아닐테고 자꾸 렉걸리고 팅기고 겜 시작도 안했는데 이름설정하다가 그대로 멈춰서 아무것도 안눌리더라구요^^ 왜 이럴까요,ios
Nebulous.io,네뷸러스 업그레이드 ㅠㅠ,2020-12-01 10:11:12+09:00,3,0,제발 아이폰도 안드로이드랑 같이 업데이트 해주세요,ios
Nebulous.io,우산쓰는 남고생,2020-11-20 23:06:07+09:00,1,0,ㅉㅉ,ios
Nebulous.io,호홍~~^^최악이내용,2020-11-20 19:31:12+09:00,2,0,개인전이든 팀전이든 자기들끼리 티밍 해서 진짜 짜증 나는데 이거 신고 하면 바로 좀 조치 취해 주세요;; 티밍 하는 얘들 너무 많아서 많이 신고하면 기다리라고 하고 개빡치네요,ios
Nebulous.io,가나다라102837,2020-11-08 18:04:56+09:00,1,0,섭종 해주세요 ㅈ망겜 접고싶어도 접을수가 있어야지 진짜 ㅈ망겜..,ios
Nebulous.io,개 노 잼,2020-11-07 11:29:54+09:00,1,0,팀전인데 다른 팀끼리 팀플하는게 말이 됨? 다른 이유는 글을 적는 시간조차 아까워서 안씀,ios
Nebulous.io,망했놐,2020-10-26 00:01:01+09:00,1,0,울트라 때매 망함,ios
Nebulous.io,서한울양,2020-10-25 15:07:38+09:00,5,0,이게임 진ㅉ ㅏ 너무 좋아학 ㅓ 든ㄷ요?,ios
Nebulous.io,에ㅔ에엥,2020-09-29 22:36:16+09:00,1,3,"게임 자체는 매우 독창적이고 재미있습니다.하지만 심각할 정도로 동맹, 즉 티밍을 하는 유저들이 넘쳐납니다........ 개인전은 물론이고 팀전에서도 같은 팀끼리 뭉쳐야 할 판에 서로 친구라는 이유로 다른 팀끼리 서로 동맹을 하는 경우가 다반사입니다. 이렇게 암묵적으로 동맹이 이뤄지는 문제들 때문에 뉴비들 유입도 힘들고 어느정도 적응하면서 게임하는 사람들도 친목질하는 고인물 때문에 오래가지 못하더군요. 이러한 기형적인 플레이 현상을 뿌리뽑지 못한다면 이 게임은 진가를 발휘하지 못한 채 친목질에 가려져 망할 것 같습니다..개발자님이 동맹 현상을 없앨 수 있는 방안을 꾸준히 마련해주신다면 다시 네뷸러스가 옛 전성기를 되찾을 수 있을것이라 믿습니다.",ios
Nebulous.io,떠영인뎅,2020-09-28 15:11:01+09:00,1,0,로그인하려는데 저꾸 오류뜨고 코드3이뭐임,ios
Nebulous.io,타느타누텨ㅐ나,2020-09-26 01:15:49+09:00,1,0,한국어로 이름 설정도 안되고 렉도 ㅈㄴ 걸려요 업뎃 좀 해줘요,ios
Nebulous.io,방득득이,2020-09-22 01:03:21+09:00,4,0,갤럭시에선 한글 입력잘되었는데 게임아이디 설정시 한글은 글자완성이 안되고 ㅎㅏㄴㄱㅡㄹ 이런식으로 밖에 안되네요,ios
Nebulous.io,너무ㅠ커져넞,2020-09-09 07:42:21+09:00,1,0,닉네임을 설정 할때 ㅎ ㅣㅅ ㅣ 이따구로 되서 닉네임이,ios
Nebulous.io,mr.츄,2020-09-07 03:07:21+09:00,1,0,너무좋어여,ios
Nebulous.io,100렙 미만 유저ෆ⃛,2020-09-03 07:21:25+09:00,4,0,"100렙 미만 유저들은 플마 기부를 못한다거나,추방을 못시키는 제도는 폐지하는게 맞는 것 같습니다.",ios
Nebulous.io,청인(淸仁),2020-09-01 10:00:58+09:00,1,0,팀전에서 다른팀하고 팀플하는 개새끼들좀 처벌해주세요.  아 ㅆㅂ 입맛떨어지는 게임,ios
Nebulous.io,가류나뉼,2020-08-30 20:49:53+09:00,1,0,ㅋㅋㅋㅋㅋㅋㅋ 스킨 사라졌는데 복구해주세요 하,ios
Nebulous.io,그릇만드는,2020-08-29 23:33:24+09:00,1,0,친구들이랑 재밌게 할려다가 기분 다 잡쳤네요~ 열심히 분발해보세요 응원합니다^^,ios
Nebulous.io,그럼 별명을 뭘로하라는거임? ;;;;,2020-08-23 13:58:26+09:00,4,0,렉 너무 많이 걸려요 ㅠㅠㅠ 고쳐주세요,ios
Nebulous.io,ㅂㄷㅎㅋㄴ,2020-08-22 11:52:43+09:00,5,0,닉네임:블롭잉  다짜고짜 패드립하고 욕하고 성드립해요 제발 저런 급식들 관리 좀 해줘요,ios
Nebulous.io,닉넴첨봐?,2020-08-20 19:02:52+09:00,5,0,"동아시아 서버 1,2등 맨날 지들끼리 먹고 먹히고 농락함 ㅇㅈ?",ios
Nebulous.io,🍎사과,2020-08-20 14:06:34+09:00,5,0,이름이 갈려요  예를들면 라라는 ㄹㅏㄹㅏ 로요,ios
Nebulous.io,무꼬잉,2020-08-19 13:12:20+09:00,3,0,정말 다 좋고 게임도 재밌는데 팀전에서 다른팀과 함께 고속하는 사람들 좀 게임 못하게 좀 해주시면 안되나요 게임 하는데 방해가 되요,ios
Nebulous.io,llllIIllIll,2020-08-18 20:03:05+09:00,3,0,재미는 있는데 맵 크기가 너무 작네요 더 넓혀주세요,ios
Nebulous.io,태현이입니다,2020-08-16 04:44:36+09:00,3,0,미안하다이글보라고오그러끌어봤다제작자아폰업데이트안해주는건지못해주는건지말도안하고그러면플레이어는뭐가되냐진짜실화냐,ios
Nebulous.io,팀플 하지마세요,2020-08-15 13:47:17+09:00,2,0,진짜로 이게임 재미는 있는데 팀플때문에 너무 스트래스를 받고 하고싶은 의지도 떨어집니다 팀플 제발 없게 해주세요 부탁입니다,ios
Nebulous.io,백로 - uccdo,2020-08-14 17:03:22+09:00,2,0,"티밍 좀 잡아주시면 안 되나요 타이밍 노리고 2:1로 하는데 제가 어케 이기나요,,",ios
Nebulous.io,?!!???!!?!?,2020-08-11 13:39:32+09:00,1,0,니들 돌아이야? 싸발 스킨증에 장범기가 왜 있어 미친놈들 아니야?,ios
Nebulous.io,예니😻,2020-08-10 16:27:40+09:00,3,0,업데이트 좀 많이 해쥬세여 ㅠㅠㅠ 제발 ㅠㅠ 아이폰 7 유저에엽,ios
Nebulous.io,별명이왜이렇게많이겹쳐,2020-08-09 17:58:57+09:00,4,0,개인전도 심각한데 팀전까지ㅋㅋㅋㄷㄷ,ios
Nebulous.io,겜페다,2020-08-05 19:19:02+09:00,5,0,업뎃 넘모조코,ios
Nebulous.io,이이이라라리잏ㄹ,2020-08-04 17:49:55+09:00,5,0,넹!,ios
Nebulous.io,아잉뀨뿌잉,2020-08-01 18:56:55+09:00,1,0,왜 대한민국 서버가 없나요 개빡치네요,ios
Nebulous.io,ㅏㅡㄱㄴㄷㅂㅅㅈㅇㄴㄱㅂㄷㄱㅅㄷㆍㅅㅇ슨ㅂㅅㄴㄱㄷㄴㅅㄴ,2020-07-28 22:13:32+09:00,1,0,그냥 사람들이 구리다고헤서,ios
Nebulous.io,재미써요용ㅇ,2020-07-14 10:20:50+09:00,2,0,이거 최애 게임이에용 아 너무 재밌어서 맨날해서 꿈에도 나오네용ㅋㅋ,ios
Nebulous.io,smsuyeon,2020-07-14 00:19:59+09:00,1,0,아이폰도 제발 한국서버 들어갈수 있게 해주세요!!!!!!!!!!!!!!!!!!! 난 한국서버가 좋단 말이야ㅠㅠㅠㅠㅠㅠㅠㅠㅠㅠ,ios
Nebulous.io,시몬 승희,2020-07-01 23:35:03+09:00,1,0,안녕 나는 한국인 업그레이드 빨리 제발,ios
Nebulous.io,sexy gat,2020-06-28 12:57:59+09:00,4,0,초등학생때 하던건데 지금 와서도 재밌어요,ios
Nebulous.io,좆뷸러스,2020-06-23 01:07:39+09:00,1,0,업데이트를 하면 할수록 조잡해져서 회생 불가능한 쓰레기 게임이 되었음 5년 전 버전으로 되돌리는 것 말고는 이 게임을 살릴방법이 없는거 같다,ios
Nebulous.io,도라주연,2020-06-23 01:00:40+09:00,5,0,앱 내에서 게임 속 소리를 조절하는 기능이 있나요 ? 있으면 누구든 알려주세요ㅠㅠ 없으면 만들어주시면 감사합니다,ios
Nebulous.io,ㅎㅂㅂㅈㅂㄴ,2020-06-17 12:05:55+09:00,1,0,그자체,ios
Nebulous.io,kms7289,2020-06-16 18:48:32+09:00,1,0,울트라 저격 안쓰고 싶을때도 강제로 써야해서.. 안드로이드 처럼 울트라저격 사용할지 안할지 선택할 수 있게 해주세요,ios
Nebulous.io,멀바예버?알아어저라고,2020-05-31 20:01:25+09:00,5,0,렉도 엄청 나고 어색하고 이상해요. 제발 좀 고쳐 주세요,ios
Nebulous.io,무닌찬,2020-05-30 20:35:35+09:00,5,0,원래대로 줄여주세요,ios
Nebulous.io,제발렉좀제발,2020-05-20 19:25:58+09:00,1,0,도저히 할 수가 없네요  대체 렉 제거하는데에 돈은 왜 내야하는거고요? 다른 쪽으로 마케팅 해도 되잖습니까 렉좀 제발.,ios
Nebulous.io,세포키우기마스터,2020-05-20 06:17:13+09:00,1,0,계속 나만가꼬 그래요 애들이 너무 잘해요,ios
Nebulous.io,갸부르스튜,2020-05-17 00:55:24+09:00,4,0,드디어 겜다운 게임하는거 같아서 기분 좋네염^^,ios
Nebulous.io,ㅇ̆̈ㅅ̆̈ㅇ̆̈,2020-05-17 00:45:24+09:00,4,0,갤럭시는 나왔는데 아이폰은 아직안나왔네요,ios
Nebulous.io,이것만 고쳐주세요 ㅜㅜ,2020-05-16 08:57:51+09:00,3,0,요즘 넘 재밌게 하고있는게임인데요 진짜 버그나 오류땜에 미칠거같아요 막 겜 플레이 하면 소리가 엄청 크게 나요. 제가 원해서 소리를 크게하는것도 아닌데 지혼자서 막 소리가....그래서 그게 제일 불편해요.그리고 게임방 들어갔는데 갑자기 이유없이 튕기고 뭐 에러 생겼다면서 메일이랑 플마 기부도못하고 막 트릭방 가면 투명벽처럼 막 못가고 지혼자서 가서 다른사람한테 먹히고.....제가 업뎃도 다하고 폰도 껐다 켰다도 했는데 않되네요. 진짜 너무너무 불편합니다. 제발제발 고쳐주세요. 부탁할게요 ㅜㅜ,ios
