APP_NAME,USER,DATE,STAR,LIKE,COMMENT,OS
"TMAP - 대리,주차,전기차충전,킥보드를 티맵에서!",Bluuueee,2022-04-07 00:51:13,4,0,카플레이 차선정보가 폰으로 티맵볼때처럼 꾸준히 보여주면 좋겠습니다. 다음 차선정보까지 함께 보여주는 폰 화면과 같다면 무조건 티맵만 쓸 것 같아요. 다른 네비에는 지원해주던데 꼭 필요한 기능 같습니다,ios
"TMAP - 대리,주차,전기차충전,킥보드를 티맵에서!",개거지같은 티맵,2022-04-06 18:31:08,1,0,미친거같아요 저번에도 멀쩡한길 냅두고  계양으로 뺑뺑 왔던갈 그대로 돌아가게하더니 심지어 톨비도 팔천원 내고 돌아갔어요ㅡㅡ 그리고 이번엔 또 지하차도인데 좌회전할곳이 어딧다고 목적지가 눈에 보이는정도였는데 갑자기 13키로가 늘어서 지금 가뜩이나 막히는 도로 또 톨비내고 사십분 넘게 시간날리고 기름날리고 목적지 다와서 또 아예 나가지도 못하게 지금 왔던길 돌아서 다시 가고있네요  업데이트하고 다시 목적지 설정햌ㅅ더니 갑자기 또 원래 알려주돈길 보다 시간은 더 늘고 톨비는 4000원 내라네요 최악중에 ㅍ최악 길을 알려주는게 아니라 돌아가기 전용 ㄴ네비어플?맞죠?ㅡㅡ,ios
"TMAP - 대리,주차,전기차충전,킥보드를 티맵에서!",익명0202282838,2022-04-06 15:18:13,3,0,음… 예전이나 지금이나 UI.UX.그래픽 변화 없네요. 그리고 가까운길 빙빙돌아가는경우가 많습니다,ios
"TMAP - 대리,주차,전기차충전,킥보드를 티맵에서!",옹ㄲㅎㄹㅇㅊ,2022-04-06 06:45:09,4,0,"추천 차선 모드 생기면 , 이 세상 모든 사람들이 티맵을 쓸 것 같습니다 ㅠㅠ  부산 같은 곳은 가다가 직진차선이 막 바껴요....",ios
"TMAP - 대리,주차,전기차충전,킥보드를 티맵에서!",주2회로,2022-04-05 18:46:08,3,0,운전점수 100점시 위젯에서 표시디지 않음,ios
