APP_NAME,USER,DATE,STAR,LIKE,COMMENT,OS
"샐러디 - Eat Better, Be Better",쮸59586,2022-03-23 11:14:54+09:00,1,0,계속 같은 비번 쳐도 안맞다고 나와요 ㅡㅡ,ios
"샐러디 - Eat Better, Be Better",naaanhyang,2022-02-19 09:15:40+09:00,3,0,스탬프적립 다 해서 쿠폰 사용할려고 하는데 쿠폰은 발행은 되었으나 오류라면사 바코드가 안보이네요? 그래서 기한 내내 오류가 떠서 제 쿠폰이 날라갔고 현재 남아있는 쿠폰도 오류도 못쓰네요 오류 언제까지 뜨나요,ios
"샐러디 - Eat Better, Be Better",인터트로칸터,2022-02-04 14:47:03+09:00,3,0,샐러디 잘 먹고 있는데  앱을 통해서 미리 주문을 하고 또 본인이 원하는 카드를 등록해서 결제할 수 있는 시스템을 만들었으면 좋겠습니다.  충전시켜서 이자따먹을 생각부터 하지 마시구요.,ios
"샐러디 - Eat Better, Be Better",hoyting,2021-11-29 11:26:06+09:00,1,0,날려먹은 쿠폰만 몇개냐 대체 로그인이 안되면 어쩌자는거 어플 왜만든겁니까??? 소비자 더 떨어져나가라고 만든거?,ios
"샐러디 - Eat Better, Be Better",zxcv9605,2021-10-20 18:11:03+09:00,1,0,이전 앱 선불충전 해놨었는데 새로운 어플 깔리고는 기존에 있던 아이디 다 없어지고 충전금액도 없어졌는데 환불처리도 안 해주시고 그대로 소멸된건가요 다시 선불금약 넣어주셔야하는 거 아닌가요,ios
"샐러디 - Eat Better, Be Better",어우메이찡,2021-10-15 09:53:05+09:00,1,0,오더주문하려고 어플설치햇는디.. 어플존재의 이유가…??,ios
"샐러디 - Eat Better, Be Better",경기펭하,2021-10-14 14:20:21+09:00,1,0,샐럽오더 언제 되는거에요…!?? 네이버 블로그에는 8월 예정으로 되어있는데 아직이네요…,ios
"샐러디 - Eat Better, Be Better",twinnkkle,2021-10-07 15:46:12+09:00,1,0,선불카드 결제한 후 사용했는데 몇 번을 시도해도 로그인이 안됩니다. 혹시 몰라 아이디 찾기랑 비밀번호 변경도 해봤는데 계속 오류가 나네요. 이렇게 계속 오류가 나면 선불카드 잔액은 어떻게 사용하나요?,ios
"샐러디 - Eat Better, Be Better",qkxx425,2021-09-28 12:34:24+09:00,1,0,쓸 때마다 로그인 튕겨져 있는 거 너무 짜증나요 앵간하면 참고 쓰는데 너무 자주 로그아웃 되어 있으니까 쓰기 싫어지네요,ios
"샐러디 - Eat Better, Be Better",4638257472994495,2021-09-24 18:24:08+09:00,1,0,들어가면 ㄹㅇ ㅈㄴ 튕겨요 이거  기본적인건 확인하고 내셔야져 어플을;;;;;,ios
"샐러디 - Eat Better, Be Better",속도 개선,2021-09-10 12:31:39+09:00,1,0,진짜 불편합니다. 어려운 일 아닌데 왜 아직도 해결이 안되나요?,ios
"샐러디 - Eat Better, Be Better",Fteam73,2021-09-09 17:05:54+09:00,1,0,"에러나고,  자동로그인은 매번 풀리고.. 아예 동작도 안하니 선불금액 시용도 못하고 이거 환불이라도 받을수 있을런지? 게다가 매장에서 이거 들이밀면  직원들이 죄다 어케 결재하는지 몰라 버벅인다...  자사앱쓰는거 자체가 주문시 가장 민폐가 되는 아이러니",ios
"샐러디 - Eat Better, Be Better",고추밭인가 여긴,2021-08-31 13:49:21+09:00,1,0,나도 샐럽오더 사용하게 해줘요 8월 초에 해준다면서요,ios
"샐러디 - Eat Better, Be Better",snowman kwon,2021-08-30 20:03:50+09:00,2,0,자주 이용하는데 갈때마다 로그인이 풀려 적립할 때마다 너무 불편해요 개선해주세요.,ios
"샐러디 - Eat Better, Be Better",지히히히,2021-08-27 09:48:18+09:00,1,0,자동로그인이 자꾸 풀려서 사용할때마다 로그인하는거 귀찮습니다. 개선해주세요.,ios
"샐러디 - Eat Better, Be Better",커비타마,2021-08-25 19:48:53+09:00,1,0,앱을 왜 만든건지 의문.. 사람들이 피드백을 보내면 고쳐야지 기본적인 것도 안되는데 수정은 전혀 없고; 노답 어플임,ios
"샐러디 - Eat Better, Be Better",ㅋㅋㅋㅋ아이디가어터케,2021-08-25 11:07:36+09:00,1,0,샐러디 이제막 유명해져서 어플만들었나본데 제대로되지도않아요 ! 로그인도 안되는게 말됨?,ios
"샐러디 - Eat Better, Be Better",라쭝,2021-08-24 08:22:29+09:00,2,0,비대면 주문 기능 때문에 다운받았는데 사용 못하네요 ... ㅠ,ios
"샐러디 - Eat Better, Be Better",Lovely Stella,2021-08-20 08:34:48+09:00,1,0,그것 때문에 굳이 다운받았는데 오더가 안됨 요즘 브랜드 어플 중에 오더 안되는 어플이 어디있는지,ios
"샐러디 - Eat Better, Be Better",brilliant olive,2021-08-18 19:51:18+09:00,1,0,자동로그인 해제는 인내심을 갖고 매번 설정해봤자 어차피 안된다. 사이렌오더 같은 기능이 생긴다고 광고는 하더니 정해진 기한도 거의 20일 가까이 못지키는 걸 보니 지워야 겠다는 생각이 든다.,ios
"샐러디 - Eat Better, Be Better",뾰뇨,2021-08-17 19:43:10+09:00,1,0,"기존 어플에서 선불로 충전했던 금액을 사용하고 싶습니다. 기존 어플로 로그인을 하면 서비스 만료 안내창이 나오고, 새로운 어플로는 로그인도 안되는 상황이에요... 가입했던 핸드폰 번호로 아이디 찾기해도 정보도 나오지 않군요 이부분부터 해결해 주셔야 하는 거 아닌가요? 어플 잘 사용하고 있운데 왜 어플을 새로 만들어서 이런 문제를 발생하시는지 모르겠네요",ios
"샐러디 - Eat Better, Be Better",수정요만,2021-08-08 01:11:32+09:00,1,0,아직 사용가능한 수준이 아닌데 기존앱 로그인 막아놓으셨네요. 매장 검색후 사진이 실 매장 사진이 아니고 즐겨찾기 설정도 불가합니다. 기존앱 아이디에 휴대전화 번호 연동 안해 놓았으면 스탬프 연결도 안되고 매장수 적지도 않은 회사에서 왜 이런식으로 일을하는지..?,ios
"샐러디 - Eat Better, Be Better",안켜져ㅡㅡ,2021-08-05 18:36:31+09:00,1,0,자동로그인 왜 맨날 풀리나요 운동하는 것보다 매번 로그인하는게 더 귀찮네요,ios
"샐러디 - Eat Better, Be Better",요니아아이,2021-08-03 08:14:59+09:00,1,0,자동로그인 매번 풀려있어서 계속 로그인 해야함 ㅡㅡ 빨리 개선해주세요 가장 기본적인거 아닌가요,ios
"샐러디 - Eat Better, Be Better",강매해 별다섯개 받으면 좋나요,2021-08-01 14:49:27+09:00,2,0,"이전버전 로그인도 안되고, 폰번호도 등록이 안되어 있다그래서 새로 회원가입 했는데 전에 충전해둔건 어떻게 되는거죠?",ios
"샐러디 - Eat Better, Be Better",Akakkka,2021-07-29 15:09:33+09:00,1,0,이전 앱도 업데이트가 아닌 신규 앱으로 대체된다고 하여 상당히 번거로웠습니다.. 근데 신규 앱은 매번 자동로그인 해제가 되네요. 자동로그인이 대단히 어려운 기능도 아니고; 이럴거면 왜 새로 만드셨는지 이해가 안갑니다. 이거 때문에 샐러디 가기 싫어질 정도로 열받네요. 제발 기본적인 기능은 제대로 점검해서 출시해주세요.,ios
"샐러디 - Eat Better, Be Better",리리리리릴ㅇㅇ,2021-07-28 19:17:17+09:00,1,0,앱 켤때마다 로그인 해야됌....^^,ios
"샐러디 - Eat Better, Be Better",Kimchimannn,2021-07-27 19:39:37+09:00,1,0,"다른 분께서도 적어주셨는데 매번 자동로그인이 풀리는 문제는 저도 똑같이 겪었습니다. 매장에 선불카드 바코드 제시했을때 한 번에 결제되는 일은 전무했고 결국 전화번호 불러드려야 결제 됐고, 적립하시겠냐는 물음이라도 들어야 그나마 적립도 될까 말까예요.  선불카드로 3번 결제해보았는데 1:1문의 남겨서 직접 올려주신 것 포함해서 풀입은 2개, 스탬프는 1개 적립되었네요 그냥 맘편히 가진 카드로 결제하는게 훨씬 빨라요. 갑갑해서 환불요청 드렸습니다",ios
"샐러디 - Eat Better, Be Better",Guinness99,2021-07-27 12:04:30+09:00,1,0,발로 만들었나 로그인은 왜 맨날 해제되는겁까,ios
"샐러디 - Eat Better, Be Better",zineeworld,2021-07-26 11:30:47+09:00,3,0,몇번을 시도해서야 한 참 뒤에 왔어요,ios
"샐러디 - Eat Better, Be Better",마스터호,2021-07-26 11:26:14+09:00,1,0,휴대폰 인증에서 진행이 안됨,ios
"샐러디 - Eat Better, Be Better",wooseojin,2021-07-26 02:59:23+09:00,3,0,"1. 자동 로그인 해제 자동로그인 체크하고 로그인해도 절대 자동로그인 되지 않습니다,, 몇 분 내로 다시 앱 들어오는 거 아니면 무조건 다시 로그인해야 해요. 2. 풀잎, 스탬프가 자동으로 안 오름 선불카드에 충전해놓고 결제중인데, 풀잎이든 스탬프든 자동으로 적립이 되어야 하는데 안 됩니다. 스탬프는 수동으로 다시 찍어야 하고 풀잎은 선불카드 이용에 대한 혜택으로 알고 있는데 그 혜택도 못 보고 있네요 ^^,, 3. 새로 고침 불가 새로 고침을 통해서 스탬프가 찍혔는지 봐야 하는데 새로 고침이 없으니까 그냥 다시 나갔다 들어오는 수밖에 없어요 4. 스탬프 적립 내역 오류 적립내역 들어가보면 쿠폰 발급까지 ~개가 나오는데 그게 남은 개수를 표시하는 게 아니라 내가 가지고 있는 스탬프 개수가 떠요  최대한 빨리 고쳐줬으면 좋겠습니다. 그리고 앱 오류로 인해 적립 받지 못한 풀잎도 제발,, 주세요,,,^^",ios
"샐러디 - Eat Better, Be Better",별명둠칯치칯힝,2021-07-14 12:17:59+09:00,5,0,~,ios
