APP_NAME,USER,DATE,STAR,LIKE,COMMENT,OS
카카오톡 KakaoTalk,별명많구나도란,2022-04-01 12:32:11,1,0,오류수정해주세요,ios
카카오톡 KakaoTalk,가가각다,2022-04-01 11:36:10,4,0,ㅜㅜ,ios
카카오톡 KakaoTalk,❤️‍🔥😳🧡💋❣️,2022-04-01 10:52:40,3,0,"카카오톡 업데이트 이후 카카오톡 선물하기 > 랭킹 부분이 상품보다 리뷰가 눈에 보이니까 선물 고를 때 불편하네요… 이 전에는 카카오톡 선물하기 많이 사용했는데, 불편해서 안 보게됩니다.",ios
카카오톡 KakaoTalk,지니맘마미,2022-04-01 10:48:15,5,0,잘 쓰다가 어느샌가 보니 없어져있네요 ㅠㅠ 착한아이 폰트 다시 업데이트 해주세요,ios
카카오톡 KakaoTalk,강보헤,2022-04-01 03:58:23,4,0,상대방한테도 안뜨게 이 기능 없애주시면 안될까요...? 프사 자주 바꾸기도 민망할지경!^^;,ios
카카오톡 KakaoTalk,Kguksscd,2022-04-01 00:31:59,1,0,"처음엔 리뷰 랭킹이 따로있는줄 알았네요 대체 누구 아이디어인지 이게 승인이된것도 놀랍고ㅜ리뷰 다 비슷비슷한 멘트에 상품은 작아서 보이지도않고 랭킹보면서 요즘 유행하는거, 잘팔리는거 보면서 아이쇼핑도 하고 내가 사서 쓰기도 하고 친구들 선물줄때도 랭킹이 유용했는데 이건 사지 말라는 거 같은데요",ios
카카오톡 KakaoTalk,개시부랄똥,2022-03-31 22:42:38,5,0,"보낸사람 : 내용. 이런식의 예전 카톡이 보고싶습니다  왜 이런 업데이트를 하는걸까요.. 진짜 한 번만 원래대로 해 주시면 안되나요 ..,!!",ios
카카오톡 KakaoTalk,커난ㅋ탸누뉴야투듀져쟌ㄴ,2022-03-31 22:24:43,1,0,좋긴 좋았는데 계속 한 1년에 2~3번 정도 계정을 계속 잃어버렸다고 하네요 결국 초기화 됐습니다,ios
카카오톡 KakaoTalk,gownjdy,2022-03-31 22:08:06,5,0,멀티프로필 기능 너무 좋은데 친구추가를 해야만 사용할 수 있다는게 너무 불편해요 단체톡방에 있는 사람을 다 추가하기도 좀 그런데 단체톡방 안에서 사용할 수 있는 멀티프로필도 생기면 좋겠어요 오픈채팅방처럼!,ios
카카오톡 KakaoTalk,cj34gun,2022-03-31 22:02:04,5,0,탈퇴하려고 보니 계속 탈퇴 안된다고 뜨는데 탈퇴 좀 시켜주세요. 뭔가 오류 난거 같은데,ios
카카오톡 KakaoTalk,이응비,2022-03-31 21:03:55,4,0,아이폰 바탕화면에 카카오톡이 깔려있는데 모르고 바탕화면에서제거 눌렀다가 바탕화면에서 카카오톡이 사라졌는데 다시 바탕화면에 보이게 하려면 어떻게 해야되나요 ㅠㅠ 앱스토어가서 카카오톡들어가도 열기로만 되어있어서 방법좀 알려주세요,ios
카카오톡 KakaoTalk,han희,2022-03-31 20:47:27,5,0,춘식이 카톡 테마 좀 만들어주세여ㅠㅠㅠㅠㅠㅠㅠㅠ,ios
카카오톡 KakaoTalk,ㅎ22222,2022-03-31 18:24:21,5,0,글씨체 더 넣어주세요,ios
카카오톡 KakaoTalk,Hannah White™,2022-03-31 05:40:23,1,1,뭡니까? 오래된 카톡 내용이 자동삭제 되어있고 몇몇 채팅방은 아예 사라져버렸네요. 한두개도 아니고 이게 뭡니까? 알림도 없이 멋대로 지워버리는 기능이 왜 있나요? 덕분에 중요한 내용 많이 날렸습니다. 언제 지워버렸는지 멋대로 해버려서 더 어이가 없네요. 톡서랍 플러스인지 뭔지 만들고 나서 오래된 카톡 자동삭제 기능 넣으신 겁니까? 중요한 내용 다 날려서 참 실망스럽고 화가 납니다. 카톡 점점 업데이트 할수록 ui도 이상해지고 차라리 10년 전 카톡이 더 쓰기 편했습니다. 결제하고 광고 기능만 점점 늘어나는 거 사용자들도 다 압니다. 이모티콘 플러스니 톡서랍 플러스니 결제랑 광고만 우겨넣지 마시고 사용자 의견도 좀 보세요.,ios
카카오톡 KakaoTalk,아ㅓ아울루철,2022-03-31 00:44:08,1,0,뭐만하면 계속 튕기네.. 오류 수정안함??,ios
카카오톡 KakaoTalk,호그와트교장,2022-03-30 23:14:35,5,0,시력이 안 좋은 사람은 카톡 내용을 읽기 힘들어요   아빠가 시력이 많이 안 좋아서 대화를 읽으려면 캡쳐를 하고 그 사진을 확대해서 한 글자 한 글자 읽어야돼요 물론 글자 크기는 가장 크게 설정되어 있죠.. 그러니 대화를 읽어주는 기능이 있으면 좋을 것 같습니다,ios
카카오톡 KakaoTalk,T^T ;;,2022-03-30 22:47:27,5,0,아이패드로 페이스톡 하면 가로 세로 바뀌는데 가로로 할 때도 안 바뀌게 해주세요,ios
카카오톡 KakaoTalk,초희귀종양꼬치,2022-03-30 22:33:12,5,0,ㄹㅇㅋㅋ,ios
카카오톡 KakaoTalk,로블록스 에러 망겜,2022-03-30 22:28:25,1,0,와 랙 실환가 이거 망했네 와 걍 문자를 쓰겠다 이런걸 왜 만들어가지고,ios
카카오톡 KakaoTalk,Aka Amy,2022-03-30 21:51:50,5,0,"지금도 좋지만, 나에게 등록되지 않은 사람에게 공개되는 카톡이 멀티프로필이 될수있게 설정 변경이 가능하면 좋겠어요. 메인 프로필이 뭔가 더 개인 사생활적인건데, 모르는 사람이 번호를 저장하고 카톡을 보내면 불편할때가 있어요.  업데이트시 참고되면 좋겠어요.",ios
카카오톡 KakaoTalk,정또시,2022-03-30 20:34:43,4,0,카카오톡도 스토리 기능이 추가됐으면 좋겠어요ㅠㅠ(인스타나 페북처럼요ㅠㅠ)  나머지는 다 만족하는데 항상 느끼는거거든요 스토리ㅠ 멀티프로필별로 올릴수있으면 좋을것같고 멀티프로필도 그 프로필이랑 상메 예전에 바꿨던거?? 볼수있는 그거 만들어주세용ㅠㅠㅠㅠ,ios
카카오톡 KakaoTalk,아라겨요,2022-03-30 19:53:11,1,0,누구 아이디어로 업데이트한거죠?  랭킹대로 보이지도 않고 특정업체 리뷰로 몰아주기입니까?  상품이 뭔지도 보이지도 않고  선물하기 아이쇼핑 이젠 하지도 못하겠네요?  리뷰보니까 저만 그런게 아닌거 같은데  이게 정말 회의를 거치고 업데이트한 항목이 맞습니까?  원래대로 돌려놓으시죠 빠른시일내에  이럴바엔 네이버쇼핑을 들어가지.,ios
카카오톡 KakaoTalk,딜라잇317,2022-03-30 19:16:50,5,0,멀티프로필 갯수 늘려주시면 좋을것 같아요 모임별로 다르게 설정하고 싶어서요 3개로는 부족해요 추가해 주실꺼죠?? 🙏🙏🙏,ios
카카오톡 KakaoTalk,핑크소리,2022-03-30 15:41:03,5,0,"예전 사각 말풍선도 있었으면 좋겠구요. 말풍선을 사각과 둥근 이렇게 선택하면 좋을거 같은데요, 말풍선 칼라도 좀 몇가지 고르게해주시면 즐거운 카톡생활이 되지않을까 합니다. 노랑둥근 말풍, 이제 지겨워요, 변화없는 테마들도 별루에요",ios
카카오톡 KakaoTalk,rlfwnsdud,2022-03-30 15:05:06,3,0,일반채팅방 별로 프로필 이름 설정 할수 있으면 좋겠네요,ios
카카오톡 KakaoTalk,Heelim51,2022-03-30 07:18:23,3,0,카톡 선물하기 애용했었는데 랭킹에서 보는게 힘들어 졌습니다. 상품사진보다 후기가 더 커서 가시성이 떨어지고 구매욕구가 줍니다.,ios
카카오톡 KakaoTalk,띠이언,2022-03-30 01:09:36,5,0,다 좋은데 추가로 카톡 보낼 때 무음으로 전송할 수 있는 기능이 있었으면 좋겠어요,ios
카카오톡 KakaoTalk,정존버,2022-03-29 23:51:37,1,0,아니 lte만 잡으면 카카오톡 수신 발신 모두 먹통됨. 인터넷 문제인가 했더니 다른거는 잘만 되고 카카오톡만 딱 안됨. 뭐임?,ios
카카오톡 KakaoTalk,whatever150905,2022-03-29 23:48:04,4,0,일러스트 배경화면을 사용할때   노란 읽음 표시가 선명하지 않아  가독성이 매우 떨어지게 됩니다  일러스트 배경별로 읽음표시가  다른 색이면 어떨까 제안합니다.,ios
카카오톡 KakaoTalk,토사요,2022-03-29 21:01:42,5,0,앱은좋은데 업데이트가 너무많아요 ㄹㅇ로 업데이트좀 줄이면 좋을듯,ios
카카오톡 KakaoTalk,정원.,2022-03-29 20:47:27,5,0,멀티 프로필 설정이 필요한데 업데이트를 해도 안떠요 어떡하죠,ios
카카오톡 KakaoTalk,마카롱유니콘,2022-03-29 16:37:02,5,0,개발자님! 늘 열심히 해 주셔서 감사합니다!❤️,ios
카카오톡 KakaoTalk,제토이,2022-03-29 11:28:11,3,0,"⭐️제발 친구목록이랑 채팅방 폴더기능 도입해주세요⭐️ 친구수가 몇백명이 넘어가는데 제발 정리할 수 있게 해주세요 동명이인도 많고 특히 ⭐️단톡방 만들때 한명씩 검색하는 것도 너무 사용성이 떨어집니다⭐️ 제발제발제발 _ 프로필 즐겨찾기&단톡방 즐겨찾기 동시에 한 곳에 다 모아놓으니까 즐겨찾기해도 정리가 안 됩니다! 제발 _ 카톡에서 오픈채팅도 활성화 시키고 계시는 거 잘 알겠구요. 그로 인해 채팅방 수가 엄청나게 늘어나고 있는데 사용자 입장에서 한 번만 제발 생각해주세요 제발.. 카드 뉴스, 피드, 임티 구독, 헤어샵, 홈쇼핑 등 사업 영역 무한정 확장시키기보다 채팅 이용에 최우선으로 기반을 다지고 다음 영역으로 이동하셨으면 좋겠습니다. 제발. plz",ios
카카오톡 KakaoTalk,연승조,2022-03-29 10:16:55,2,0,줌 링크를 카카오톡으로 보내주셨는데 pc 카카오톡과 연동이 되지 않아 회의에 지각했습니다.,ios
카카오톡 KakaoTalk,plentysun,2022-03-29 10:06:05,5,0,"친구 프로필 업데이트 없애주세요..,, 궁금하지도 않은데 뜨고 시간만 허비하게 되는 것 같아요.",ios
카카오톡 KakaoTalk,대한민국만세종,2022-03-28 23:49:05,1,0,어플리케이션 구동하면 2~3초씩 딜레이 걸리네요. Ios문제인지…카톡 개발팀에서 해결 가능하다고 믿습니다ㅎㅎ 응원할게요!,ios
카카오톡 KakaoTalk,ㄱㅈ귻ㅂ드,2022-03-28 20:59:20,1,0,이미지첨부가안되서 진짜 속터져요,ios
카카오톡 KakaoTalk,메라포리,2022-03-28 20:21:39,3,0,카카오콘을 더 쉽게 얻으면 좋겟네염 (잼민이),ios
카카오톡 KakaoTalk,꾸빈꽃 (유튜버),2022-03-28 20:11:08,5,0,말 그대로 다 좋습니당! 프로필 뮤직 여러개로 할 수 있는 기능도 추가하면 좋을 것 같아영,ios
카카오톡 KakaoTalk,제발이거추가해주세요,2022-03-28 19:42:17,5,0,사진으로 답장 보낼수 있게 해주세욥. 그리구 검색한거 보내는건 참 좋은것가타욥.,ios
카카오톡 KakaoTalk,딸 국 질,2022-03-28 18:47:31,3,0,좋타,ios
카카오톡 KakaoTalk,리리뢰,2022-03-28 15:30:21,1,0,후기만 보이고 진짜 드가기싫게 만들어둬서 선물해주기싫어요,ios
카카오톡 KakaoTalk,qywtrw,2022-03-28 15:27:52,4,0,실험실 기능이 바람처럼 나타났다가 사라지는 건 알겠는데 오픈채팅 분리는 언제 다시 나타나나요🥺🥺🥺🥺 13 유저도 분리 해주세요 ㅠㅠㅠㅠ,ios
카카오톡 KakaoTalk,바규민,2022-03-28 14:45:11,1,0,제발요 후기로 뜨는거 너무 불편해요 상품만 떠서 제가 알아서 고를게요  상품잘보이지도 않고 이게 대체 무슨 디자인인지 선물하기 진짜 맨날쓰는데 이건 진짜 아닌것같아요 혹시 알아서 예전디자인으로 바꿀수있는 방법이 있다면 꼭 알려주세요 너무 별로에요 전말 ㅠㅠㅠㅠㅠㅠㅠㅠㅠㅠㅠ,ios
카카오톡 KakaoTalk,를이,2022-03-28 14:28:55,5,0,카카오톡은 정말 잘 사용하고있습니다. 그러나 불편한점이 있어서 리뷰에 남깁니다! 단톡방에 여러명이 있을때 눈치보여서 나가지 못하는 상황이라 누군지 모르게 나가는 것도 만들어 주시면 감사하겠습니다!,ios
카카오톡 KakaoTalk,Young2e2,2022-03-28 14:23:59,3,0,"어제부터 갑자기 알림이 안와서(계속 사용하던 설정 그대로인데) 업뎃하기 싫었지만 업뎃했습니다.   알림은 10에 2개 정도 오는데....  이건 어찌저찌 계속 앱 들어가서 확인한다 치고 이모티콘 플러스가 제대로 사용이 불가합니다.   단어 행복 -> 행복한 이모티콘들이 바로 떠야 하는데 이모티콘 플러스 홈 화면이 뜹니다.   모든 단어들이 마찬가지이고 이러면 이모티콘 플러스 쓰는 의미가 없는데요. 타자를 치면서 그때 그때 필요한 이모티콘을 바로 쓰려고 출시한 이후로 계속 사용중인건데.... 연관성 없는 홈화면이 뜨니 이건 우째 사용하란건지 ㅠㅠ   기종 아이폰XS 업뎃 전 버전 - 9.5.x 업뎃 후 버전 - 9.7.2 증상 - 알림 푸시가 제대로 오지 않음,  이모티콘 플러스의 제대로된 서비스가 되지 않음 (타자치고 옆에 뜨는 이모티콘을 누르면 홈화면으로 돌아감)",ios
카카오톡 KakaoTalk,매직키보드오류,2022-03-28 14:06:44,4,0,"안녕하세요,  아이패드를 매직키보드에 장착하고 카톡을 사용하고 있는데요, 메시지 입력 필드 옆에 +버튼 (첨부 등)을 누르면 매번 앱 밖으로 나가버리는 오류가 있습니다.  어쩌다 잘 누르면 되는데 “대부분” 앱 밖으로 튀어나가 여간 불편한게 아닙니다.  (매직키보드를 빼고 하면 잘 되는 것 같습니다.)  꼭 찾아서 수정 부탁드립니다. ㅠ  감사합니다.",ios
카카오톡 KakaoTalk,굴찡,2022-03-28 12:25:54,1,0,무슨일인가요;;; 담당자 시말서 써야할듯. 상품을 보고싶은거지 후기를 보고싶은건 아닌데요 ㅋ 후기는 우리가 알아서 찾아본다고요,ios
카카오톡 KakaoTalk,아이팟터치6,2022-03-28 08:30:21,4,0,오픈/일반 분리가능하듯이 일반 채팅방 중에서도 분류를 할 수 있었으면 좋겠습니다.,ios
카카오톡 KakaoTalk,princess_chris,2022-03-28 01:42:56,1,0,진짜 0점 주고 싶은데 안되서 하나 줍니다 자꾸 메세지 읽지도 않았는데 읽어지고 보내지지도 않고 계속 튕기고 진짜 별로에요,ios
카카오톡 KakaoTalk,뭘봐아어러로아,2022-03-28 00:51:00,3,0,오픈채팅 포스트에 동영상을 못올린다는 점이 아쉽네요ㅠ,ios
카카오톡 KakaoTalk,ownswest,2022-03-27 23:05:43,1,0,왜 업데이트를 할 수록 이 앱에 불만이 늘어나는지 모르겠네요,ios
카카오톡 KakaoTalk,ㅏㅛ앗뇌,2022-03-27 22:55:26,4,0,버그도 좀 있고 디데이 개수도 늘려 주셨으면 좋겠습니다. 그 외에는 다 너무 좋고 괜찮습니다,ios
카카오톡 KakaoTalk,jenlydhjsv,2022-03-27 22:31:49,5,0,일반 채팅방을 만들었을때 그 채팅방을 만든 사람이 강퇴할수있게 해주세요. 제발ㅠㅠㅠㅠ,ios
카카오톡 KakaoTalk,영민39,2022-03-27 20:31:07,3,0,프사 바꾸고 싶은데 상단 업데이트한 친구에 떠서 남들한테 다 보이는게 너무 싫어서 못바꾸고 있어요 이거 좀 없앨 수 있는 기능 만들어주세요 다들 이 기능 너무 싫어합니다,ios
카카오톡 KakaoTalk,asdfqwertyghvbjui,2022-03-27 18:42:51,1,0,그 대화백업조차도 똑바로 작동안해서 폰에 있던 대화 다 날려먹고 pc카톡에서 다시 백업하는중 그리고 세상에 로그아웃기능이 없어서 지웠다가 깔아야된다니 ㅋㅋㅋㅋㅋ 얼탱이가 없다 그냥,ios
카카오톡 KakaoTalk,아이폰13프로맥스유저,2022-03-27 17:51:36,3,0,나갈때 나가는게 채팅방에 뜨잖아요 그러니까 나가야 하는 방도 나가기 조심스러워서 불편합니다,ios
카카오톡 KakaoTalk,appleuser7083,2022-03-27 17:17:37,5,0,지원 좀 해주세요 .. 제발 업데이트 plz,ios
카카오톡 KakaoTalk,지현이 리뷰❤️,2022-03-27 17:13:23,4,0,카카오톡 다 좋아요 근데 진짜 이것만 고쳐주세요 재가 친구들이랑 페이스톡을 많이하는데 예전부터 계속 저는 친구목소리가 들리는데 친구는 재 목소리가 안들린데요 그래서 몆번이고 나갔다 다시 걸고 해도 안되요 예전에는 가끔씩 그랬는데 요즘은 자주그래요 빨리고쳐주셨음 좋겠습니다,ios
카카오톡 KakaoTalk,지포씌,2022-03-27 15:44:51,5,0,저는 나중에 업데이트가 된다면 3가지가 추가 되었으면 좋겠어요..! 먼저 디데이를 좀 더 늘려 주셨으면 좋겠습니다 5개도 충분히 많지만 저에겐 부족해서요.. 주변 친구들도 디데이가 늘어났으면 좋겠다고 하고..ㅠ 그리고 카톡도 스토리가 생겼으면 좋겠어요.. 마지막 하나는 상대방이 타자를 치고 있다는 걸 알려주는 표시가 생겼으면 좋겠어요 약간 페메 처럼 알려주면 좀 더 좋을 것 같아요,ios
카카오톡 KakaoTalk,숭아쵸코,2022-03-27 11:23:41,4,0,카카오톡을 정말 잘 사용하고 있는 사람입니다.  진짜 정말 다 좋은데 친구 관리에서 바로 삭제할 수 있게 해주세요. 그리고 그 삭제할 때 일일이 한명 한명 하는 것보단 선택해서 삭제할 수 있게 해주세요.  원래 삭제할 땐 (숨김할 사람 누르기 - 숨김 - 숨김에 들어가서 삭제할 사람 누르기 - 삭제) 이렇게 번거롭게 해야 하는데 숨김이랑 차단 있는 메뉴 쪽에 삭제도 넣어주세요 제발 너무 불편해요.  또 일일이 삭제하기 보다는 선택을 해서 한 번에 삭제할 수도 있게 해주시고요 진짜 너무 번거롭고 너무 불편해요   진짜 제발 고쳐주세요ㅠㅠㅠㅠㅠ 이것만 아니면 진짜 정말 좋단 말이에요😭😭,ios
카카오톡 KakaoTalk,히메3034,2022-03-27 09:02:17,1,0,갑자기 아예안되네요 ㅠ,ios
카카오톡 KakaoTalk,어려어어터러러,2022-03-27 02:48:19,5,0,예수천국 불신지옥,ios
카카오톡 KakaoTalk,잘하자 오인격,2022-03-27 01:18:02,1,0,어쩌다가 카톡을 지웠는데 다시 깔려지지가 않아요,ios
카카오톡 KakaoTalk,장징씨,2022-03-27 00:06:30,5,0,일일히 클릭 노노ㅜㅜ 용량커서 정리하고싶은데 넘나 귀찮게되잇굼요,ios
카카오톡 KakaoTalk,불편한 응갈치,2022-03-26 22:48:47,5,0,디데이 횟수를 10개로 해주시면 안됄까요 5개여서 불편하네요..,ios
카카오톡 KakaoTalk,아잎폰에러,2022-03-26 16:11:50,4,0,ㅠㅠ 글씨체 더 업데이트 해주세용.. 간절히..,ios
카카오톡 KakaoTalk,sheiejej,2022-03-26 14:35:15,2,1,원래가 훨씬 보기 편했는데 후기부터 딱 뜨니까 상품 보기도 불편하고 죄다 좋다는 입바른 말이 상단에 뜨니까 솔직히 의미 없어요...,ios
카카오톡 KakaoTalk,빵뽜래,2022-03-26 14:31:44,5,0,잘 쓰고있는데 업데이트를 하라는데 안떠요ㅜㅜ,ios
카카오톡 KakaoTalk,간닌,2022-03-26 11:57:18,5,0,본인 프로필을 3자 입장에서 볼 수 있는 미리보기 기능 있으면 유용할 것 같습니다,ios
카카오톡 KakaoTalk,쿠쿠ㄹ삥 ㅃ🙃🙂,2022-03-26 10:48:06,1,0,아니 이모티콘 많이 보낸다고 정지먹는건 선넘네 카카오톡?,ios
카카오톡 KakaoTalk,러버러뷰러,2022-03-26 09:07:12,1,1,저 이런 리뷰 진짜 귀찮아서 안다는데 신경쓰여서 리뷰 작성합니다 .. 왜있는지 모르겠어요 진짜,ios
카카오톡 KakaoTalk,아니별명어캐하냐,2022-03-26 01:44:33,1,1,카톡 처음화면에 업데이트한 친구뜨는거 진짜 짜증나고 별로에요 다시 원래대로 바꿔주세요 제발.. 너무 신경쓰이고 전이 더 편하고 좋았는데 굳이 왜 하셨는지..,ios
카카오톡 KakaoTalk,알빠100,2022-03-25 23:38:25,4,0,글씨체 중에서 파라솔 그늘 다시 만나들어주세요!! 그 글씨체가 필요해요',ios
카카오톡 KakaoTalk,짜 쯩 낭,2022-03-25 23:14:03,1,0,옾쳇 2인말고 3인도 통화 ㄱㄴ하게 해주셈,ios
카카오톡 KakaoTalk,RH_K,2022-03-25 22:51:20,1,0,폰 알림 소리를 켜놓은 상태에서 카톡만 진동으로 알림을 받고싶어요. 알림에는 소리랑 무음밖에 없어서 폰 전체는 소리를 켜논 상태에서는 진동으로 받을 수 없습니다. 전화 벨소리와 카톡 진동을 동시에 하고싶은데 어떻게 해도 안되네요ㅠ,ios
카카오톡 KakaoTalk,제작자 장난하냐,2022-03-25 21:15:46,2,0,전원이 꺼져서 충전하고 다시 켰는데 카톡 와서 볼려고 하는데 로그아웃 되어 있었어요;; 이게 한두번도 아니고 근데 그때는 로그인 됬는데 이젠 되지도 않아요 ; 버그좀 고쳐주세요 제발,ios
카카오톡 KakaoTalk,카툭,2022-03-25 20:59:04,3,0,"다른 사람들 변경 알림 기능 외 제 프로필 변경했을 때 뜨는 알림 끄는 기능 좀 만들어주세요,,, 이거 생긴 이후로 프로필 변경 하기 너무 부담스럽습니다",ios
카카오톡 KakaoTalk,백업좀 고쳐주세요오오오옹,2022-03-25 20:05:52,5,0,카카오톡을 잘 쓰고 있는 학생입니다  예전부터 컴퓨터와도 연동시키고 번갈아가며 쓰기도 했는데 어느 순간부터 백업을 하면 컴퓨터는 괜찮은데 핸드폰 같은 경우에는 백업을 한 뒤 채팅방에 내용들이 싹 사라져 있고 다시 지웠다가 깔아야 다시 복귀가 됩니다 이 점을 조금만 수정해 줬으면 하네요,ios
카카오톡 KakaoTalk,tdrtfg9212,2022-03-25 18:56:07,1,0,"상품을 봐야지 뭔 후기만 잔뜩 띄어놓으면 먼 상품 후기인지도 몰라요,,,하아 레이어도 너무 정신 사납고, 예전의 라이트한 카톡이 좋앗는데 갈수록 묵직한게 아니고 그냥 무겁기만 해지네요",ios
카카오톡 KakaoTalk,4용중,2022-03-25 13:56:33,5,0,군대가서 카톡 몇 일 못하는 동안 채팅이 다 지워진다는데 이 기능 원하는 사람에 한해서라도 없앨 수 없나요?,ios
카카오톡 KakaoTalk,예민한 여우,2022-03-25 12:57:03,3,0,알림이 왔다가 안 왔다가 하다가 아예 안 울리고 숫자만 쌓여요..  아이폰만 그런건가요? 알림이 안 울려서 중요한 알림도 제때 못 보고 불편해요 빨리 해결됐으면 좋겠어요. 그리고 상대방이 확인했는데 톡 옆에 1도 안 사라져요..,ios
카카오톡 KakaoTalk,천진루이,2022-03-25 12:04:06,4,0,카카오톡 유저로 잘 사용중입니다 이전에 버전은 문제가 있었는지 모르지만  아이폰 이랑 카카오톡 이랑 안맞는건지 잘 되다가도 멈춤 현상이 일어 납니다 안드로이폰은 그런건 없다고  하더라고요  몇개월 된거 같아요 확인 해서 버그 좀 수정해주세요,ios
