APP_NAME,USER,DATE,STAR,LIKE,COMMENT,OS
쿠키런: 오븐브레이크,안녕?꼬마신사 아가씨,2022-04-07 09:01:03,4,0,쿠키런 진짜 너무 재밌어요 캐릭터 모으는맛 뽑는맛 떼탈출 스토리 각기각종 이벤트하는것까지 최근에는 마법사탕도 확률 100이라 개좋고 많이 발전해가고있는 쿠키런을 보고 더 하게되서 그거 따문에 중독성이 강해요 중3인데 공부해야하는데 계속 폰만찾고 쿠키런만 들락날락해욬ㅋ 시간제한도 있는데 계속 요청보내고 중독되서 잠깐 지웠는데 쿠키런 지우니까 할게없어요..그만큼 정말 대단한 쿠키런의 중독 능력 ㅎ,ios
쿠키런: 오븐브레이크,혀어니잉,2022-04-07 03:25:27,1,0,개조ㅈ같네 진짜..,ios
쿠키런: 오븐브레이크,도레ㅣ시라,2022-04-06 23:12:46,5,0,이번 업데이트 이후로 닥터와사비가 조합추천해주면 쿠키랑 보물 둘 다 레벨이 높은 순서대로 그냥 나열되어있더라고요 이거 좀 빨리 고쳐주세요ㅜㅜ 조합추천없으면 못하는 사람입니다..ㅜㅜ,ios
쿠키런: 오븐브레이크,ko3638,2022-04-06 22:26:55,1,0,광고를 우겨넣네 클릭미스로 광고를 보다니 ㅋㅋ,ios
쿠키런: 오븐브레이크,훈이여염,2022-04-06 18:30:44,1,0,너무해요,ios
쿠키런: 오븐브레이크,뚜깡쓰,2022-04-06 13:08:28,2,0,"산쿠키 출시, 기존 쿠키 버프 무한반복. 신쿠키 도전하느라 키우고, 겨우 보상 다 획득하고 나면 챔스에는 버프된 기존 쿠키 때문에 티어는 하락함. 버프된 기존 쿠키 괜찮은것같아 키우려다 보면 어느새 새 쿠키 출시, 또 다른 기존 쿠키 버프. 스트레스 풀려고 게임하는건데 무한 경쟁에 스트리스는 더 받아감. 길드전 우정런 떼탈출 등 모두 의무감으로 하는 숙제같음.",ios
